id,date,class,percent,sentiment,text
0,2009-03-09T17:00:00,increase,0.25,Positive,A netbook Apple would amazing could Apple entry point priced much lower
1,2009-03-09T17:00:00,increase,0.25,Positive,I fan apple carrot ginger smoothies Never tried Italian Parsley Sounds good
2,2009-03-09T17:00:00,increase,0.25,Negative,Praying people going hard time Heading apple
3,2009-03-09T17:00:00,increase,0.25,Positive,Definitely Girls day big apple right alley Need go shopping
4,2009-03-09T17:00:00,increase,0.25,Positive,im drinking sparkling apple cider cup monsters listening random things pandora thinking going driving
5,2009-03-09T17:00:00,increase,0.25,Negative,I really like Apple Mail especially interfaces wtih iCal Address book much easier
6,2009-03-09T17:00:00,increase,0.25,Positive,Thanks ergo sum recommendation They changed RAM handling Apple later
7,2009-03-09T17:00:00,increase,0.25,Negative,Safari 4 trashed system What fuck apple
8,2009-03-09T17:00:00,increase,0.25,Negative,apple snow leopard may drop june 8th best I hold hackintosh bit
9,2009-03-09T17:00:00,increase,0.25,Negative,Ha I forgot drank Cupertino Coolaid It never easy less The Apple Way
10,2009-03-09T17:00:00,increase,0.25,Positive,That Apple store says personally I see
11,2009-03-09T17:00:00,increase,0.25,Negative,I amazed many iPhone cases still sell original 1st generation apple cell phone pink blue black clear still selling
12,2009-03-09T17:00:00,increase,0.25,Positive,Boxer rebellion apple store tonight 1 50 guest list Excited
13,2009-03-09T17:00:00,increase,0.25,Negative,took 4 years rumors Apple release iPhone Wonder long take time around
14,2009-03-09T17:00:00,increase,0.25,Positive,apple aqua
15,2009-03-09T17:00:00,increase,0.25,Negative,u seriously became one Apple stan evangelists us smh
16,2009-03-09T17:00:00,increase,0.25,Positive,Todays Green Smoothie Italian Flat Leaf Parsley Cabbage Water 40 60 Strawberries orange apple pear banana spirulina
17,2009-03-09T17:00:00,increase,0.25,Positive,Dear Apple please add functionality iTunes let easily rearrange app icons thx
18,2009-03-09T17:00:00,increase,0.25,Positive,I would love Apple netbook oversized iPod touch I guess
19,2009-03-09T17:00:00,increase,0.25,Negative,looking forward 5pm run doori never ate red apple ooops
20,2009-03-09T17:00:00,increase,0.25,Negative,apple lot people wont expect
21,2009-03-09T17:00:00,increase,0.25,Negative,The teachers I spoke new Apple server cant use anything intraweb They use wikispaces free sites
22,2009-03-09T17:00:00,increase,0.25,Positive,todays day get yesterdays mac apples making room new hardware unadvertised fire sales older machines
23,2009-03-09T17:00:00,increase,0.25,Negative,But rock apple store got ta hit jamba juice cuz tastes good runnin 2 miles
24,2009-03-09T17:00:00,increase,0.25,Negative,3rd day row Ive apple store ihatemyipod
25,2009-03-09T17:00:00,increase,0.25,Negative,Please oh Apple hear plea mercy serfs
26,2009-03-09T17:00:00,increase,0.25,Negative,Would nice Apple allows Firmware updates using P2P softwares Still brooding slow EDGEs inability upgrade beyond 20
27,2009-03-09T17:00:00,increase,0.25,Positive,partied Apple Hollywood sat If like really rich blond chicks great place good Djs though
28,2009-03-09T17:00:00,increase,0.25,Negative,transition Apple completed PC desks
29,2009-03-09T17:00:00,increase,0.25,Positive,First fruitest Some best trees apple 2nd raised blood pressure 3rd thrill ride
30,2009-03-09T17:00:00,increase,0.25,Positive,Make appleautomator script
31,2009-03-09T17:00:00,increase,0.25,Positive,Rumor Apple Netbook Do think real
32,2009-03-09T17:00:00,increase,0.25,Positive,Lunch Bell Turkey Sandwich apple baked lays water 610
33,2009-03-09T17:00:00,increase,0.25,Positive,watched The Dark Knight last evening tried reading ObjC book zzzz great movie watched HD 60 screen via Apple TV
34,2009-03-09T17:00:00,increase,0.25,Positive,bye apple mail helloooo thunderbird
35,2009-03-09T17:00:00,increase,0.25,Positive,RT Ridin van beet celery carrot apple ginger blueberry raspberry juice
36,2009-03-09T17:00:00,increase,0.25,Negative,Apple make NetBooks I wonder would come low price
37,2009-03-09T17:00:00,increase,0.25,Positive,There seems strong correlation Ducati owners Apple computer owners way around
38,2009-03-09T17:00:00,increase,0.25,Negative,Slow start morning I coffee IV running hardcore Fingers crossed Apple drop reported netbook q3
39,2009-03-09T17:00:00,increase,0.25,Negative,dear apple I buy phone illegal I dont want locked I cant pirate I
40,2009-03-09T17:00:00,increase,0.25,Positive,In mood gooey crunchy warm apple crumble vanilla cream
41,2009-03-09T17:00:00,increase,0.25,Positive,Just uploaded Tap Memory app store Waiting review Apple
42,2009-03-09T17:00:00,increase,0.25,Positive,heading chapel Apple Store
43,2009-03-09T17:00:00,increase,0.25,Positive,good morning apple jacks work
44,2009-03-09T17:00:00,increase,0.25,Negative,There small fly screen proving decidedly distractingthink gorging apple juice sprayed earlier
45,2009-03-09T17:00:00,increase,0.25,Negative,back apple store new iphone hand life good
46,2009-03-09T17:00:00,increase,0.25,Negative,I washed ipod It doesnt work anymore I sorry Hes taking Apple store
47,2009-03-09T17:00:00,increase,0.25,Negative,So kind bags Apple give Paper No bag
48,2009-03-09T17:00:00,increase,0.25,Positive,I wish I could click artists name iTunes taken collection Apples
49,2009-03-09T17:00:00,increase,0.25,Positive,Apple Netbook soon Hmmm
50,2009-03-09T17:00:00,increase,0.25,Negative,Very disappointed discover Raymarine CPU NOT drive cool Apple 20 monitor Nerdvana 2 getting lesscool LG monitor
51,2009-03-09T17:00:00,increase,0.25,Positive,Im eating mangos apple juice
52,2009-03-09T17:00:00,increase,0.25,Positive,Back checking different Apple laptops What
53,2009-03-09T17:00:00,increase,0.25,Negative,theres beautiful new iphone 3G sitting desk nay wont work send back apple wait 2 weeks repair
54,2009-03-09T17:00:00,increase,0.25,Positive,If sun shining get Healing mental health especially blues Gorgeous NC Heading Apple
55,2009-03-09T17:00:00,increase,0.25,Negative,What using I swear Apple Mail especially Data Detectors iCal LDAP support
56,2009-03-09T17:00:00,increase,0.25,Negative,ew pitchfork apple add nasty isnt
57,2009-03-09T17:00:00,increase,0.25,Negative,apple store fancy macbook want one
58,2009-03-09T17:00:00,increase,0.25,Negative,Ive already eaten apple cookie AND sandwich even 11AM yet
59,2009-03-09T17:00:00,increase,0.25,Positive,Apple works seryoso
60,2009-03-09T17:00:00,increase,0.25,Negative,Apple Mail email attached account beware delete account later mail deleted
61,2009-03-09T17:00:00,increase,0.25,Positive,Thanks many interesting things pics Portugal I like Twitter name
62,2009-03-09T17:00:00,increase,0.25,Negative,bagel apple lunch Really wanted wolf chocolate croquante told
63,2009-03-09T17:00:00,increase,0.25,Negative,At apple store
64,2009-03-09T17:00:00,increase,0.25,Negative,Starting snow outside skip Apple Store trip today
65,2009-03-09T17:00:00,increase,0.25,Positive,Every song Fiona Apple published anthem one point another Shes brilliant
66,2009-03-09T17:00:00,increase,0.25,Negative,Apple changes standards include cable like say mini DVI FW 800
67,2009-03-09T17:00:00,increase,0.25,Negative,Does anyone know connect Apple TV TV without using HDMI DVI ok video sound
68,2009-03-09T17:00:00,increase,0.25,Negative,I dont know rent one maybe Apple 14 day returns 30 day staff zero power negotiate
69,2009-03-09T17:00:00,increase,0.25,Negative,Apple IDIOTS charging £30 get new phone sent fault broken
70,2009-03-09T17:00:00,increase,0.25,Negative,Keys starting Apple rumor 1 Make something 2 Talk incessantly 3 find someone makes prototype graphics 4 post
71,2009-03-09T17:00:00,increase,0.25,Positive,loving plate avocado apple soaked almonds I love foods alphafoods
72,2009-03-09T17:00:00,increase,0.25,Positive,mmm applegrapekiwicucumberparsleyginger juice post yoga
73,2009-03-09T17:00:00,increase,0.25,Positive,How belong see Apples Kindle killer iPhone form factor bigger
74,2009-03-09T17:00:00,increase,0.25,Positive,Todays anthem Oh Well Fiona Apple Never song apt Actually I think I country would National Anthem
75,2009-03-09T17:00:00,increase,0.25,Negative,Google 300 Baidu holding Apple around 85
76,2009-03-09T17:00:00,increase,0.25,Positive,An apple themed weekend Mine also fantabulous
77,2009-03-09T17:00:00,increase,0.25,Positive,Nokia opens mobile app arms race vs Apple ZDNet Nokia opens mobile app arms race vs AppleZDNetNokia coming swinging A
78,2009-03-09T17:00:00,increase,0.25,Negative,trying work sync outlook google Apple iphone
79,2009-03-09T17:00:00,increase,0.25,Negative,With Linux incl Android low end Apple high end M feeling squeeze play
80,2009-03-09T17:00:00,increase,0.25,Negative,found apple cinnamon muffin ruining dinner probably
81,2009-03-09T17:00:00,increase,0.25,Positive,RT slowly moving stuff apple mail apple mail really good I use dont like sorting features much
82,2009-03-09T17:00:00,increase,0.25,Positive,hmmm sounds good Whats crunchy part Nuts Apple crunch type
83,2009-03-09T17:00:00,increase,0.25,Negative,Being new Mac userIf I Id go Double Apple
84,2009-03-09T17:00:00,increase,0.25,Positive,Hey PC users If hardware manufacturers shipped stickers PCs would slap cars Or uniquely Apple love
85,2009-03-09T17:00:00,increase,0.25,Positive,Can I help schofe I mac genius apple store
86,2009-03-09T17:00:00,increase,0.25,Negative,David I still mostly wear Apple retail shirts since majority wardrobe
87,2009-03-09T17:00:00,increase,0.25,Negative,Loving Apple Remote app iPod Touch Im changing tracks every 20 seconds hell
88,2009-03-09T17:00:00,increase,0.25,Negative,Problem may well Bluetooth disappeared MacBook Pro Lots posts problem Apple forum
89,2009-03-09T17:00:00,increase,0.25,Positive,Ok thanks Dont think Apple say anything though
90,2009-03-09T17:00:00,increase,0.25,Negative,check nonapple places fix charge less Im surprised apple didnt offer refurb replacement
91,2009-03-09T17:00:00,increase,0.25,Negative,Still waiting apple store Just thinking I need get Dr Who coat Im
92,2009-03-09T17:00:00,increase,0.25,Negative,Big queue Apple Store Several people buying adaptor
93,2009-03-09T17:00:00,increase,0.25,Positive,flylady Love blog Will definitely try recipes starting apple bread tho I google Oleo LOL
94,2009-03-09T17:00:00,increase,0.25,Negative,So I read xls file iPhone Numbers file APPLE WTF
95,2009-03-09T17:00:00,increase,0.25,Positive,ya Apple finally provide promo codes nonUS Those bugs 2 mixed iTunes accounts funny
96,2009-03-09T17:00:00,increase,0.25,Negative,Been using Kindle 2 week Great reading Love cons poor navigation wireless connectivity Would Apple take shot
97,2009-03-09T17:00:00,increase,0.25,Negative,First time Ive asked news Im afraid Perhaps try Apple
98,2009-03-09T17:00:00,increase,0.25,Negative,lithium monitors apple xsan servers clients windows trying first time expectation high
99,2009-03-09T17:00:00,increase,0.25,Negative,Poor apple I meds I get migraines I could send way lol
100,2009-01-20T17:00:00,increase,0.2,Positive,says hey apple make possible two people run itunes windows pc time 2009
101,2009-01-20T17:00:00,increase,0.2,Negative,Sitting floor Cpb lobby eating apple pie watching history happen
102,2009-01-20T17:00:00,increase,0.2,Positive,During My Country Tis Thee thing patriotic I could ask Bald Eagle humping Apple Pie shaped like USA
103,2009-01-20T17:00:00,increase,0.2,Negative,CNN big screen work Apple pie Boulder hot dogs Miami
104,2009-01-20T17:00:00,increase,0.2,Positive,hmmm delicious apple
105,2009-01-20T17:00:00,increase,0.2,Positive,Seems presentation innovation using Apple example So far nothing banking FFZ
106,2009-01-20T17:00:00,increase,0.2,Positive,Breakfast hoy hoy ham eggs apple
107,2009-01-20T17:00:00,increase,0.2,Negative,Steve Jobs Apple Chief Executive
108,2009-01-20T17:00:00,increase,0.2,Positive,loves baseball apple pie President believe
109,2009-01-20T17:00:00,increase,0.2,Positive,I feel like one invited party seeing inaug coverage μblogs today goes fashion golden apple
110,2009-01-20T17:00:00,increase,0.2,Negative,Feeling hungry Big Apple Walked three blocks Sun office morning past Chrysler building Grand Central station
111,2009-01-20T17:00:00,increase,0.2,Positive,Watching inauguration apple store boylston
112,2009-01-20T17:00:00,increase,0.2,Negative,everyone apple store turn appletv tv watch
113,2009-01-20T17:00:00,increase,0.2,Positive,My Happy Inaguration Day apple tastes like sweet change
114,2009-01-20T17:00:00,increase,0.2,Positive,17 us watching together complete potluck goodies We paper cups sparkling apple juice ready toast President Obama
115,2009-01-20T17:00:00,increase,0.2,Positive,You mean MacTalk voice Apple tap
116,2009-01-20T17:00:00,increase,0.2,Negative,Im apple genius many crashes
117,2009-01-20T17:00:00,increase,0.2,Negative,I didnt anything morning read BBC news No idea Maybe Apple wired OS X automatically
118,2009-01-20T17:00:00,increase,0.2,Positive,They keep calling National Mall I dont see Orange Julius Spencer Gifts let alone Apple Store Sunglass Hut
119,2009-01-20T17:00:00,increase,0.2,Negative,Where closest Apple store Lausanne Would faster
120,2009-01-20T17:00:00,increase,0.2,Positive,Ate 2 cinnamon rolls chocolate milk breakfast went apple make feel better
121,2009-01-20T17:00:00,increase,0.2,Positive,apple crisp granola taste good
122,2009-01-20T17:00:00,increase,0.2,Positive,Reminiscing I remember giving Apple Newton curator St Petersburg Museum use abstractlanguage art piece
123,2009-01-20T17:00:00,increase,0.2,Negative,Wow Tried download ustream client Apple App Store App Store looks frozen
124,2009-01-20T17:00:00,increase,0.2,Positive,could really use latte apple fritter
125,2009-01-20T17:00:00,increase,0.2,Negative,No I want Apple update OS No I want Time Machine back Stop interrupting stream
126,2009-01-20T17:00:00,increase,0.2,Positive,finishing first presentation MSSQL 2008 DBA Training Apples Keynote iWork09 Pretty cool app
127,2009-01-20T17:00:00,increase,0.2,Positive,hold see Apple logo
128,2009-01-20T17:00:00,increase,0.2,Negative,nvm eff anyone point direction live txtbased feed event la Apple keynotes CES
129,2009-01-20T17:00:00,increase,0.2,Positive,Moved BoxeeApple TV Web watching inauguration plain ol TV POTV For stuff like works great
130,2009-01-20T17:00:00,increase,0.2,Negative,Oh boy Apple events inaugurations You cant escape At least twitter
131,2009-01-20T17:00:00,increase,0.2,Negative,Apple expensive works well
132,2009-01-20T17:00:00,increase,0.2,Positive,Michelles gloves classy Apple green I believe
133,2009-01-20T17:00:00,increase,0.2,Negative,Got cider apple bar Nothing compares Off mtg hope goes better last weeks
134,2009-01-20T17:00:00,increase,0.2,Negative,My courier delivery show Apple regent st emergency purchase job tomorrow
135,2009-01-20T17:00:00,increase,0.2,Positive,Just wee apple pie listening Obama inauguration background Could I American
136,2009-01-20T17:00:00,increase,0.2,Negative,upstairs right outside apple storethey ahve projector
137,2009-01-20T17:00:00,increase,0.2,Negative,Apple keeps deleting forum posts stating webmail sucks
138,2009-01-20T17:00:00,increase,0.2,Negative,get apple time machine easy transition
139,2009-01-20T17:00:00,increase,0.2,Negative,Obama going president I downed whole jar apple sauce hair pretty I feel twitterblitz coming JUMP KICKS
140,2009-01-20T17:00:00,increase,0.2,Positive,mexican veggie use ti alot salsas etc like cross potato apple
141,2009-01-20T17:00:00,increase,0.2,Negative,Did anything special steps apply pre Apple Tv 22 software update
142,2009-01-20T17:00:00,increase,0.2,Negative,While getting email Apple Repair Center started fix MacBook pro inauguration begin
143,2009-01-20T17:00:00,increase,0.2,Negative,go apple stote Btown They help They square
144,2009-01-20T17:00:00,increase,0.2,Negative,I think graphics chip dropped Apple service shop morning repair Got ta love 3 year warranties
145,2009-01-20T17:00:00,increase,0.2,Negative,wish could run background Wish Apple would allow programs
146,2009-01-20T17:00:00,increase,0.2,Positive,nice profile image nice fiona apple song
147,2009-01-20T17:00:00,increase,0.2,Negative,29900 500 GB 49900 TB They wireless also wireless router Apple rocks
148,2009-01-20T17:00:00,increase,0.2,Positive,Weve got apple pie office jion inaug09 spirit
149,2009-01-20T17:00:00,increase,0.2,Negative,watching coverage Apple iTouch via USTREAM well Mac via CNN Remember Cisco plumbing behind
150,2009-01-20T17:00:00,increase,0.2,Positive,done little reading check marks daily apple often like ideas eating want healthy way stay lean
151,2009-01-20T17:00:00,increase,0.2,Negative,Apples stock seem excited Obama everyone else Bummer
152,2009-01-20T17:00:00,increase,0.2,Positive,Glad able witness inauguration Barack Obama wish Apple would make sound controls OSX work better P
153,2009-01-20T17:00:00,increase,0.2,Positive,recovering brash attempt combine Cracklin Oat Bran Cinnamon Crunch Total Apple Cinnamon Cheerios Toomuchcinnamon
154,2009-01-20T17:00:00,increase,0.2,Negative,Slideshare truly blows away every time I view presentation Its got works feel apple products
155,2009-01-20T17:00:00,increase,0.2,Positive,I also food inspired celebrate inaug09 Apple pie last night Will pu cupcake gauntlet get baking
156,2009-01-20T17:00:00,increase,0.2,Positive,I bet thought got Apple
157,2009-01-20T17:00:00,increase,0.2,Negative,apple sauce cinnamon rice flour stivea They werent bad A little sticky though
158,2009-01-20T17:00:00,increase,0.2,Positive,take bath get high apple lol national
159,2009-01-20T17:00:00,increase,0.2,Negative,new update says reinstall fix problem v14 update approved Apple
160,2009-01-20T17:00:00,increase,0.2,Negative,It guess people take gloves use iPhone pissed Apple Those poor people DC suffering
161,2009-01-20T17:00:00,increase,0.2,Positive,Fried eggs apple cider UK Office Good morning
162,2009-01-20T17:00:00,increase,0.2,Negative,RIM And Microsoft look releasing AppleLike Application Stores OSes I hope still grab apps places
163,2009-01-20T17:00:00,increase,0.2,Negative,got ipod touch pessy thinking writing apps apple steal 30 w0000p cool thou
164,2009-01-20T17:00:00,increase,0.2,Negative,I agree I dont think large company heavily dependent CEO identity success Apple
165,2009-01-20T17:00:00,increase,0.2,Negative,Is back big apple gotten grieving Ravens hey pitchers catchers report little three weeks
166,2009-01-20T17:00:00,increase,0.2,Positive,brother trying convert apple sony discounts tempting
167,2009-01-20T17:00:00,increase,0.2,Positive,like said bring em list delete option seems obvious feature apple implement
168,2009-01-20T17:00:00,increase,0.2,Negative,Cox Apple 35 cals
169,2009-01-20T17:00:00,increase,0.2,Positive,wondering got boxee running newest version apple tv
170,2009-01-20T17:00:00,increase,0.2,Negative,zero interest apples desktop os would buy iphone based tablet right interface nice
171,2009-01-20T17:00:00,increase,0.2,Negative,Do think apple store would take iPhone apart get rid dust screen Its driving crazy
172,2009-01-20T17:00:00,increase,0.2,Positive,Next Inning Technology Research Previews Earnings Apple Google Nokia Cree Source PR Newswire
173,2009-01-20T17:00:00,increase,0.2,Positive,Ive jicama kind like applepotato theyre great salads
174,2009-01-20T17:00:00,increase,0.2,Positive,inauguration watching full swingwe got apple pie red white blue fruit pizza lunch smoke daddyyummmm
175,2009-01-20T17:00:00,increase,0.2,Negative,Thats partly great phone Apple make slideout keyboard
176,2009-01-20T17:00:00,increase,0.2,Positive,Dude Im tellin ya roads perfect smooth like Apple built skeeball ramp
177,2009-01-20T17:00:00,increase,0.2,Negative,Apple stalling video capturestreaming No vid bettery battery specs b Apple Qik
178,2009-01-20T17:00:00,increase,0.2,Negative,Wanker security man threw Apple Store today DICK
179,2009-01-20T17:00:00,increase,0.2,Negative,Got computer back Apple care covered everything free
180,2009-01-20T17:00:00,increase,0.2,Negative,Apple Xcode got useless error Friday tried today worked problem
181,2009-01-20T17:00:00,increase,0.2,Positive,Just like Apple product
182,2009-01-20T17:00:00,increase,0.2,Negative,Yeah I really wonder Apple doesnt allow video capturestream recording
183,2009-01-20T17:00:00,increase,0.2,Negative,I fear I may turn apple
184,2009-01-20T17:00:00,increase,0.2,Positive,Shift apple 4 really useful shortcut I know Thanks
185,2009-01-20T17:00:00,increase,0.2,Negative,This apple smells like excreted aging monkey colon disease I think Id better wash
186,2009-01-20T17:00:00,increase,0.2,Positive,oohi heard Jicama like cross apple potato
187,2009-01-20T17:00:00,increase,0.2,Negative,Apple reports quarterly earnings Wed looking like going tad lower expected according
188,2009-01-20T17:00:00,increase,0.2,Negative,Idea Apple may switched higherbitrate iTunes Plus drive customers expensive highercapacity iPods
189,2009-01-20T17:00:00,increase,0.2,Positive,gambling Apple better capitalisation RBS Or expecting instant Obama feel good bounce
190,2009-01-20T17:00:00,increase,0.2,Negative,apple guess
191,2009-01-20T17:00:00,increase,0.2,Negative,Ustream downloaded Apple Store Now I need wifi bus Id golden Stream inaug09 iPhone video
192,2009-01-20T17:00:00,increase,0.2,Positive,The way gets implemented gon na marketshaker Im sure Apple watching closely loading sleeves Haha
193,2009-01-20T17:00:00,increase,0.2,Negative,apple external drive
194,2009-01-20T17:00:00,increase,0.2,Positive,Apple breaks fresh session lows dips probe NovJan52wk range low 7914
195,2009-01-20T17:00:00,increase,0.2,Negative,Im glad Ustream app wish apple would alowed 3G everything
196,2009-01-20T17:00:00,increase,0.2,Positive,Watching Obama Apple TV via Boxee At 12 pm I longer pay gas school house W00t
197,2009-01-20T17:00:00,increase,0.2,Positive,Twitter crazy slow today Am I believe universe loves Apple enlightened enough twitter inauguration Wo
198,2009-01-20T17:00:00,increase,0.2,Positive,Probably roast pork n apple sauce sarnie since I deliberately chose HUGE piece pork Sundays roast dinner
199,2009-01-20T17:00:00,increase,0.2,Negative,apple stock falling I think Steve Jobs taking medical leave
200,2008-04-15T17:00:00,increase,0.17,Negative,Firmware del Apple Wireless Keyboard Actualizado De momento las teclas siguen tal cual han aparecido pantallitas OLED
201,2008-04-15T17:00:00,increase,0.17,Negative,At working drinking apple piss
202,2008-04-15T17:00:00,increase,0.17,Negative,At work drinking apple pee
203,2008-04-15T17:00:00,increase,0.17,Positive,eating apple
204,2008-04-15T17:00:00,increase,0.17,Negative,Going order one new thin quiet apple keyboards She types like hail storm tin roof
205,2008-04-15T17:00:00,increase,0.17,Negative,Apple bloatware 500MB iPodSoftwareUpdater drive Buhbye Delete
206,2008-04-15T17:00:00,increase,0.17,Positive,It looks like subscribe Apples blackcostsmore thought huh Jeez
207,2008-04-15T17:00:00,increase,0.17,Negative,I experiencing severe technolust Apple iTouch What say Should I give
208,2008-04-15T17:00:00,increase,0.17,Positive,lol got ta love new Apple smell
209,2008-04-15T17:00:00,increase,0.17,Negative,apple cinnamon rice cakes pretty good bad ill hungry 65 minutes
210,2008-04-15T17:00:00,increase,0.17,Negative,Lol Got Apple Keyboard 2wks ago cant say Ive tried smelling Love tho lol
211,2008-04-15T17:00:00,increase,0.17,Negative,Roxio Crunch Physical Roxio Crunch Physical3999Roxio Crunch essential video converter Apple TV
212,2008-04-15T17:00:00,increase,0.17,Negative,Roxio Crunch Download Roxio Crunch Download3999Roxio Crunch essential video converter Apple TV
213,2008-04-15T17:00:00,increase,0.17,Negative,So cheapest place Apple bluetooth KB mighty mouse Anybody know
214,2008-04-15T17:00:00,increase,0.17,Negative,Antsy Ate yogurt apple Want get outside Must run free
215,2008-04-15T17:00:00,increase,0.17,Positive,That sounds good Very nice Apple
216,2008-04-15T17:00:00,increase,0.17,Positive,Im girl would change name become foreign apple picker falls weak knees Jose matador fun
217,2008-04-15T17:00:00,increase,0.17,Negative,The Apple Keyboard Firmware update seems fixed squeaky tab key issue hmmmm
218,2008-04-15T17:00:00,increase,0.17,Positive,dont apple sue Psystar could open antitrust suits Apple
219,2008-04-15T17:00:00,increase,0.17,Negative,Enjoying sunshine apple slicer fact theres light end tunnel And tunnel aint long either
220,2008-04-15T17:00:00,increase,0.17,Negative,Facebook deleted Apple Inc fan page
221,2008-04-15T17:00:00,increase,0.17,Negative,Good news Apple They allow reload music I ever bought
222,2008-04-15T17:00:00,increase,0.17,Positive,petes coffee Burlingame Next Apple store free wifi Nice combo
223,2008-04-15T17:00:00,increase,0.17,Negative,noticing apple didnt list iPod list
224,2008-04-15T17:00:00,increase,0.17,Negative,Suffering due lack sleep Not helpful teaching class Especially class challenging Apple SE
225,2008-04-15T17:00:00,increase,0.17,Negative,Thanks Apple iPhone problem Swap new phone Restore backup Im right back I like never happened
226,2008-04-15T17:00:00,increase,0.17,Negative,I dont think I Apple Hardware Test located
227,2008-04-15T17:00:00,increase,0.17,Negative,TORX Phillips head Powerbook back Apple Store new logic board increased 1 GB memory I US
228,2008-04-15T17:00:00,increase,0.17,Negative,sitting couch folding laundry watching Larry Boy Bad Apple
229,2008-04-15T17:00:00,increase,0.17,Negative,Aargh Another brushoff Apple We currently reviewing applications iPhone Developer Programs contact soon
230,2008-04-15T17:00:00,increase,0.17,Negative,went sheesha bar last night went home feeling dizzy cappucino apple lemon flavored sheesha try next time
231,2008-04-15T17:00:00,increase,0.17,Negative,At home upgrading Apple TV
