id,date,class,percent,sentiment,text
682,2013-11-05T17:00:00,neutral,0.01,Positive,I remember playing football chiller apple exploded haha
683,2013-11-05T17:00:00,neutral,0.01,Positive,I dont like toffee I want toffee apple Okay makes sense BonfireNightProblems
684,2013-11-05T17:00:00,neutral,0.01,Negative,And Apple decides release iPhone 5s iPhone 5c
685,2013-11-05T17:00:00,neutral,0.01,Negative,This Soup And Apple Cider gtgtgtgtgtgtgtgt
686,2013-11-05T17:00:00,neutral,0.01,Positive,What favorite applecentric Fall dish Well RT favorites extra points going link recipes
687,2013-11-05T17:00:00,neutral,0.01,Positive,Apple peanut butter life 👅💦🍏
688,2013-11-05T17:00:00,neutral,0.01,Positive,try twinnings apple crunch tea milk sugar drinkable
689,2013-11-05T17:00:00,neutral,0.01,Positive,Win new Apple iPad Experience Advertising Sweepstakes
690,2013-11-05T17:00:00,neutral,0.01,Negative,Lol sounds depressing Im sorry yeah fu apple ruined day I woke CutsforBieber
691,2013-11-05T17:00:00,neutral,0.01,Positive,told Apple probably intensive video castingI thought macs could handle I know u screencast
692,2013-11-05T17:00:00,neutral,0.01,Negative,iOS 6 mountain lion Tsk tsk apple
693,2013-11-05T17:00:00,neutral,0.01,Positive,My RAW STAR CAFE Specials Today 25 Sampler 3 Entrees Eggplant Apple Cinnamon Stuffing Pumpkin Soup Sweet Potato Pie
694,2013-11-05T17:00:00,neutral,0.01,Negative,Why Apple hasnt opened iBooks Android yet beyond They would opening new revenue opportunities wouldnt
695,2013-11-05T17:00:00,neutral,0.01,Negative,RT How Apple sell LTE iPad huge Retina display 629 iPhones start 649 WTF
696,2013-11-05T17:00:00,neutral,0.01,Negative,RT How Apple sell LTE iPad huge Retina display 629 iPhones start 649 WTF
697,2013-11-05T17:00:00,neutral,0.01,Negative,Tori sprayed perfume killing rest table I taste Vermont Honey Apple instead lunch
698,2013-11-05T17:00:00,neutral,0.01,Positive,Yo Im hot bothered astronaut crashin Jackin bufferin vids Asher Roth eatin apple sauce
699,2013-11-05T17:00:00,neutral,0.01,Positive,RT Im completely covered love 😍❤️
700,2017-03-27T17:00:00,neutral,0.01,Positive,When 4G service start apple devices puneCould provide date please
701,2017-03-27T17:00:00,neutral,0.01,Negative,Apple Pen
702,2017-03-27T17:00:00,neutral,0.01,Positive,RT Search Ice Billion Berg iTunesApple Music Spotify Tidal amp Google Play
703,2017-03-27T17:00:00,neutral,0.01,Positive,RT good apple too😇
704,2017-03-27T17:00:00,neutral,0.01,Negative,RT Is anyone else issues registering WWDC17 WWDC Apple
705,2017-03-27T17:00:00,neutral,0.01,Positive,RT Dear I say dont show message I mean DONT SHOW ME THIS MESSAGE AGAIN
706,2017-03-27T17:00:00,neutral,0.01,Positive,RT official Apple released iOS 103 Everyone Worldwide💥Jailbreakers Stay AWAY
707,2017-03-27T17:00:00,neutral,0.01,Negative,Just first Apple Pay transaction Ive never felt alive
708,2017-03-27T17:00:00,neutral,0.01,Negative,2am Apple juice instrumentals 🙏🏾
709,2017-03-27T17:00:00,neutral,0.01,Negative,Ever I continue circling nothing hate carousel agony Bad Apple
710,2017-03-27T17:00:00,neutral,0.01,Negative,RT The sound someone biting apple really infuriates 😖
711,2017-03-27T17:00:00,neutral,0.01,Negative,ios 103 released
712,2017-03-27T17:00:00,neutral,0.01,Negative,iOS 103 Finally released AppleQuite like Jailbreak avoiding like Arsenal avoid making title challenge
713,2017-03-27T17:00:00,neutral,0.01,Positive,comparison Always comparison Apple vs Apple
714,2017-03-27T17:00:00,neutral,0.01,Negative,Apple update day
715,2017-03-27T17:00:00,neutral,0.01,Negative,The IC seems find workarounds lot Can ’ remember ultimate outcome IC demands Apple security keys
716,2017-03-27T17:00:00,neutral,0.01,Positive,Do mean like Apple Android Pay usage
717,2017-03-27T17:00:00,neutral,0.01,Positive,Apple Music execs get IT Well said Iovine
718,2017-03-27T17:00:00,neutral,0.01,Negative,But moms weave looks horrible soapple doesnt fall far nappy tree
719,2017-03-27T17:00:00,neutral,0.01,Negative,RT Much like Apple products I also compatible
720,2017-03-27T17:00:00,neutral,0.01,Negative,Is anyone else issues registering WWDC17 WWDC Apple
721,2017-03-27T17:00:00,neutral,0.01,Negative,ios 103 Im way Im actually updating iPhone 7 thank wait SO long got ta worth 💯🙏🏽📱
722,2017-03-27T17:00:00,neutral,0.01,Negative,Apple Crumble tupperware box next day Oh My God foodheaven
723,2017-03-27T17:00:00,neutral,0.01,Positive,Keep good times flowing canvas wine tote easily stashes bottle two Colors black red bright pink apple
724,2017-03-27T17:00:00,neutral,0.01,Negative,The dad trying fix phone Apple Store gives life Hes sweet Be dad wtf
725,2017-03-27T17:00:00,neutral,0.01,Positive,RT Apples claim fixed vulnerabilities described DARKMATTER duplicitous EFI systemic problem n…
726,2017-03-27T17:00:00,neutral,0.01,Positive,Girl could hand core apple Id like Yes thank much 😭😭😭
727,2017-03-27T17:00:00,neutral,0.01,Positive,RT official Apple released iOS 103 Everyone Worldwide💥Jailbreakers Stay AWAY
728,2017-03-27T17:00:00,neutral,0.01,Positive,RT official Apple released iOS 103 Everyone Worldwide💥Jailbreakers Stay AWAY
729,2017-03-27T17:00:00,neutral,0.01,Positive,RT Apple juice Orange Juice
730,2017-03-27T17:00:00,neutral,0.01,Positive,RT favorite guy dictating shopping list Apple Watch whilst shopping Short term memory mu…
731,2017-03-27T17:00:00,neutral,0.01,Positive,I want Apple pie Burger King
732,2017-03-27T17:00:00,neutral,0.01,Positive,Apple Releases watchOS 32 With Theater Mode SiriKit
733,2017-03-27T17:00:00,neutral,0.01,Positive,Apple Releases iOS 103 With Find My AirPods APFS App Store Review Tweaks More
734,2017-03-27T17:00:00,neutral,0.01,Negative,If I spent much time studying I spent untangling apple headphones I would 70
735,2017-03-27T17:00:00,neutral,0.01,Negative,urgency ever help loyal long term customer unbelievable much time energy money lost
736,2017-03-27T17:00:00,neutral,0.01,Positive,Apple Releases iOS 103 With Find My AirPods APFS App Store Review Tweaks More
737,2017-03-27T17:00:00,neutral,0.01,Negative,RT Claims circulated CIA hacking tools dont work newer Apple products false There many Apple attacks Va…
738,2017-03-27T17:00:00,neutral,0.01,Negative,Apple bees😂😂😂
739,2017-03-27T17:00:00,neutral,0.01,Negative,RT Today I went Apple Store get MacBook fixed I walked new iPhone MacBook still broke
740,2017-03-27T17:00:00,neutral,0.01,Negative,Apple unleashed iOS103 14E277 OTA iPhone iPad series🖖
741,2017-03-27T17:00:00,neutral,0.01,Negative,apple music bugs
742,2017-03-27T17:00:00,neutral,0.01,Positive,Apple Music gtgtgt
743,2017-03-27T17:00:00,neutral,0.01,Positive,Slow Ride Monday specials699 Meatloaf Dinner325 Sam Adams bottles450 Crown Royal Apple Vanilla
744,2017-03-27T17:00:00,neutral,0.01,Negative,Apple Stock Price 14096 apple AAPL
745,2017-03-27T17:00:00,neutral,0.01,Positive,Announcing newest apple product The iSIS Our first ever automated sister complete favorite sister traits need
746,2017-03-27T17:00:00,neutral,0.01,Positive,Id like visit Apple Isle
747,2017-03-27T17:00:00,neutral,0.01,Positive,RT official Apple released iOS 103 Everyone Worldwide💥Jailbreakers Stay AWAY
748,2017-03-27T17:00:00,neutral,0.01,Positive,I would love apple clafouti recipe lt3
749,2017-03-27T17:00:00,neutral,0.01,Positive,Read Apple Watch
750,2017-03-27T17:00:00,neutral,0.01,Positive,Talked guy works Apple Gave hope bill passes ways protect info follow Q reliable
751,2017-03-27T17:00:00,neutral,0.01,Positive,includes champagne wine martinis favorite foods anyways theres filet mignon emoji
752,2017-03-27T17:00:00,neutral,0.01,Negative,Hi Apple AirPort compatible modem If DM full address phone I take look SD
753,2017-03-27T17:00:00,neutral,0.01,Negative,RT yuppp candy apple gone long gone 😂😂😂😂
754,2017-03-27T17:00:00,neutral,0.01,Negative,Words never want hear chorister Im sure I feel Adams apple 🍎 🍏 🙊🙊
755,2017-03-27T17:00:00,neutral,0.01,Positive,RT official Apple released iOS 103 Everyone Worldwide💥Jailbreakers Stay AWAY
756,2017-03-27T17:00:00,neutral,0.01,Negative,A collective breath anxiety apple migrate iOS devices new file system could go right massively wrongapple
757,2017-03-27T17:00:00,neutral,0.01,Negative,one near unusable nonuser friendly widespread pieces software going How could Apple make bad
758,2017-03-27T17:00:00,neutral,0.01,Negative,This morning I forgot A salad I going lunchB apple I going eat snack C take meds
759,2017-03-27T17:00:00,neutral,0.01,Negative,RT Apple released 3 new iOS OTA Firmwares iOS 90 Build 14V249 iOS 32 Build 14V249 iOS 32 Build 14V6249
760,2017-03-27T17:00:00,neutral,0.01,Negative,RT Apple released 3 new iOS OTA Firmwares iOS 99103 beta Build 14E6277 iOS 99103 Build 14E277 iOS 103 Bui…
761,2017-03-27T17:00:00,neutral,0.01,Positive,RT official Apple released iOS 103 Everyone Worldwide💥Jailbreakers Stay AWAY
762,2017-03-27T17:00:00,neutral,0.01,Negative,bro dont even get started older iPhones fast die Apple drops new iOS 😡
763,2017-03-27T17:00:00,neutral,0.01,Negative,RT Claims circulated CIA hacking tools dont work newer Apple products false There many Apple attacks Va…
764,2017-03-27T17:00:00,neutral,0.01,Positive,also pretty sure theres addiction lvling weapons game finding apple eden gourd
765,2017-03-27T17:00:00,neutral,0.01,Negative,Spotify unfortunately Apple Music moment
766,2017-03-27T17:00:00,neutral,0.01,Negative,RT Apple released 3 new iOS OTA Firmwares iOS 99103 beta Build 14E6277 iOS 99103 Build 14E277 iOS 103 Bui…
767,2017-03-27T17:00:00,neutral,0.01,Negative, apple released 103
768,2017-03-27T17:00:00,neutral,0.01,Positive,RT Im surprised iPhone users buy data like us youd think Apple would make special iData purchased…
769,2017-03-27T17:00:00,neutral,0.01,Negative,Break apple said PCs better said Its less 24 hours Im two glitches away loosing shit
770,2017-03-27T17:00:00,neutral,0.01,Positive,enjoy big apple
771,2017-03-27T17:00:00,neutral,0.01,Negative,Apparently left laptop full brightness I sorry everyone sitting behind theyareallblindnow imsosorry apple
772,2017-03-27T17:00:00,neutral,0.01,Negative,Right seemed strongest 90s Apple little weak
773,2017-03-27T17:00:00,neutral,0.01,Positive,RT official Apple released iOS 103 Everyone Worldwide💥Jailbreakers Stay AWAY
774,2017-03-27T17:00:00,neutral,0.01,Positive,using samsungappleandroid pay
775,2017-03-27T17:00:00,neutral,0.01,Negative,Apple Juice 💜💍😻
776,2017-03-27T17:00:00,neutral,0.01,Positive,RT official Apple released iOS 103 Everyone Worldwide💥Jailbreakers Stay AWAY
777,2017-03-27T17:00:00,neutral,0.01,Positive,2017 Goal Bake apple pie scratch even crisscross crust top 😋
778,2017-03-27T17:00:00,neutral,0.01,Negative,yuppp candy apple gone long gone 😂😂😂😂
779,2017-03-27T17:00:00,neutral,0.01,Positive,OMG Im happy shopping trip New York booked I cant believe Ive got week selfie whilst theyre big apple
780,2017-03-27T17:00:00,neutral,0.01,Negative,coming iOSApple Store
781,2017-03-27T17:00:00,neutral,0.01,Positive,The apple symbol love The Celts believed apple represented love lasted long picked love
782,2017-03-27T17:00:00,neutral,0.01,Positive,I saw someone pay bus Apple Watch cool tech
783,2017-03-27T17:00:00,neutral,0.01,Negative,official Apple released iOS 103 Everyone Worldwide💥Jailbreakers Stay AWAY
784,2017-03-27T17:00:00,neutral,0.01,Negative,I really hope keeps ProductRed iPhone starting color option iPhone8 iPhone8Red
785,2017-03-27T17:00:00,neutral,0.01,Negative,Love MyFitnessPal synch data w apple fitness apple health Is app
786,2017-03-27T17:00:00,neutral,0.01,Positive,RT If dont Apple Music youre messing massive way
787,2017-03-27T17:00:00,neutral,0.01,Negative,If havent realized Apple releases new iPhone every fucking fall idiot
788,2017-03-27T17:00:00,neutral,0.01,Positive,A thank Apple lt3
789,2017-03-27T17:00:00,neutral,0.01,Negative,I need gbc dudes put sht apple music
790,2017-03-27T17:00:00,neutral,0.01,Positive,👉Position matters 7 Apple Rs170 Apple 7 Rs70000
791,2017-03-27T17:00:00,neutral,0.01,Positive,plot theres guy book kill people also lanky guy apple theres also guy never sits
792,2017-03-27T17:00:00,neutral,0.01,Negative,Apple Bees Waiter wan na suck I Kno it❗😂
793,2017-03-27T17:00:00,neutral,0.01,Positive,Yet create millions jobs If want complain look liberal apple Microsoft
794,2017-03-27T17:00:00,neutral,0.01,Positive,make apple music playlist
795,2017-03-27T17:00:00,neutral,0.01,Negative,Why send Apple phone fix never get back I thought considered stealing
796,2017-03-27T17:00:00,neutral,0.01,Negative,Apple eye 🔥🔥
797,2017-03-27T17:00:00,neutral,0.01,Negative,I think Id Apple Jacks somewhere
798,2017-03-27T17:00:00,neutral,0.01,Negative,Apple doesnt fall far tree
799,2017-03-27T17:00:00,neutral,0.01,Positive,like I DO I dont know apple music got information
800,2011-12-06T17:00:00,neutral,0.01,Negative,An apple day keeps doctor away
801,2011-12-06T17:00:00,neutral,0.01,Positive,Whats breakfast Water first Then org granny smith apple A bit later green vibrance greens powder mixed org Vanilla almond milk
802,2011-12-06T17:00:00,neutral,0.01,Positive,NeverTrustAGirlThat Adams Apple
803,2011-12-06T17:00:00,neutral,0.01,Positive,apple store people usually happy oblige But youre tweeting must 90 done anyway
804,2011-12-06T17:00:00,neutral,0.01,Negative,Apple refurbished 2010 11 ″ 128GB MacBook Air available 799
805,2011-12-06T17:00:00,neutral,0.01,Negative,Apple Slippin Giving Me A 283 GB When I Ordered 32 Whats That
806,2011-12-06T17:00:00,neutral,0.01,Positive,NeverTrustAGirlThat bigger Adams Apple u ltlt bigger arms lmao
807,2011-12-06T17:00:00,neutral,0.01,Negative,Apple doesnt fall far dear
808,2011-12-06T17:00:00,neutral,0.01,Positive,RT When I reach 4000 Followers Ill giving away 3 x Apple IPod Shuffles U choose Colour FOLLOW RT
809,2011-12-06T17:00:00,neutral,0.01,Negative,RT I thirsty I want apple juice crazy straw
810,2011-12-06T17:00:00,neutral,0.01,Positive,lighting apple cinnamon creamy custard scented candles gettingintheholidayspirit
811,2011-12-06T17:00:00,neutral,0.01,Positive,Hey guess long Apples laptop second time A week How many times called
812,2011-12-06T17:00:00,neutral,0.01,Negative,omg omg omg dont apple flavor Wat I InAisleFreakOut
813,2011-12-06T17:00:00,neutral,0.01,Positive,Feels like apple blossom weather Christmas
814,2011-12-06T17:00:00,neutral,0.01,Negative,So apple pie tried 2 charge almost 45 update software kmsl I cursed bitches lt lol str8 GHETTO
815,2011-12-06T17:00:00,neutral,0.01,Negative,NeverTrustAGirlThat Still wears Apple Bottom
816,2011-12-06T17:00:00,neutral,0.01,Positive,Everyone deserves Apple D Where buy
817,2011-12-06T17:00:00,neutral,0.01,Positive,nevertrustagirl adams apple
818,2011-12-06T17:00:00,neutral,0.01,Positive,Tis season giving deserves apple appleofmyeye
819,2011-12-06T17:00:00,neutral,0.01,Negative,I wish I apple
820,2011-12-06T17:00:00,neutral,0.01,Positive,RT 7digital iTunes UK peaked Apples market share drop 2012
821,2011-12-06T17:00:00,neutral,0.01,Negative,RT guys mom didnt cut apple I supposed eat firstworldproblems
822,2011-12-06T17:00:00,neutral,0.01,Positive,Wow RT NeverTrustAGirlThat bigger Adams Apple u
823,2011-12-06T17:00:00,neutral,0.01,Positive,awesome Happy eating apple
824,2011-12-06T17:00:00,neutral,0.01,Negative,apple elma sapple selma
825,2011-12-06T17:00:00,neutral,0.01,Positive,yup Essentially RAM without Apple sticker
826,2011-12-06T17:00:00,neutral,0.01,Positive,Adams apple bigger ursLmao Wendy Williams Man Now Im questioning ur sexuality Lls
827,2011-12-06T17:00:00,neutral,0.01,Negative,So went Apple Bees waisted lastnight hour closed I bet hated us dontcare
828,2011-12-06T17:00:00,neutral,0.01,Positive,RT Hello New York In Big Apple press Deathly Hallows Part 1 Its going busy week Em x
829,2011-12-06T17:00:00,neutral,0.01,Negative,thats apple
830,2011-12-06T17:00:00,neutral,0.01,Negative,ohAre Pune
831,2011-12-06T17:00:00,neutral,0.01,Positive,Tis season giving deserves apple appleofmyeye ” ”
832,2011-12-06T17:00:00,neutral,0.01,Negative,time I doubt Apple wrong
833,2011-12-06T17:00:00,neutral,0.01,Negative,Parents grandparents new computers Take apple store try IPAD
834,2011-12-06T17:00:00,neutral,0.01,Positive,Apple putting actual TV makes zero sense More likely robust Apple TV current generation
835,2011-12-06T17:00:00,neutral,0.01,Positive,NeverTrustAGirlThat still rocks Baby Phat Apple Bottoms Ecko Red Pastrys etc
836,2011-12-06T17:00:00,neutral,0.01,Positive,NeverTrustAGirlThat adams apple
837,2011-12-06T17:00:00,neutral,0.01,Positive,RT APPLE ON TRACK FOR JAPANESE SIRI NEXT YR NIKKEI SAYS via Bloomberg
838,2011-12-06T17:00:00,neutral,0.01,Positive,RT My favourite quote day far Thats Apples marketing brilliance took nerds rebranded genius
839,2011-12-06T17:00:00,neutral,0.01,Negative,sucksI feel though I one A nurse performer moving Big Apple bettersad
840,2011-12-06T17:00:00,neutral,0.01,Positive,fancy granny smith apple dont even like apples much
841,2011-12-06T17:00:00,neutral,0.01,Positive,Loves apple cinnamon
842,2011-12-06T17:00:00,neutral,0.01,Negative,Thats standard term use walk apple store ask want RT specs imac maxed
843,2011-12-06T17:00:00,neutral,0.01,Negative,Living pudding apple sauce soup Kill I want steak
844,2011-12-06T17:00:00,neutral,0.01,Positive,APPLE ON TRACK FOR JAPANESE SIRI NEXT YR NIKKEI SAYS via Bloomberg
845,2011-12-06T17:00:00,neutral,0.01,Positive,Tis season giving deserves apple appleofmyeye
846,2011-12-06T17:00:00,neutral,0.01,Negative,watch dont choke eating like apple something x
847,2011-12-06T17:00:00,neutral,0.01,Negative,una gorpia hay que da te RT I lost 3 apple headphones less week Really Jess
848,2011-12-06T17:00:00,neutral,0.01,Positive,Macro teach said I get recipe apple pie shell give B I dont take final Happy Birthday ta ME
849,2011-12-06T17:00:00,neutral,0.01,Positive,I ANT TALKIN BOUT APPLE BUT IMAC I ANT TALKIN BOUT LEGOS BUT I STACK HAD YO GIRL GETTIN NAKED ON MY I CKHAT
850,2011-12-06T17:00:00,neutral,0.01,Positive,I hit say say sky I say whats good say McDonalds Apple Pie
851,2011-12-06T17:00:00,neutral,0.01,Positive,Tis season giving deserves apple appleofmyeye
852,2011-12-06T17:00:00,neutral,0.01,Negative,Why tf tyresha throwinn apple juicescreaminn
853,2011-12-06T17:00:00,neutral,0.01,Negative,apple core
854,2011-12-06T17:00:00,neutral,0.01,Positive,RT Youre welcome Try yummy green apple Taste like apple pie
855,2011-12-06T17:00:00,neutral,0.01,Negative,“ Eve first hoe history Bitch sold apple ”
856,2011-12-06T17:00:00,neutral,0.01,Negative,Apple rumored release 7 tablet early next year retweetthisrumor
857,2011-12-06T17:00:00,neutral,0.01,Negative,RT sour apple bitter bitches fuggin
858,2011-12-06T17:00:00,neutral,0.01,Negative,Something apple cider isnt sitting well stomach
859,2011-12-06T17:00:00,neutral,0.01,Positive,EU antitrust probe Apple ebook publishers
860,2011-12-06T17:00:00,neutral,0.01,Negative,I feel 3 transfers coming fighting urge What dyou reckon AB Should I take 4 pt hit
861,2011-12-06T17:00:00,neutral,0.01,Negative,So apple pie tried charge almost 45 update software kmsl I cursed bitches
862,2011-12-06T17:00:00,neutral,0.01,Negative,I goin much gas I live Mpls work Apple Valley go school Eden Praire BPWtf bird smh
863,2011-12-06T17:00:00,neutral,0.01,Positive,I loveeee baby ur apple eyes u de make ring oooooo
864,2011-12-06T17:00:00,neutral,0.01,Positive,Ill think giving apple time capsule Merry Christmas
865,2011-12-06T17:00:00,neutral,0.01,Negative,YouKnowAFatPersonInvented apple
866,2011-12-06T17:00:00,neutral,0.01,Positive,RT Follow enter loved one chance win Tis season giving deserves
867,2011-12-06T17:00:00,neutral,0.01,Positive,Tis season giving deserves apple appleofmyeye ”
868,2011-12-06T17:00:00,neutral,0.01,Negative,I want apple jacks
869,2011-12-06T17:00:00,neutral,0.01,Positive,NeverTrustAGirlThat bigger Adams Apple u
870,2011-12-06T17:00:00,neutral,0.01,Positive,“ Apples aint even good thonot even Peach strawberry pineapple Ol basic ass apple loving hoe ”
871,2011-12-06T17:00:00,neutral,0.01,Negative,Steve Jobs ThankGodForU without wouldnt iPod iPad MacBook Apple Computers
872,2011-12-06T17:00:00,neutral,0.01,Positive,Apple jacks best cereal
873,2011-12-06T17:00:00,neutral,0.01,Positive,Tis season giving deserves apple appleofmyeye
874,2011-12-06T17:00:00,neutral,0.01,Positive,oh yeah
875,2011-12-06T17:00:00,neutral,0.01,Negative,everybodys kind rotten apple way ones perfect
876,2011-12-06T17:00:00,neutral,0.01,Positive,NeverTrustAGirl Adams Apple
877,2011-12-06T17:00:00,neutral,0.01,Positive,Eating fresh apple cinnamon oatmeal brainfood
878,2011-12-06T17:00:00,neutral,0.01,Positive,ive sipping Smirnoff Ice Green Apple since 11am good lmao
879,2011-12-06T17:00:00,neutral,0.01,Positive,Tis season giving deserves apple appleofmyeye
880,2011-12-06T17:00:00,neutral,0.01,Negative,I aint gagged anything far 3 month old rotten apple got I almost going throw
881,2011-12-06T17:00:00,neutral,0.01,Negative,apple products cockroaches electronics
882,2011-12-06T17:00:00,neutral,0.01,Negative,Apple juicegtgtgtgtgt
883,2011-12-06T17:00:00,neutral,0.01,Positive,RT mmmm apple juice
884,2011-12-06T17:00:00,neutral,0.01,Positive,Apple trying ban world Good luck
885,2011-12-06T17:00:00,neutral,0.01,Negative,She apple eye
886,2011-12-06T17:00:00,neutral,0.01,Positive,What happens Apple actually reinvents television
887,2011-12-06T17:00:00,neutral,0.01,Positive,Im drinking apple juice Haha
888,2011-12-06T17:00:00,neutral,0.01,Positive,Your apple pie straw berry smoke high one wan na marrywere perfect two
889,2011-12-06T17:00:00,neutral,0.01,Positive,gt Gomadic Universal Charging Station Apple iPod 4G 40GB many mobile devices 2nd Generation Design uses Gomadic Ti
890,2011-12-06T17:00:00,neutral,0.01,Negative,aw naw rite androidsbut imm apple mobile app setup soon
891,2011-12-06T17:00:00,neutral,0.01,Positive,Tis season giving deserves apple appleofmyeye
892,2011-12-06T17:00:00,neutral,0.01,Positive,Just got apple size softball lunch whoa
893,2011-12-06T17:00:00,neutral,0.01,Positive,RT Para drogas tienen el shopping los smartphones The walking man twitter facebook apple
894,2011-12-06T17:00:00,neutral,0.01,Negative,This apple point
895,2011-12-06T17:00:00,neutral,0.01,Positive,RT Follow enter loved one chance win Tis season giving deserves
896,2011-12-06T17:00:00,neutral,0.01,Negative,Why teasing donkey apple
897,2011-12-06T17:00:00,neutral,0.01,Positive,HEY APPLE
898,2011-12-06T17:00:00,neutral,0.01,Negative,RT Why messages sending messages people fucking iMessenger apple stupidfuckingiphone
899,2011-12-06T17:00:00,neutral,0.01,Positive,Of course Some apple cider alcohol could ask anything better
