id,date,class,percent,sentiment,text
232,2008-04-15T17:00:00,increase,0.17,Negative,Dear Apple Just know moment drop updates 30 Cinema display Ill ordering Been waiting thoughMe
233,2008-04-15T17:00:00,increase,0.17,Positive,Go go gadget Apple iWork Keynote oh sorry youve hours P
234,2008-04-15T17:00:00,increase,0.17,Negative,interestingly Apple arent cutting iPhone price UK store
235,2008-04-15T17:00:00,increase,0.17,Negative,Entourage frequently switch apple mail ical address book
236,2008-04-15T17:00:00,increase,0.17,Positive,Explaining Apple products people I commission Will Cult Mac still exist everyone got one
237,2008-04-15T17:00:00,increase,0.17,Negative,Just bought 16GB ipod touch Man thing cool Its fourth ipod Damn Apple making buy new one every 2 years
238,2008-04-15T17:00:00,increase,0.17,Negative,grr first corded iPhone headsets mic bit dust Apple BT headset refusing work
239,2008-04-15T17:00:00,increase,0.17,Negative,Taking bike apple store first ride year
240,2008-04-15T17:00:00,increase,0.17,Positive,I used enjoy browsing Apple store assault youre actively buying something
241,2008-04-15T17:00:00,increase,0.17,Negative,Apple called My computer ready
242,2008-04-15T17:00:00,increase,0.17,Positive,stick apple logo might surprised call quicktake shuffle needs 8 pics
243,2008-04-15T17:00:00,increase,0.17,Positive,I liked better Apple sent WWDC DVDs You click Get Movie EVERYSINGLEONE Then burn
244,2008-04-15T17:00:00,increase,0.17,Positive,I highly highly recommend spending minutes new apple keyboard grabbing one I think perfect
245,2008-04-15T17:00:00,increase,0.17,Positive,Plaxo best use Apple Mail Address Book iCal problem company Exchange server thus Entourag
246,2008-04-15T17:00:00,increase,0.17,Negative,Plaxo best use Apple Mail Address Book iCal problem company Exchange server thus Ento
247,2008-04-15T17:00:00,increase,0.17,Negative,Why destroy Apple Microsoft see takes us future
248,2008-04-15T17:00:00,increase,0.17,Negative,Quicktime gone far long world builtin software update feature Get program Apple
249,2008-04-15T17:00:00,increase,0.17,Negative,learned resend iTunes gift lost ether matter think Apple I think iTunes UI poor
250,2008-04-15T17:00:00,increase,0.17,Negative,interesting Psystar maker new desktop mac clone wants challenge apples EULA court saying violates Monopoly laws
251,2008-04-15T17:00:00,increase,0.17,Negative,Fly pretty lay waste Curpetino Apple betrayed must punished Kill
252,2008-04-15T17:00:00,increase,0.17,Positive,Most people favorite coffee shop Apple laptops gt75 Sweet
253,2008-04-15T17:00:00,increase,0.17,Negative,Do need get something country Apple Stores
254,2008-04-15T17:00:00,increase,0.17,Positive,I saying exact thing It would win win situation Apple content providers alike
255,2008-04-15T17:00:00,increase,0.17,Positive,two old Apple digital cameras well called QuickTake among first digital cameras market
256,2008-04-15T17:00:00,increase,0.17,Positive,Never judge day first impressions Mine looking Observed catering class got baked apple ice cream Yummy
257,2008-04-15T17:00:00,increase,0.17,Negative,Just ate apple pastry apple consecutively see brought enlightenment Just made feel bemused confused
258,2008-04-15T17:00:00,increase,0.17,Negative,yeah Mythtv cool I time mess thati thought making mac mini apple tv though
259,2008-04-15T17:00:00,increase,0.17,Negative,My boss generally like You need okay But balks buying Mac reason Hes probably apple hater
260,2008-04-15T17:00:00,increase,0.17,Negative,Why Apple Microsoft interoperate play nicely together Wheres single signon damn
261,2008-04-15T17:00:00,increase,0.17,Negative,o2 cuts £100 iPhone price cut apple going
262,2008-04-15T17:00:00,increase,0.17,Negative,want Apple TV capability play 1080p content OR Mac mini HDMI 13
263,2008-04-15T17:00:00,increase,0.17,Negative,Switching back Gmail interface months Apple Mail IMAP For Gmail better way
264,2008-04-15T17:00:00,increase,0.17,Negative,Yes Apple install comment Ive uninstall Safari twice home puter
265,2008-04-15T17:00:00,increase,0.17,Positive,1020 AM 4 eggs 800 jello 160 choc pudding 160 apple juice 100
266,2008-04-15T17:00:00,increase,0.17,Positive,Its time work For breakfast Im eating apple Diet Root Beer
267,2008-04-15T17:00:00,increase,0.17,Positive,lunch perusing apple products
268,2008-04-15T17:00:00,increase,0.17,Negative,LOL reading Psystar argues Apple monopoly completely discounting existence established operating systems
269,2008-04-15T17:00:00,increase,0.17,Positive,Listening shuffled music via ear buds seems shuffle apple means really random
270,2008-04-15T17:00:00,increase,0.17,Negative,Running count Apple 2 pc 3
271,2008-04-15T17:00:00,increase,0.17,Positive,No Apple gaming console needed Digital still cameras video cameras haloexpansion opportunity edit content Mac
272,2008-04-15T17:00:00,increase,0.17,Negative,Roxio Crunch Physical Roxio Crunch Physical3999Roxio Crunch essential video converter Apple TV
273,2008-04-15T17:00:00,increase,0.17,Negative,Roxio Crunch Download Roxio Crunch Download3999Roxio Crunch essential video converter Apple TV
274,2008-04-15T17:00:00,increase,0.17,Negative,Yay I get two hours Then I phone Apple Care find moms Imac issue
275,2008-04-15T17:00:00,increase,0.17,Negative,Apple right new folder icons better
276,2008-04-15T17:00:00,increase,0.17,Positive,well case Apple everything sekrit maybe bug actually feature next years WWDC
277,2008-04-15T17:00:00,increase,0.17,Negative,apple matching reductions Sluggish sales likely reason
278,2008-04-15T17:00:00,increase,0.17,Positive,Contemplating one builds community Guy kawasaki Blog discussing days apple
279,2008-04-15T17:00:00,increase,0.17,Negative,whats wrong applemail
280,2008-04-15T17:00:00,increase,0.17,Negative,sad apple didnt make phone works Verizons network aftr 10yrs I think Ill leaving Verizon 3G iphone coming summer
281,2008-04-15T17:00:00,increase,0.17,Negative,My foldable Sennheisers broke yesterday using crappy Apple earbuds instead Fix pony buy new pair
282,2008-04-15T17:00:00,increase,0.17,Positive,iTunes U session Apple Boston What Apple enabled voluntary micropayments content All gift cards floating around
283,2008-04-15T17:00:00,increase,0.17,Negative,bummed new iPod Classics EQ adds audible distortion sound WTF Apple
284,2008-04-15T17:00:00,increase,0.17,Negative,Trying explain AFP RAID NAS Apple TV hacking via email
285,2008-04-15T17:00:00,increase,0.17,Positive,Fiona Apple A cross universe ♫
286,2008-04-15T17:00:00,increase,0.17,Positive,pondering purchase new apple need subjective thing
287,2008-04-15T17:00:00,increase,0.17,Negative,course bridge could called Apple TV
288,2008-04-15T17:00:00,increase,0.17,Positive,awed google earth running fullscreen 30 apple studio display D D
289,2008-04-15T17:00:00,increase,0.17,Negative,11 hours counting MBP fresh back Apple 3rd logic board many weeks Holding breath Considering extended warranty
290,2008-04-15T17:00:00,increase,0.17,Negative,If buy rich gamingmedia concolidation death broadcast TV 1st screen computer Apple bridgesthe worlds
291,2008-04-15T17:00:00,increase,0.17,Negative,Question weakened sterling mean longer necessary Apple lower prices iTunes Store
292,2008-04-15T17:00:00,increase,0.17,Negative,iphone crashed two times tracking SDK Apples live event It madness
293,2008-04-15T17:00:00,increase,0.17,Positive,Setting Xserve customer also purchased Apple 30inch display Ok wow yeah
294,2008-04-15T17:00:00,increase,0.17,Negative,Okay 30 seconds I tell coworkers lab position I get call APPLE schedule interview tomorrow
295,2008-04-15T17:00:00,increase,0.17,Negative,Why wireless backup Apples TimeCapsule Why wired least 200 faster 400 More reliable Why push wireless
296,2008-04-15T17:00:00,increase,0.17,Negative,least could somewhat afford whats microsoft store MacBook Air 1700 dvd drive nice one Apple
297,2008-04-15T17:00:00,increase,0.17,Positive,I think best system somewhere Apples subscriptions I think Pickles Favorites
298,2008-04-15T17:00:00,increase,0.17,Positive,They might carry Apple Store sure though Great bag though
299,2008-04-15T17:00:00,increase,0.17,Negative,Apple great works Sucks doesnt IPhone lost synchronizations Now must Restore fix
300,2008-01-14T17:00:00,decrease,-0.23,Negative,Apple cant I legally virtualize OS X Theres something wrong Windows test environment better OS X
301,2008-01-14T17:00:00,decrease,-0.23,Negative,I ran shuttle morning Man I shape It wasnt shuttle It Apple shuttle Exercise humiliation
302,2008-01-14T17:00:00,decrease,-0.23,Negative,I want Keychain sync work 1Password But trust Apple mess
303,2008-01-14T17:00:00,decrease,-0.23,Positive,Domestic bliss bride making spicedapple coffee cake blizzard
304,2008-01-14T17:00:00,decrease,-0.23,Negative,Keychain iDisk sync great ideas Apple failed implementation It works huh
305,2008-01-14T17:00:00,decrease,-0.23,Positive,Techrunch Google Beefs Up iPhone Interface As noted earlier Google pumped interface Apple
306,2008-01-14T17:00:00,decrease,-0.23,Positive,Out 2 meetings go By time Im finished Ill able read new stuff Apple
307,2008-01-14T17:00:00,decrease,-0.23,Positive,Anyone using Quicktime pro What uses The Apple site bit vague
308,2008-01-14T17:00:00,decrease,-0.23,Negative,Just sent skitch non apple person sorry mac sort compensates safari frustration thanks plasq
309,2008-01-14T17:00:00,decrease,-0.23,Negative,Netflix trying compete Apple cant I use Watch Now feature Mac
310,2008-01-14T17:00:00,decrease,-0.23,Negative,eFluxMediaApple Give Us Something Talk AboutBusinessWeek 8 hours agoThe skys limit predicting CEO Jobs disc
311,2008-01-14T17:00:00,decrease,-0.23,Negative,eFluxMediaApple Give Us Something Talk AboutBusinessWeek 8 hours agoThe skys limit predicting CEO Jobs disc
312,2008-01-14T17:00:00,decrease,-0.23,Negative,owning nothing apple anymore dont know im still excited macworld
313,2008-01-14T17:00:00,decrease,-0.23,Positive,wilalambre All excited Macworld tomorrow Its christmas apple fanatics
314,2008-01-14T17:00:00,decrease,-0.23,Positive,Are Apple XServe OSX Managed Hosting companies Why one taking advantage Apples Halo effect server bu
315,2008-01-14T17:00:00,decrease,-0.23,Positive,All excited Macworld tomorrow Its christmas apple fanatics
316,2008-01-14T17:00:00,decrease,-0.23,Negative,turned 12hrs week Apple
317,2008-01-14T17:00:00,decrease,-0.23,Positive,Apple runs China Mobile wallMarketWatch 1 hour agoBy MarketWatch LONDON MarketWatch Whatever big announcements come outof
318,2008-01-14T17:00:00,decrease,-0.23,Positive,I love MBP I ust need Apple 30in display birthday year
319,2008-01-14T17:00:00,decrease,-0.23,Negative,Apple
320,2008-01-14T17:00:00,decrease,-0.23,Negative,Apple also applied patent something looks like iMac allows insertion portable macbook docking
321,2008-01-14T17:00:00,decrease,-0.23,Negative,really try outback steak house across road Apple campus Cupertino really good
322,2008-01-14T17:00:00,decrease,-0.23,Positive,Dear Minions Apple new stuff Come Buy Give us money Oder aehnlich halt
323,2008-01-14T17:00:00,decrease,-0.23,Negative,DownloadSquad ZSF Mac OS X Filed Macintosh Productivity Apple Open SourceThere rumor
324,2008-01-14T17:00:00,decrease,-0.23,Negative,Working two computers three phones Now integrate giving bot apple sauce Its dangerous life
325,2008-01-14T17:00:00,decrease,-0.23,Positive,ready first day scouting today EA CISCO HP garage infinite loop street Apple
326,2008-01-14T17:00:00,decrease,-0.23,Negative,An Apple day keeps doctor away A call Apple day prevents headaches going away
327,2008-01-14T17:00:00,decrease,-0.23,Positive,Played The Metadata Screencast Part Three The Apple Blog
328,2008-01-14T17:00:00,decrease,-0.23,Positive,Played The Metadata Screencast Part Three The Apple Blog
329,2008-01-14T17:00:00,decrease,-0.23,Positive,Globe MailApple runs China Mobile wallMarketWatch 37 minutes agoBy MarketWatch LONDON MarketWatch Whatever big announ
330,2008-01-14T17:00:00,decrease,-0.23,Positive,Globe MailApple runs China Mobile wallMarketWatch 37 minutes agoBy MarketWatch LONDON MarketWatch Whatever big announ
331,2008-01-14T17:00:00,decrease,-0.23,Positive,thinking ahead apple keynote shiny goodness dreaming hours time
332,2008-01-14T17:00:00,decrease,-0.23,Negative,Note self never call phone display iphone apple store
333,2008-01-14T17:00:00,decrease,-0.23,Positive,Is chuffed shiny new Apple keyboard MMM aluminum
334,2008-01-14T17:00:00,decrease,-0.23,Negative,My Apple mouse buggy lately Maybe I try Cursing banging dont seem help much
335,2008-01-14T17:00:00,decrease,-0.23,Negative,Heading Apple Store iPhone replacement Battery issues
336,2008-01-14T17:00:00,decrease,-0.23,Negative,took monitor cleaning wipe Apple mouse semblance scrolling ftw
337,2008-01-14T17:00:00,decrease,-0.23,Negative,HONG KONG Reuters Apple Inc China Mobile called talks tolaunch US firms popular iPhones China dashing inves
338,2008-01-14T17:00:00,decrease,-0.23,Negative,HONG KONG Reuters Apple Inc China Mobile called talks tolaunch US firms popular iPhones China dashing inves
339,2008-01-14T17:00:00,decrease,-0.23,Negative,At kickoff Apple China Mobile The market ignoring prediction Cmon China need iPhone Apple needs China
340,2008-01-14T17:00:00,decrease,-0.23,Positive,learning Adobe Lightroom loving Apples Aperture Good stuff
341,2008-01-14T17:00:00,decrease,-0.23,Positive,Did move go ok Welcome Big Apple
342,2008-01-14T17:00:00,decrease,-0.23,Positive,eating apple reading Service Oriented Architecture wondering rest team
343,2008-01-14T17:00:00,decrease,-0.23,Positive,maybe I get job apple nowexcept I smell like trout
344,2008-01-14T17:00:00,decrease,-0.23,Negative,Wishing Apple made keyboard black
345,2008-01-14T17:00:00,decrease,-0.23,Negative,points finger Apple friend thou hast forsaken Its tomorrow 9 fact p Thanks
346,2008-01-14T17:00:00,decrease,-0.23,Positive,Something Air In strategic alliance WhamO Apples new MacBook shape Frisbee Sneakernet meet Wristnet
347,2008-01-14T17:00:00,decrease,-0.23,Positive,thats awesome And great idea Do remember Lemonade Stand game Apple It great
348,2008-01-14T17:00:00,decrease,-0.23,Negative,MacBook Air Think Apple notbook thickness new keyboards
349,2008-01-14T17:00:00,decrease,-0.23,Negative,HONG KONG Reuters Apple Inc China Mobile called talks tolaunch US firms popular iPhones China dashing inves
350,2008-01-14T17:00:00,decrease,-0.23,Positive,It ’ definitely time break A big forgettodolists playHalo tastybeverage break And apple pie With icecream
351,2008-01-14T17:00:00,decrease,-0.23,Positive,Lots rumors slim notebook going announced If would awesome Apple needed something niche
352,2008-01-14T17:00:00,decrease,-0.23,Negative,HONG KONG Reuters Apple Inc China Mobile called talks tolaunch US firms popular iPhones China dashing inves
353,2008-01-14T17:00:00,decrease,-0.23,Negative,Soon apple store registration Moscone Center 800am
354,2008-01-14T17:00:00,decrease,-0.23,Negative,Soon apple store registration Moscone Center 800am
355,2008-01-14T17:00:00,decrease,-0.23,Negative,Hopes Apple releases updates MacBook tomorrow
356,2008-01-14T17:00:00,decrease,-0.23,Positive,Hoping something air means Apple bringing unique quality fragrance market
357,2008-01-14T17:00:00,decrease,-0.23,Negative,明天FC Barcelona Apple MWSF 2008
358,2008-01-14T17:00:00,decrease,-0.23,Positive,Fuji apple Greek yogurt
359,2008-01-14T17:00:00,decrease,-0.23,Negative,Globe MailUPDATE 2Apple China Mobile call iPhone launch talksReuters 3 hours agoBy Vinicy Chan HONG KONG Jan 14 Reute
360,2008-01-14T17:00:00,decrease,-0.23,Negative,could turn back Apple like How sinfulD
361,2008-01-14T17:00:00,decrease,-0.23,Negative,HONG KONG Reuters Apple Inc China Mobile called talks tolaunch US firms popular iPhones China dashing inves
362,2008-01-14T17:00:00,decrease,-0.23,Negative,HONG KONG Reuters Apple Inc China Mobile called talks tolaunch US firms popular iPhones China dashing inves
363,2008-01-14T17:00:00,decrease,-0.23,Negative,Apples hardware engineers spent year working touchscreen technology tablet PC In 2004 Interesting
364,2008-01-14T17:00:00,decrease,-0.23,Positive,Checking apple Website updates MacWorld Expo begins today
365,2008-01-14T17:00:00,decrease,-0.23,Negative,I think Apple gave couldnt make slick enough
366,2008-01-14T17:00:00,decrease,-0.23,Negative,Tomorrow MacExpo Im wigglish hipplish What everyone think come apple
367,2008-01-14T17:00:00,decrease,-0.23,Negative,Globe MailUPDATE 2Apple China Mobile call iPhone launch talksReuters 2 hours agoBy Vinicy Chan HONG KONG Jan 14 Reute
368,2008-01-14T17:00:00,decrease,-0.23,Negative,I know mentality keeps Apple business
369,2008-01-14T17:00:00,decrease,-0.23,Positive,Apple havent done live stream years Some blogs try live text commentary
370,2008-01-14T17:00:00,decrease,-0.23,Negative,HONG KONG Reuters Apple Inc China Mobile called talks tolaunch US firms popular iPhones China dashing inves
371,2008-01-14T17:00:00,decrease,-0.23,Positive,pondering apple launch week dont even give fig apple Apple 0wns us MacWorld FTW
372,2008-01-14T17:00:00,decrease,-0.23,Negative,seems working morning Apple Mail
373,2008-01-14T17:00:00,decrease,-0.23,Negative,Tomorrow apparently superthinlaptop day apple If solid state drive I hard time buying
374,2008-01-14T17:00:00,decrease,-0.23,Negative,Apparently bought Apple
375,2008-01-14T17:00:00,decrease,-0.23,Negative,HONG KONG Reuters Apple Inc China Mobile called talks tolaunch US firms popular iPhones China dashing inves
376,2008-01-14T17:00:00,decrease,-0.23,Negative,Globe MailUPDATE 2Apple China Mobile call iPhone launch talksReuters 2 hours agoBy Vinicy Chan HONG KONG Jan 14 Reute
377,2008-01-14T17:00:00,decrease,-0.23,Negative,Globe MailUPDATE 2Apple China Mobile call iPhone launch talksReuters 2 hours agoBy Vinicy Chan HONG KONG Jan 14 Reute
378,2008-01-14T17:00:00,decrease,-0.23,Negative,HONG KONG Reuters Apple Inc China Mobile called talks tolaunch US firms popular iPhones China dashing inves
379,2008-01-14T17:00:00,decrease,-0.23,Negative,Wishing I Macworld 08 My prediction Apple announce buying FCC Airspace
380,2008-01-14T17:00:00,decrease,-0.23,Negative,Tate M flaky free BT WiFi open Apple node opposite works better Plus cut power plugs turbine hall misers
381,2008-01-14T17:00:00,decrease,-0.23,Negative,If Apple went DRM free free amazon would able upgrade existing music
382,2008-01-14T17:00:00,decrease,-0.23,Negative,caught thinking AppleZ picking rubber
383,2008-01-14T17:00:00,decrease,-0.23,Negative,Globe MailUPDATE 2Apple China Mobile call iPhone launch talksReuters 2 hours agoBy Vinicy Chan HONG KONG Jan 14 Reute
384,2008-01-14T17:00:00,decrease,-0.23,Negative,HONG KONG Reuters Apple Inc China Mobile called talks tolaunch US firms popular iPhones China dashing inves
385,2008-01-14T17:00:00,decrease,-0.23,Negative,HONG KONG Reuters Apple Inc China Mobile called talks tolaunch US firms popular iPhones China dashing inves
386,2008-01-14T17:00:00,decrease,-0.23,Negative,Damn I really wish I would brought Apple Keyboard home The way I see I could pick end day
387,2008-01-14T17:00:00,decrease,-0.23,Negative,Globe MailUPDATE 2Apple China Mobile call iPhone launch talksReuters 1 hour agoBy Vinicy Chan HONG KONG Jan 14 Reuter
388,2008-01-14T17:00:00,decrease,-0.23,Negative,HONG KONG Reuters Apple Inc China Mobile called talks tolaunch US firms popular iPhones China dashing inves
389,2008-01-14T17:00:00,decrease,-0.23,Negative,interestingly enough Apple Store lists airport extreme base station Not Available
390,2008-01-14T17:00:00,decrease,-0.23,Negative,HONG KONG Reuters Apple Inc China Mobile called talks tolaunch US firms popular iPhones China dashing inves
391,2008-01-14T17:00:00,decrease,-0.23,Negative,Apple Adobe AIR far fetched
392,2008-01-14T17:00:00,decrease,-0.23,Negative,HONG KONG Reuters Apple Inc China Mobile called talks tolaunch US firms popular iPhones China dashing inves
393,2008-01-14T17:00:00,decrease,-0.23,Negative,apple
394,2008-01-14T17:00:00,decrease,-0.23,Negative,HONG KONG Reuters Apple Inc China Mobile called talks tolaunch US firms popular iPhones China dashing inves
395,2008-01-14T17:00:00,decrease,-0.23,Negative,HONG KONG Reuters Apple Inc China Mobile called talks tolaunch US firms popular iPhones China dashing inves
396,2008-01-14T17:00:00,decrease,-0.23,Negative,Why people keep speculating Apple going release PDA They already called iPhone
397,2008-01-14T17:00:00,decrease,-0.23,Negative,apple
398,2008-01-14T17:00:00,decrease,-0.23,Negative,They promised snow NY Six inches Weather forecasters like Apple marketers get jazzed leave flat
399,2008-01-14T17:00:00,decrease,-0.23,Positive,eFluxMediaApple May Need Play Better OthersBusinessWeek 3 hours agoby Peter Burrows If years Macworld Conference E
400,2008-09-25T17:00:00,decrease,-0.24,Negative,Why Vistas image generation engine Quartzdll isnt Apples graphics engine called
401,2008-09-25T17:00:00,decrease,-0.24,Positive,Daily 1 oclock sticky fingers red delicious apple Purell time
402,2008-09-25T17:00:00,decrease,-0.24,Negative,going Apple store get new iPhone
403,2008-09-25T17:00:00,decrease,-0.24,Negative,nope Tim Gunns podcast went away NBC owns Bravo broke Apple couple years ago bad I liked
404,2008-09-25T17:00:00,decrease,-0.24,Positive,Apple agreed
405,2008-09-25T17:00:00,decrease,-0.24,Negative,timing open G1 shapes nice Apples closed core problems
406,2008-09-25T17:00:00,decrease,-0.24,Negative,continue formulate thesiscall applecall microsoftrecord storerelax
407,2008-09-25T17:00:00,decrease,-0.24,Negative,still dissapointed heard Apple push notification
408,2008-09-25T17:00:00,decrease,-0.24,Negative,Theres nothing like getting tossed sea soaked bone deck coming hot apple cider amp spiced rum
409,2008-09-25T17:00:00,decrease,-0.24,Negative,It appears dotMacKit doesnt work w MobileMe Apple doesnt care Oh well money service
410,2008-09-25T17:00:00,decrease,-0.24,Negative,whoever apple made decision allow fast uncomplicated hw swaps get medal
411,2008-09-25T17:00:00,decrease,-0.24,Positive,3 biggest MSFT competitors according Ballmer Linux Open Office Apple Google
412,2008-09-25T17:00:00,decrease,-0.24,Positive,Update found solution Apple Discussions Will followup confirmed
413,2008-09-25T17:00:00,decrease,-0.24,Negative,internship Apple I thought hated products The years insulting hardware choices lead
414,2008-09-25T17:00:00,decrease,-0.24,Negative,good newsbad news apple store time capsule fine Its OSX 1055 install thats totally messed Blah
415,2008-09-25T17:00:00,decrease,-0.24,Negative,Wishing I done load laundry yesterday headed Airport way Apple Store stupid power adapter
416,2008-09-25T17:00:00,decrease,-0.24,Positive,Headin west coast green fair hopin see Apple renewable hardware Ala 1977 west coat computer fair
417,2008-09-25T17:00:00,decrease,-0.24,Positive,Eyes focused reading rather lunch I almost ate sticker apple
418,2008-09-25T17:00:00,decrease,-0.24,Negative,Could agree moreHello Apple uhh copy paste please
419,2008-09-25T17:00:00,decrease,-0.24,Negative,Trying MobileMe Having problems syncing iCal subscriptions iPhone though time write Apple Script
420,2008-09-25T17:00:00,decrease,-0.24,Negative,Apple solves quotarbitrary rejection iPhone apps problemquot putting rejection letters NDA No bad press No problem For
421,2008-09-25T17:00:00,decrease,-0.24,Negative,hold Apple theyre playing In My Place Coldplayit sounds terrible coming phone yet im tempted sing along
422,2008-09-25T17:00:00,decrease,-0.24,Negative,Ummyogurt parfait apple dippers regular chicken sandwhich mayo grilled chicken sandwhich
423,2008-09-25T17:00:00,decrease,-0.24,Negative,Its bummer see Apple managing App Store draconian way They even NDAs bitchy rejection letters
424,2008-09-25T17:00:00,decrease,-0.24,Positive,I donut lottery today Cinnamon Apple FTW
425,2008-09-25T17:00:00,decrease,-0.24,Positive,sure flavours good together add one wtih apple strudel Opentoberfest
426,2008-09-25T17:00:00,decrease,-0.24,Negative,Dear Apple Used Macs 20 yrs DRM amp App Store policies made defecteven iPod Let control content amp Ill back Im pirate
427,2008-09-25T17:00:00,decrease,-0.24,Positive,Stood new Apple store Cabot Circus using free WiFi write ipod This place incredible
428,2008-09-25T17:00:00,decrease,-0.24,Positive,drinking apple amp cinnamon tea
429,2008-09-25T17:00:00,decrease,-0.24,Negative,Waiting Apple Store My right knee kinda hurts P
430,2008-09-25T17:00:00,decrease,-0.24,Negative,really pains see Apple acting way using NDA instead transparent surefire way lose support 4 iPhone
431,2008-09-25T17:00:00,decrease,-0.24,Negative,forcing device reboot Just hold lock home buttons get familiar apple screen
432,2008-09-25T17:00:00,decrease,-0.24,Positive,Know would cool Apple Copypaste Yeah
433,2008-09-25T17:00:00,decrease,-0.24,Positive,Turns Apples search top right searches everything I show results could obvious though
434,2008-09-25T17:00:00,decrease,-0.24,Negative,OH quotGuess lost iPhone last night This guyquot Apple iPhone tech support agent
435,2008-09-25T17:00:00,decrease,-0.24,Positive,cider doughnuts relatively common New England found farms apple picking season stores
436,2008-09-25T17:00:00,decrease,-0.24,Negative,right apple menu
437,2008-09-25T17:00:00,decrease,-0.24,Positive,Having turkey cheese apple lunch
438,2008-09-25T17:00:00,decrease,-0.24,Positive,Its time Steve Jobs write quotThoughts Musicquotstyled article App Store Apple Hot News blog
439,2008-09-25T17:00:00,decrease,-0.24,Positive,double success Apple change rules engagement price competition playing game
440,2008-09-25T17:00:00,decrease,-0.24,Positive,free apple mail Id suspicious healthwise Remember Snow White
441,2008-09-25T17:00:00,decrease,-0.24,Negative,Woah Its dark amp chilly big apple tday
442,2008-09-25T17:00:00,decrease,-0.24,Negative,Very strange Just ate apple half tasted crunchy apple amp half like mushy water
443,2008-09-25T17:00:00,decrease,-0.24,Negative,Going lunch Apple Store
