id,date,class,percent,sentiment,text
444,2008-09-25T17:00:00,decrease,-0.24,Negative,Apple Crisp REALLY hot ice cream starts melting right away
445,2008-09-25T17:00:00,decrease,-0.24,Positive,I really need longer support like Apple 37signals
446,2008-09-25T17:00:00,decrease,-0.24,Negative,This weather making want make Apple Crisp big scoop vanilla ice creamno wonder Im fat
447,2008-09-25T17:00:00,decrease,-0.24,Negative,Plus apple would probably reject app anyway
448,2008-09-25T17:00:00,decrease,-0.24,Negative,wondering apple problem people downlaoding podcast iPhone Music ok podcast Bandwidth maybe
449,2008-09-25T17:00:00,decrease,-0.24,Negative,My iPhone dying Dead Pixel Creep Cant read time Ugh Help Apple Geniuses
450,2008-09-25T17:00:00,decrease,-0.24,Negative,At apple store buying mac pro
451,2008-09-25T17:00:00,decrease,-0.24,Negative,Looks like quotwhine Applequot today
452,2008-09-25T17:00:00,decrease,-0.24,Positive,Sure would nice Apple would ship 8GB iTouch
453,2008-09-25T17:00:00,decrease,-0.24,Negative,buy ipod shouldnt watch apple commercials ever youve already got money jerks
454,2008-09-25T17:00:00,decrease,-0.24,Positive,Amazing homemade apple turnovers amazing talented wife delicious I want eat 10 But Ill settle 1 chai
455,2008-09-25T17:00:00,decrease,-0.24,Negative,cali teeming obama fever least LA every LA person ichat obama buddy icon hows big apple
456,2008-09-25T17:00:00,decrease,-0.24,Negative,Had lot trouble getting bed think Anathem causing weird dreams shower Apple
457,2008-09-25T17:00:00,decrease,-0.24,Positive,eating apple
458,2008-09-25T17:00:00,decrease,-0.24,Positive,aware number two result quotapple pnsquot SOMETHING SMELLS FUNNY might apples pns
459,2008-09-25T17:00:00,decrease,-0.24,Negative,Rainy Washington Fall I want smell cinnamon air apple cider belly
460,2008-09-25T17:00:00,decrease,-0.24,Positive,Lunch Time Apple Chicken Walnut salad Steak N Shake
461,2008-09-25T17:00:00,decrease,-0.24,Positive,Is looking crew Apple
462,2008-09-25T17:00:00,decrease,-0.24,Positive,Apple Mail wont let reply message I forward reply How fin weird
463,2008-09-25T17:00:00,decrease,-0.24,Negative,Saw Apple Store
464,2008-09-25T17:00:00,decrease,-0.24,Positive,Now lets make apple pie
465,2008-09-25T17:00:00,decrease,-0.24,Positive,Wonders Apple hiring educational specialists
466,2008-09-25T17:00:00,decrease,-0.24,Negative,take Mac back Apple new hard drive2nd one 6 months
467,2008-09-25T17:00:00,decrease,-0.24,Negative,I think I would kill someone apple turnover right This must feels like diet No wonder fail
468,2008-09-25T17:00:00,decrease,-0.24,Negative,On hold Apple Care Again This getting old fast
469,2008-09-25T17:00:00,decrease,-0.24,Positive,Airplane breakfast pancake sheet rock stuffed apple cinnamon napalm topped buttersyrup epoxy
470,2008-09-25T17:00:00,decrease,-0.24,Positive,made green drink morn celery romaine lettuce kale amp apple good
471,2008-09-25T17:00:00,decrease,-0.24,Positive,Never got Cranberry apple best
472,2008-09-25T17:00:00,decrease,-0.24,Negative,Apparently photoshop CS4 wont 64bit OSX due apple dropping Carbon API Adobe rebuild Coco
473,2008-09-25T17:00:00,decrease,-0.24,Positive,Going apple store Ace Gary
474,2008-09-25T17:00:00,decrease,-0.24,Negative,Think possibilitiesU cud hve email Motorola MOT Razr calls Apple AAPL iPhone mobile Web browsing 1 phne
475,2008-09-25T17:00:00,decrease,-0.24,Negative,Losing entire morning printer setups Workgroup Manager isnt working advertised Boo Apple
476,2008-09-25T17:00:00,decrease,-0.24,Positive,Done apple orchard going park eat lunch
477,2008-09-25T17:00:00,decrease,-0.24,Negative,btw still resolution Apple debacle AppleCare repair center lost 200GB Macbook HD theyre giving runaround
478,2008-09-25T17:00:00,decrease,-0.24,Negative,No Flash Android Nor Quicktime They dont want pay license fee They say Adobe Apple free release players
479,2008-09-25T17:00:00,decrease,-0.24,Negative,Have tried Unarchiver It opens everything fast Apples Archive Helper
480,2008-09-25T17:00:00,decrease,-0.24,Positive,im interested see Apple store us Oct 14th id rather powerful machine netbook
481,2008-09-25T17:00:00,decrease,-0.24,Negative,My managers second last day Apple Sniff sniff
482,2008-09-25T17:00:00,decrease,-0.24,Negative,Raaaa friggin iPhone NDA makes crazy The day Apple allow us speak I start podcast I tons things share
483,2008-09-25T17:00:00,decrease,-0.24,Positive,Making bread meeting tonight coaching group getting ready go apple orchard
484,2008-09-25T17:00:00,decrease,-0.24,Negative,Get mp3 locker Listen phone comp share library friends anywhere No drm crap restrictions apple stuff
485,2008-09-25T17:00:00,decrease,-0.24,Positive,Nah Apple testing far developers go
486,2008-09-25T17:00:00,decrease,-0.24,Positive,frantic vibes Apple Store friendly knowledgeble staff experience good pace slows Well done Apple
487,2008-09-25T17:00:00,decrease,-0.24,Positive,mind asking payed touch looking one apple store wondering cheaper
488,2008-09-25T17:00:00,decrease,-0.24,Positive,enjoying home made Apple Pie made home made Apples cuppa
489,2008-09-25T17:00:00,decrease,-0.24,Positive,Meet Spike Lee Apple Store Soho 700pm Hell speaking new movie quotMiracle St Annaquot Ill white polo amp hat
490,2008-09-25T17:00:00,decrease,-0.24,Positive,The Daily Show equated 2000 McDonalds apple pies everyone P
491,2008-09-25T17:00:00,decrease,-0.24,Positive,Apple tree Blue bird Empire state building My neuro exam
492,2008-09-25T17:00:00,decrease,-0.24,Positive,Jesus lt3s apple cinnamon candles dresser
493,2008-09-25T17:00:00,decrease,-0.24,Negative,thanks thats much cheaper Apple refurbs gon na go preloved budget
494,2008-09-25T17:00:00,decrease,-0.24,Negative,The Apple Genius Bar folks picky whether broken iPod got wet What I supposed listen shower Jeez
495,2008-09-25T17:00:00,decrease,-0.24,Negative,mean quotscrollbackquot havent trouble Apple Term mine quotunlimitedquot
496,2008-09-25T17:00:00,decrease,-0.24,Positive,Meet Director Spike Lee Apple Store Soho today 700pm 800pm He speaking new movie quotMiracle St Annaquot
497,2008-09-25T17:00:00,decrease,-0.24,Positive,wondering Apple TV renting HD movies using video chat ASL et al bring comcasts new limits FIOS
498,2008-09-25T17:00:00,decrease,-0.24,Negative,The blueshirted Apple Store employees science officers And orange concierge Its confusing
499,2008-09-25T17:00:00,decrease,-0.24,Positive,yup shiny Now I need airport expresses apple tv coolest stereo ever
500,2008-09-03T17:00:00,decrease,-0.18,Positive,Lastnight Kiji made Apple Crisps Amazing Also Spore comes weekend Expect lot twitted updates Sunday Monday
501,2008-09-03T17:00:00,decrease,-0.18,Negative,I cant eat big presos Currently sustained 14 scone apple Less puke I guess
502,2008-09-03T17:00:00,decrease,-0.18,Negative,Yikes A single strawberry 30 calories Man I could whole apple
503,2008-09-03T17:00:00,decrease,-0.18,Negative,im apple store regent street
504,2008-09-03T17:00:00,decrease,-0.18,Negative,showing apple ropes new mac user
505,2008-09-03T17:00:00,decrease,-0.18,Positive,Id appreciate Apple also introduced iTunes movie rentals Europe along iTunes 8
506,2008-09-03T17:00:00,decrease,-0.18,Negative,waiting train still hungry snacks An apple doesnt cut
507,2008-09-03T17:00:00,decrease,-0.18,Positive,What think Apples media event bring next week Speculating always fun
508,2008-09-03T17:00:00,decrease,-0.18,Negative,Anyone else experiencing issues Apple stuff lately makes feel like becoming like every company
509,2008-09-03T17:00:00,decrease,-0.18,Negative,Just worst parking experience ever still going Apple Store
510,2008-09-03T17:00:00,decrease,-0.18,Positive,Remind thank Apple borrowing Pandoras functionality use iTunes
511,2008-09-03T17:00:00,decrease,-0.18,Negative,Backing computer aperture vaults prep going apple store I dont know whatll happen P
512,2008-09-03T17:00:00,decrease,-0.18,Negative,Sore throat Gargle apple cider vinegar glass warm water spit swallow mouthful Do every hour
513,2008-09-03T17:00:00,decrease,-0.18,Negative,apple Im sorry Spaces flatulent idiotsavant sitting desktop always know worst thing
514,2008-09-03T17:00:00,decrease,-0.18,Negative,differentiate themself Apple
515,2008-09-03T17:00:00,decrease,-0.18,Positive,Newest flavor Limited Edition board APPLE PIE
516,2008-09-03T17:00:00,decrease,-0.18,Positive,New apple bran muffin Starbucks really good
517,2008-09-03T17:00:00,decrease,-0.18,Negative,I doesnt seem take notice one heh I annoyed Apple
518,2008-09-03T17:00:00,decrease,-0.18,Negative,2 min Quiz An Apple iPhone delivered door
519,2008-09-03T17:00:00,decrease,-0.18,Positive,Soon apple picking season But weekend best
520,2008-09-03T17:00:00,decrease,-0.18,Positive,Apple Introduce new additions ipod Family price cuts Sweet Do hear thousand shouts Iphone
521,2008-09-03T17:00:00,decrease,-0.18,Negative,I think mean Apple Store forgive This time
522,2008-09-03T17:00:00,decrease,-0.18,Negative,Therefore Google becoming Applelike
523,2008-09-03T17:00:00,decrease,-0.18,Positive,Apples PR folks must easiest PR job world Its either Worship time No comment
524,2008-09-03T17:00:00,decrease,-0.18,Positive,may bad RAM hardware related issue Reco call Apple tech support
525,2008-09-03T17:00:00,decrease,-0.18,Negative,Looking Flat Earth Apple Cinnamon chips starting think dogs health food party I wasnt paying attention
526,2008-09-03T17:00:00,decrease,-0.18,Negative,An apple breakfast today I wonder cure headache
527,2008-09-03T17:00:00,decrease,-0.18,Negative,Eating apple thinking I need visit dentist
528,2008-09-03T17:00:00,decrease,-0.18,Positive,You drop store grab Apple Bottoms
529,2008-09-03T17:00:00,decrease,-0.18,Negative,Former apple employee nurse turned cancer survivor gets bundle Im going throw things didnt ask
530,2008-09-03T17:00:00,decrease,-0.18,Negative,Try restarting iPhone holding power Home button Apple logo appears
531,2008-09-03T17:00:00,decrease,-0.18,Negative,I notice talk Apples name isnt connected Webkit
532,2008-09-03T17:00:00,decrease,-0.18,Positive,Apple PR pulling stops going far push foreign tech journalists fly San Francisco next week Orly
533,2008-09-03T17:00:00,decrease,-0.18,Negative,At Apple Store lets hope right thing replace iPhone
534,2008-09-03T17:00:00,decrease,-0.18,Negative,Will apple take rap ATT outage like Blackberry This obviously Apple issue besides iPhone owners care
535,2008-09-03T17:00:00,decrease,-0.18,Negative,Ive asked allowed use Apple Mail IT wants research wExchange 1st
536,2008-09-03T17:00:00,decrease,-0.18,Negative,What I use clean Apple keyboard
537,2008-09-03T17:00:00,decrease,-0.18,Positive,N1 working apple project week called family find favorite color apple Shes taking seriously
538,2008-09-03T17:00:00,decrease,-0.18,Negative,edge major issues last days Everyone I deal forgets ATT provides service Not apple Assholes
539,2008-09-03T17:00:00,decrease,-0.18,Negative,Hurry Apple announce changes macbooks I buy one
540,2008-09-03T17:00:00,decrease,-0.18,Negative,Waiting silly little Windows Mobile device charge even slow compared Nokia Apple
541,2008-09-03T17:00:00,decrease,-0.18,Positive,Im listening Apple Shampoo Blink 182 Dude Ranch
542,2008-09-03T17:00:00,decrease,-0.18,Negative,Ive gone proAple leanings completly antiApple Apple retail version John McCain Im looking buy Obama laptop
543,2008-09-03T17:00:00,decrease,-0.18,Negative,Almost Apple Store Yeeeeeeeeaaaaaahhh
544,2008-09-03T17:00:00,decrease,-0.18,Negative,things take long come mail 1 new lease 2 apple credit card
545,2008-09-03T17:00:00,decrease,-0.18,Positive,Woo hoo I picked mac New logic board costing £600 Im glad I bought apple care I pay
546,2008-09-03T17:00:00,decrease,-0.18,Positive,Got ta ask naturallysugarFILLED organic apple
547,2008-09-03T17:00:00,decrease,-0.18,Positive,Good luck fun Ill come running advice first day arrives Three weeks go
548,2008-09-03T17:00:00,decrease,-0.18,Negative,Hopefully iTunes 8 clean releases breaks Apples cursed summer And I hope Steve burger since last time
549,2008-09-03T17:00:00,decrease,-0.18,Positive,When Apple uses word genius productservice naming strategy arrogance level makes want pound head wall
550,2008-09-03T17:00:00,decrease,-0.18,Positive,apple PR paying Cred deserve thumbs info
551,2008-09-03T17:00:00,decrease,-0.18,Positive,I got press pass Apple secret launch next week
552,2008-09-03T17:00:00,decrease,-0.18,Negative,Meant mention yesterday Google pulled Apple put Chrome icons Desktop Quick Launch without asking Grr
553,2008-09-03T17:00:00,decrease,-0.18,Positive,sigh How come Apple make people feel luckier Sarah Palin
554,2008-09-03T17:00:00,decrease,-0.18,Positive,Getting new toys My favorite combo Panera Bread Apple Store next door
555,2008-09-03T17:00:00,decrease,-0.18,Negative,Would love update iPhone apps apparently Apple removed Update All option App Store iPhone application thanks
556,2008-09-03T17:00:00,decrease,-0.18,Positive,I nominate SJ guild smarty person day hands SJ apple
557,2008-09-03T17:00:00,decrease,-0.18,Positive,I hear ya drinking slim fast apple bar lunch
558,2008-09-03T17:00:00,decrease,-0.18,Negative,Twitter Im sending back al crapy apple product Getting refund
559,2008-09-03T17:00:00,decrease,-0.18,Negative,Why world Apple remove Update All iPhone app Store
560,2008-09-03T17:00:00,decrease,-0.18,Negative,gon na eat apple
561,2008-09-03T17:00:00,decrease,-0.18,Negative,going class apple store get macbook air traveling
562,2008-09-03T17:00:00,decrease,-0.18,Negative,9 apple 2 slices beef jerky cup water
563,2008-09-03T17:00:00,decrease,-0.18,Positive,Just got back meeting Will Wright Apple store spore demo
564,2008-09-03T17:00:00,decrease,-0.18,Negative,Thanks info Express fine Why doesnt Apple store run FC classes
565,2008-09-03T17:00:00,decrease,-0.18,Positive,Eating Carmel Apple pie
566,2008-09-03T17:00:00,decrease,-0.18,Positive,would great itunes apple tv could work together reliably
567,2008-09-03T17:00:00,decrease,-0.18,Positive,Could agree Entourage Any feedback Apple lovers
568,2008-09-03T17:00:00,decrease,-0.18,Negative,Just read another lawsuit apple att To many 3g iPhones slowing network Yeh thats What 3g handsets
569,2008-09-03T17:00:00,decrease,-0.18,Positive,Have apple
570,2008-09-03T17:00:00,decrease,-0.18,Positive,On hand run rumor site like Apple Insider would liberal policy Its transparency
571,2008-09-03T17:00:00,decrease,-0.18,Positive,Wondering Apple announce 9 September Or point include sons next birthday gift
572,2008-09-03T17:00:00,decrease,-0.18,Negative,Realizes Apple products nothing good software pretty package
573,2008-09-03T17:00:00,decrease,-0.18,Positive,At Apple Store Always fun The gym next
574,2008-09-03T17:00:00,decrease,-0.18,Negative,iPod Crisis Restore seems upset apple cart
575,2008-09-03T17:00:00,decrease,-0.18,Positive,Finally apple orchards producing around Looking newold dishes try fall
576,2008-09-03T17:00:00,decrease,-0.18,Negative,WTF Why didnt anyone tell Apple Mail threaded conversations view This awesome
577,2008-09-03T17:00:00,decrease,-0.18,Negative,gets point cool enough u need anythin apple google release stupid
578,2008-09-03T17:00:00,decrease,-0.18,Positive,Eating apple tart breakfast Nyom
579,2008-09-03T17:00:00,decrease,-0.18,Positive,seemed like good idea us 2am sack 24 crystal burgers 4 large fries 3 large chicken chunks apple turnover
580,2008-09-03T17:00:00,decrease,-0.18,Positive,sweet manfinally got issues apple resolved
581,2008-09-03T17:00:00,decrease,-0.18,Negative,opted apple emails however I wanted opt email students onlyI dont think allow
582,2008-09-03T17:00:00,decrease,-0.18,Negative,In Big Apple today
583,2008-09-03T17:00:00,decrease,-0.18,Positive,This golden delicious apple isnt delicious Who earth likes spongy apples
584,2008-09-03T17:00:00,decrease,-0.18,Negative,Life hard MacBook died The Apple Authorised Service Partner offers ray hope though
585,2008-09-03T17:00:00,decrease,-0.18,Positive,Apple chance shine Implement Chromes tab behaviors Safari could win users
586,2008-09-03T17:00:00,decrease,-0.18,Negative,Wondering Apple show 9th cant wait
587,2008-09-03T17:00:00,decrease,-0.18,Negative,Whats ATT I pay lot plan Apple gave 3 free months mobileme issues ATT follows suit
588,2008-09-03T17:00:00,decrease,-0.18,Negative,Recreated Apple keyboard chipboard Major pita I dont wan na see chipboard llong time Crit went pretty well though
589,2008-09-03T17:00:00,decrease,-0.18,Negative,Cant connect wmy new iPhone Fuck Apple Experience sux I cant connect iNet email Tried resets nwork device nuthin
590,2008-09-03T17:00:00,decrease,-0.18,Negative,wondering Apple gon na release new MacBook model next week
591,2008-09-03T17:00:00,decrease,-0.18,Positive,When become The Applerumorguy
592,2008-09-03T17:00:00,decrease,-0.18,Negative,Oh reason Chrome isnt Linux Apparently built Apples WebKit Safari libs arent Linux
593,2008-09-03T17:00:00,decrease,-0.18,Negative,Same reason never got BSplines Shake Someone Apple simply hates us
594,2008-09-03T17:00:00,decrease,-0.18,Negative,When getting fixed Did call Apple
595,2008-09-03T17:00:00,decrease,-0.18,Negative,LOLOL Next itll apple cozycozies Ridic
596,2008-09-03T17:00:00,decrease,-0.18,Positive,ohmystarsits getting 80 today Currently 64 My windows open My apple pie candles burning fresh coffee
597,2008-09-03T17:00:00,decrease,-0.18,Negative,Dear Apple Inc Why charger never MacBook I walk least THREE steps
598,2008-09-03T17:00:00,decrease,-0.18,Positive,Lily I sharing apple tree Yum
599,2008-09-03T17:00:00,decrease,-0.18,Positive,midmorning snack organic apple halfcup blueberries almonds
600,2013-11-05T17:00:00,neutral,0.01,Negative,RT Hey Apple fuck Cupertino
601,2013-11-05T17:00:00,neutral,0.01,Negative,hey I apple That left car Lmao
602,2013-11-05T17:00:00,neutral,0.01,Positive,Dear Skittles Please change green skittles back Lime Green Apple awful Thank youZamboni
603,2013-11-05T17:00:00,neutral,0.01,Negative,You realize Google doesnt make apps windows RTphone MS makes apps Apple OSX iOS Android
604,2013-11-05T17:00:00,neutral,0.01,Negative,dont need Apple TV air server work highawk
605,2013-11-05T17:00:00,neutral,0.01,Negative,Have tried magic handshake I thought 4 GB Nano dead amp gone came back Check Apple Support reset deets
606,2013-11-05T17:00:00,neutral,0.01,Negative,apple wasnt trying make phones masses What made techie phone
607,2013-11-05T17:00:00,neutral,0.01,Negative,So paid 1 billion dollars due nickels 😭😂😭😂😭😂😭😂
608,2013-11-05T17:00:00,neutral,0.01,Negative,Stressing cause cant decide many apple ciders buy today 😖 daily struggle
609,2013-11-05T17:00:00,neutral,0.01,Negative,sound like need ride apple store
610,2013-11-05T17:00:00,neutral,0.01,Positive,aww well try
611,2013-11-05T17:00:00,neutral,0.01,Negative,I freaking hate Apple
612,2013-11-05T17:00:00,neutral,0.01,Positive,RT Eve herbed Adam eating apple triflinghoe
613,2013-11-05T17:00:00,neutral,0.01,Negative,I That would nice Haha If Apple store within 3 hours Id go talk someone theres
614,2013-11-05T17:00:00,neutral,0.01,Positive,Hahaha feeling RT Bakedlike apple pie baby
615,2013-11-05T17:00:00,neutral,0.01,Positive,RT future big apple
616,2013-11-05T17:00:00,neutral,0.01,Positive,RT The Apple Store employee said Congrats new iPad like I baby Then certainly cost enough t…
617,2013-11-05T17:00:00,neutral,0.01,Negative,thangs horrible Im Apple orange type nigga
618,2013-11-05T17:00:00,neutral,0.01,Positive,Im trying make caramel apple pie cookies I saw though
619,2013-11-05T17:00:00,neutral,0.01,Positive,1110 sis bday TurnUp apple juice Haha
620,2013-11-05T17:00:00,neutral,0.01,Negative,Im gon na cry longer apple cider season 🍎☕️
621,2013-11-05T17:00:00,neutral,0.01,Negative,This nigga damn liar got honest The apple never falls far tree
622,2013-11-05T17:00:00,neutral,0.01,Negative,Brought cherry poor tart 😑 shit apple cinnamon 😑😑😑😑😑
623,2013-11-05T17:00:00,neutral,0.01,Positive,Apple inks 578 million deal sapphire production The company signed deal GT Advanced Technologies produce
624,2013-11-05T17:00:00,neutral,0.01,Negative,Nike Move M7ready app available put paces The app unveiled Apples iPhone 5S event September allow
625,2013-11-05T17:00:00,neutral,0.01,Negative,RT I cant believe years VS fantasy bra 10 million dollars
626,2013-11-05T17:00:00,neutral,0.01,Positive,RT The Apple Store employee said Congrats new iPad like I baby Then certainly cost enough t…
627,2013-11-05T17:00:00,neutral,0.01,Negative,apple
628,2013-11-05T17:00:00,neutral,0.01,Negative,Organic apple breakfast daily keeps doc away
629,2013-11-05T17:00:00,neutral,0.01,Positive,Friesapple juice♥
630,2013-11-05T17:00:00,neutral,0.01,Negative,Fuck yall I got apple cider
631,2013-11-05T17:00:00,neutral,0.01,Negative,This apple woke
632,2013-11-05T17:00:00,neutral,0.01,Negative,“ You wan na buy apple bees ” Lol Yeah Baby
633,2013-11-05T17:00:00,neutral,0.01,Positive,1st Thing Ima Do When I Get Them Off Is Eat An AppleHavent Had One In 2 Years Way I See ItAn Apple Is Made To Bite Not That SpoonFed Shit
634,2013-11-05T17:00:00,neutral,0.01,Negative,ITS 2013 APPLE SHOULD BE MAKING THERE SHIT WATERPROOF ALREADY INSTEAD OF COLORFUL LIKE WTH IS THIS IM SUING
635,2013-11-05T17:00:00,neutral,0.01,Positive,“ SOMEONE COME WATCH NETFLIX WITH ME ALL DAY AND CUDDLE AND EAT CARMEL APPLE POPS K THANKS ”
636,2013-11-05T17:00:00,neutral,0.01,Positive,Everything say Siri iPhone sent Apple Apple right share
637,2013-11-05T17:00:00,neutral,0.01,Positive,yeah I personally think Apple makes way better wallpapers Google
638,2013-11-05T17:00:00,neutral,0.01,Positive,DO U PREFER PUMPKIN PIE OR APPLE
639,2013-11-05T17:00:00,neutral,0.01,Positive,Chicken nuggets apples butter butters life
640,2013-11-05T17:00:00,neutral,0.01,Negative,dont even bother guy Apple brainwashed beyond recovery
641,2013-11-05T17:00:00,neutral,0.01,Positive,Eve herbed Adam eating apple triflinghoe
642,2013-11-05T17:00:00,neutral,0.01,Positive,DO U PREFER PUMPKIN PIE OR APPLE
643,2013-11-05T17:00:00,neutral,0.01,Negative,My Sony headphones didnt even last long crappy Apple ones come new phone NotCool
644,2013-11-05T17:00:00,neutral,0.01,Positive,DO U PREFER PUMPKIN PIE OR APPLE
645,2013-11-05T17:00:00,neutral,0.01,Negative,iPod Touch conks 2nd time less 18 months Had replace iPad early yr Apples verge losing fan boy
646,2013-11-05T17:00:00,neutral,0.01,Negative,Im switching Android Apple 4 years I vote iPhone
647,2013-11-05T17:00:00,neutral,0.01,Negative,Just fucking devoured apple nobraces noproblems
648,2013-11-05T17:00:00,neutral,0.01,Negative,I want white woman bake apple pies sit window dog fuck Ya know American dream
649,2013-11-05T17:00:00,neutral,0.01,Negative,yoooo Write I need ur Apple ID password ASAP dm
650,2013-11-05T17:00:00,neutral,0.01,Positive,MFI partner asking Apple
651,2013-11-05T17:00:00,neutral,0.01,Positive,hero brining apple class LoveYou AnAppleADay
652,2013-11-05T17:00:00,neutral,0.01,Negative,Apple smoothie disgusting
653,2013-11-05T17:00:00,neutral,0.01,Positive,I see reason apple crisp shouldnt acceptable breakfast Fruit oatmeal ftw It
654,2013-11-05T17:00:00,neutral,0.01,Positive,RAW STAR CAFE Specials Today Mango Cheesecake Vegan Raw GlutenFree Creamed Spinach Rice Apple Pie Smoothie amp Eggnog
655,2013-11-05T17:00:00,neutral,0.01,Positive,RT Using iPad plane takes feels funny like first time paid stuff apple store app walke…
656,2013-11-05T17:00:00,neutral,0.01,Negative,grr sysco parked outside apple flashbacks ptsd GMTsummerstaff
657,2013-11-05T17:00:00,neutral,0.01,Positive,Adding idevices already established ecosystem phew confusing adventure maze Apple
658,2013-11-05T17:00:00,neutral,0.01,Negative,mine Pi especially Apple
659,2013-11-05T17:00:00,neutral,0.01,Negative,My iPhone express emotions What Well done apple 👌
660,2013-11-05T17:00:00,neutral,0.01,Negative,RT When Apple finally enables WebGL Safari iOS I seriously think pixijs going eat appstore breakfast
661,2013-11-05T17:00:00,neutral,0.01,Positive,I wont happy unless Apple replaces Siris voice Morgan Freemans
662,2013-11-05T17:00:00,neutral,0.01,Negative,My boy “ Bakedlike apple pie baby ”
663,2013-11-05T17:00:00,neutral,0.01,Positive,prefer pumpkin pie apple
664,2013-11-05T17:00:00,neutral,0.01,Negative,Apple TV class 👍
665,2013-11-05T17:00:00,neutral,0.01,Positive,RT Officially block number iPhone Thank apple feature
666,2013-11-05T17:00:00,neutral,0.01,Positive,Missed google apple If invested 1000 Amazon 1997 youd 239045 richer
667,2013-11-05T17:00:00,neutral,0.01,Positive,prefer pumpkin pie apple
668,2013-11-05T17:00:00,neutral,0.01,Negative,Really want toffee apple🍭🍎
669,2013-11-05T17:00:00,neutral,0.01,Negative,Apple inconsiderate AF give least mute feature groups
670,2013-11-05T17:00:00,neutral,0.01,Positive,RT An onion apple potato taste The differences flavour caused smell
671,2013-11-05T17:00:00,neutral,0.01,Positive,go ahead drink Mountain Dew eat red lobster front Straight shot Adams apple
672,2013-11-05T17:00:00,neutral,0.01,Positive,Thanks Just wondering Apple stuff makes technosavvy go blind products P
673,2013-11-05T17:00:00,neutral,0.01,Negative,oh follow sheket apple lel asafgama3aaaaaaaaaa fee apple gedeed nezel ismo apple air naal fee america bas nezelshi fee il suadiya
674,2013-11-05T17:00:00,neutral,0.01,Positive,prefer pumpkin pie apple
675,2013-11-05T17:00:00,neutral,0.01,Negative,So excited tonight Even though Ill end cold move hands runny nose toffee apple stuck hair
676,2013-11-05T17:00:00,neutral,0.01,Positive,prefer pumpkin pie apple
677,2013-11-05T17:00:00,neutral,0.01,Negative,I want another Carmel Apple 😫
678,2013-11-05T17:00:00,neutral,0.01,Negative,sad life
679,2013-11-05T17:00:00,neutral,0.01,Positive,Blackberry green apple Surprisingly good
680,2013-11-05T17:00:00,neutral,0.01,Positive,Eating apple shower magical
681,2013-11-05T17:00:00,neutral,0.01,Positive,prefer pumpkin pie apple
