id,date,class,percent,sentiment,text
479,2013-11-04T17:00:00,decrease,-0.24,Positive,On brighter note also looking expanding partnership Tesla
480,2013-11-04T17:00:00,decrease,-0.24,Positive,Nikola Tesla one brilliant men walk earth
481,2013-11-04T17:00:00,decrease,-0.24,Positive,RT What one man calls God another calls laws physicsNikola Tesla
482,2013-11-04T17:00:00,decrease,-0.24,Positive,Buffett previous invested China BYD electric motor benefited Tesla motor success Chinesegovt green policy PE damn high la
483,2013-11-04T17:00:00,decrease,-0.24,Negative,Tesla disputed idea electrons subatomic particles Dint stop revolutionizing entire electricity field
484,2013-11-04T17:00:00,decrease,-0.24,Positive,If planet Tesla Model S Please find safe place stop exit vehicle
485,2013-11-04T17:00:00,decrease,-0.24,Positive,RT What one man calls God another calls laws physicsNikola Tesla
486,2013-11-04T17:00:00,decrease,-0.24,Positive,What one man calls God another calls laws physicsNikola Tesla
487,2013-11-04T17:00:00,decrease,-0.24,Positive,RT 326 Weight Tesla Roadster sports car measured gallon jugs water
488,2013-11-04T17:00:00,decrease,-0.24,Positive,Melody Hopson says Tesla stock fire Not best phrasing latest Tesla headlines
489,2013-11-04T17:00:00,decrease,-0.24,Positive,Edmundscom Tesla Model S top selling car among wealthest Americans Mercedes 2 followed JeepGrandCherokee
490,2013-11-04T17:00:00,decrease,-0.24,Negative,I want one radial tires tesla battery pack Wan na
491,2013-11-04T17:00:00,decrease,-0.24,Positive,Ive never car person I still dont necessitate owning car near future wow Tesla Model S dreamcar
492,2013-11-04T17:00:00,decrease,-0.24,Positive,New survey shows Tesla Model S mostregistered car 8 top 25richest zip codes Beat 98 Civic still mostpopular driveway
493,2013-11-04T17:00:00,decrease,-0.24,Positive,How Nicola Tesla still majorly unknown baffles
494,2013-11-04T17:00:00,decrease,-0.24,Positive,Music means lot like love I make I Tesla
495,2013-11-04T17:00:00,decrease,-0.24,Positive,Congrats Woz Welcome Tesla club RT Here pick new car w 2 others
496,2013-11-04T17:00:00,decrease,-0.24,Negative,Teslatrivia 1909 Nikola Tesla claims Martians trying contact via wireless transmitter👽
497,2013-11-04T17:00:00,decrease,-0.24,Positive,TeslaFunnies Nikola Tesla walked bar Thomas Edison got credit tweet funnies RT
498,2013-11-04T17:00:00,decrease,-0.24,Positive,TeslaFacts Nikola Tesla without question genius He spoke eight languages He could memorize entire books recite
499,2013-11-04T17:00:00,decrease,-0.24,Positive,Shout recommending good book Tesla See tweets title Pledge4Tesla
500,2012-07-16T17:00:00,decrease,-0.18,Positive,Have Tesla showroom Park Meadows Mall The Tesla Model S nice
501,2012-07-16T17:00:00,decrease,-0.18,Positive,1Hour Interview With Elon Musk Tesla SolarCity Electric Planes Fool Cells Lots More Portrait entrepreneur work
502,2012-07-16T17:00:00,decrease,-0.18,Positive,Having Volt weekend made want til I afford Tesla It really enticing
503,2012-07-16T17:00:00,decrease,-0.18,Negative,Tesla isnt bad Not factor gas costs couple years Just depends keep charged
504,2012-07-16T17:00:00,decrease,-0.18,Positive,New Goal Life make enough money buy Tesla Roadster quickest car Ive ever Electric one gear GO SoFast
505,2012-07-16T17:00:00,decrease,-0.18,Positive,Yeah I cant imagine writing check Tesla Egads expensive
506,2012-07-16T17:00:00,decrease,-0.18,Positive,I TELL HER TO SUCK ON THAT TESLA COIL
507,2012-07-16T17:00:00,decrease,-0.18,Positive,I WILL BE WITH THE BOTH OF YOU SPLASHING AROUND IN GLEE UNTIL 2014
508,2012-07-16T17:00:00,decrease,-0.18,Positive,Christian Bale Nicholas Cage attached Tesla Project rivalry Thomas EdisonA pseudo Prestige 2 Gimmie
509,2012-07-16T17:00:00,decrease,-0.18,Positive,haha taught well RT Martin terrible show
510,2012-07-16T17:00:00,decrease,-0.18,Positive,ever since chicken little said sky fallin upon head told self wonnnnderful world Tesla
511,2012-07-16T17:00:00,decrease,-0.18,Negative,I REALLY need watch West Wing I guess D
512,2012-07-16T17:00:00,decrease,-0.18,Positive,listening 2 Late 4 Love Tesla
513,2012-07-16T17:00:00,decrease,-0.18,Negative,I love electricity Tesla I LOVE air conditioning
514,2012-07-16T17:00:00,decrease,-0.18,Positive,F JpMorgan could free energe since 1920 via Nikola Tesla
515,2012-07-16T17:00:00,decrease,-0.18,Positive,Tesla would fucking drawer full Higgs Boson sayin Mark Copyranter
516,2012-07-16T17:00:00,decrease,-0.18,Positive,’ industry watcher check 2012 Tesla Model S 2014 Chevrolet Impala pensacola newride
517,2012-07-16T17:00:00,decrease,-0.18,Positive,“ Fuck Joey And fuck Tesla ” Joey
518,2012-07-16T17:00:00,decrease,-0.18,Positive,RT Oscar Wilde knew sht said “ women meant loved understood ” ELLA CERON
519,2012-07-16T17:00:00,decrease,-0.18,Positive,RT Coming someday A Tesla electric pickup truck Tesla head designer Franz Von HolzhausenWith Model S launch h
520,2012-07-16T17:00:00,decrease,-0.18,Negative,So Illuminati want us peaceful ETs tell us Teslas science whacked media crap
521,2012-07-16T17:00:00,decrease,-0.18,Positive,Think Ive seen two ever RT Not every day see Tesla roadneedless say I couldnt get pic They flying
522,2012-07-16T17:00:00,decrease,-0.18,Positive,loooool Im awesome
523,2012-07-16T17:00:00,decrease,-0.18,Positive,Ill meet Tesla ifIgobackintime
524,2012-07-16T17:00:00,decrease,-0.18,Positive,Illuminati speak benevolent extraterrestrial intervention Reality Teslas hidden work Peace Earth Jesus Christ interested
525,2012-07-16T17:00:00,decrease,-0.18,Positive,obsessed creature black lagoon kid My bro I used spend hours making models Makes
526,2012-07-16T17:00:00,decrease,-0.18,Positive,Really Please god yes brb going find
527,2012-07-16T17:00:00,decrease,-0.18,Positive,ah I c I thought going bring amazing news Tesla wanted update godawful lightning T logo
528,2012-07-16T17:00:00,decrease,-0.18,Positive,Thanks Im based UK Ill anywhere people willing pay travel
529,2012-07-16T17:00:00,decrease,-0.18,Positive,Company I work sells wholesales sometimes designs electrical connectors WIlliams Tesla clearly want
530,2012-07-16T17:00:00,decrease,-0.18,Positive,I asked bro high places okay make working hand held tesla coillike prop
531,2012-07-16T17:00:00,decrease,-0.18,Negative,haha I miss I back around early august summer plans
532,2012-07-16T17:00:00,decrease,-0.18,Positive,Tesla designer tips BMW 3series rival 2015 Tesla originally kicked production electric vehicle line R
533,2012-07-16T17:00:00,decrease,-0.18,Positive,2 interesting enquiries come work email inbox past days One Williams Hybrid Technology another Tesla
534,2012-07-16T17:00:00,decrease,-0.18,Positive,Thomas Edison evil You quote Nikola Tesla
535,2012-07-16T17:00:00,decrease,-0.18,Positive,Tesla Fisker Havent driven Tesla yet But Fiskers bad 😁
536,2012-07-16T17:00:00,decrease,-0.18,Positive,Congrats Budapest incredible Hospital Rock Memento Park Elektrotechnikai Museum working Tesla Coil
537,2012-07-16T17:00:00,decrease,-0.18,Negative,thats way put hair ur chest lol
538,2012-07-16T17:00:00,decrease,-0.18,Positive,Just drove Tesla Model S past week end Get AmpedRoadshow Unbelievable car Cant wait get it…
539,2012-07-16T17:00:00,decrease,-0.18,Negative,I cant believe let people close type massive discharge tesla coils
540,2012-07-16T17:00:00,decrease,-0.18,Positive,Complete TESLA ACTION
541,2012-07-16T17:00:00,decrease,-0.18,Positive,Now Playing Tesla The Gate Invited Presented The RaED13 Radio Network
542,2012-07-16T17:00:00,decrease,-0.18,Positive,Ever seen Doctor Tesla room Coincidence
543,2012-07-16T17:00:00,decrease,-0.18,Positive,Seconded RT Speaking Doctor Who hasnt Doctor paid Tesla visit yet Please make happen Ktnxbai
544,2012-07-16T17:00:00,decrease,-0.18,Positive,listening Were No Good Together Tesla
545,2012-07-16T17:00:00,decrease,-0.18,Positive,gon na get coffee thanks reminder
546,2012-07-16T17:00:00,decrease,-0.18,Positive,thnkx lol
547,2012-07-16T17:00:00,decrease,-0.18,Positive,ask nicely really want work hate Tesla go titsup
548,2012-07-16T17:00:00,decrease,-0.18,Negative,“ We build tear Most work resource squanderedEverywhere theres appalling loss time effort amp life ” Tesla
549,2012-07-16T17:00:00,decrease,-0.18,Positive,metal head youll need TeslaModern Day Cowboy highlyrecommended
550,2012-07-16T17:00:00,decrease,-0.18,Positive,Saw Tesla Roadster morning Heard go 060 Sounded like whisper
551,2012-07-16T17:00:00,decrease,-0.18,Positive,“ Elon Musk My proceeds PayPal 180m I put 100m SpaceX 70m Tesla amp 10m Solar City I borrow money rent
552,2012-07-16T17:00:00,decrease,-0.18,Positive,google pliss
553,2012-07-16T17:00:00,decrease,-0.18,Positive,RT Elon Musk My proceeds PayPal 180m I put 100m SpaceX 70m Tesla amp 10m Solar City I
554,2012-07-16T17:00:00,decrease,-0.18,Positive,“ 4Wigans Ali AlHabsi made twice many penalty saves goalkeeper PL last season Spiderish ”
555,2012-07-16T17:00:00,decrease,-0.18,Positive,jar cookies
556,2012-07-16T17:00:00,decrease,-0.18,Positive,thank u I say something nice bs inshalla nap looooool
557,2012-07-16T17:00:00,decrease,-0.18,Negative,David Bowie turned Tesla cit CTA mentor
558,2012-07-16T17:00:00,decrease,-0.18,Positive,start saying nice things lol
559,2012-07-16T17:00:00,decrease,-0.18,Positive,RT Elon Musk My proceeds PayPal 180m I put 100m SpaceX 70m Tesla amp 10m Solar City I
560,2012-07-16T17:00:00,decrease,-0.18,Positive,RT Elon Musk My proceeds PayPal 180m I put 100m SpaceX 70m Tesla amp 10m Solar City I
561,2012-07-16T17:00:00,decrease,-0.18,Negative,friendship truly based money Sharof fix
562,2012-07-16T17:00:00,decrease,-0.18,Positive,Saw Tesla Roadster Btown yesterday nice looking expensive electric car
563,2012-07-16T17:00:00,decrease,-0.18,Positive,If want find secrets Universe think terms energy frequency vibration Nikola Tesla quotes
564,2012-07-16T17:00:00,decrease,-0.18,Positive,RT Kates always fave Tesla Magnus Top 3 badasses ever Kates bby though
565,2012-07-16T17:00:00,decrease,-0.18,Negative,10 mins left see dear bed
566,2012-07-16T17:00:00,decrease,-0.18,Positive,Kates always fave Tesla Magnus Top 3 badasses ever Kates bby though
567,2012-07-16T17:00:00,decrease,-0.18,Negative,I want sleep
568,2012-07-16T17:00:00,decrease,-0.18,Positive,Yes DPA wait Tesla get Bulgaria ORas work hard accelerate
569,2012-07-16T17:00:00,decrease,-0.18,Positive,RT Elon Musk My proceeds PayPal 180m I put 100m SpaceX 70m Tesla amp 10m Solar City I
570,2012-07-16T17:00:00,decrease,-0.18,Negative,RT 11 year olds today Omg Iove smokin pot I get like drunk YOLO Me I 11 I forgot feed tamagotchi
571,2012-07-16T17:00:00,decrease,-0.18,Positive,lately I would prefer tesla roadster But I may little bias bro lead tesla engineer
572,2012-07-16T17:00:00,decrease,-0.18,Positive,RT Tesla would fuck­ing draw­er full Higgs Bosons sayin
573,2012-07-16T17:00:00,decrease,-0.18,Positive,Mr Zinsp Tesla Coil He must know stuff mediawatch
574,2012-07-16T17:00:00,decrease,-0.18,Positive,Listened HowStuffWorks podcast Nikola Tesla walk home last night Thanks suggestion
575,2012-07-16T17:00:00,decrease,-0.18,Positive,lool
576,2012-07-16T17:00:00,decrease,-0.18,Positive,progress
577,2012-07-16T17:00:00,decrease,-0.18,Positive,Respect Elon Musk Proceeds PayPal 180m I put 100m SpaceX 70m Tesla 10m Solar City Borrowed money rent
578,2012-07-16T17:00:00,decrease,-0.18,Positive,NP Better odd without Tesla
579,2012-07-16T17:00:00,decrease,-0.18,Positive,The present future I really worked mine nikola tesla
580,2012-07-16T17:00:00,decrease,-0.18,Positive,RT I sure Love Peter Cushing heroes
581,2012-07-16T17:00:00,decrease,-0.18,Positive,nowplaying 「twisted wires」by TESLA！
582,2012-07-16T17:00:00,decrease,-0.18,Positive,brother The one thats always silent
583,2012-07-16T17:00:00,decrease,-0.18,Negative,vaccine side effects sharifas brothers experience
584,2012-07-16T17:00:00,decrease,-0.18,Positive,I sure Love Peter Cushing heroes
585,2012-07-16T17:00:00,decrease,-0.18,Positive,Thank great day
586,2012-07-16T17:00:00,decrease,-0.18,Positive,thankyou much hope well
587,2012-07-16T17:00:00,decrease,-0.18,Positive,first story asmas rabies shot
588,2012-07-16T17:00:00,decrease,-0.18,Positive,I wonder world would like Nikolas Tesla managed provide everyone free electricity
589,2012-07-16T17:00:00,decrease,-0.18,Positive,RT Cruising around Lake Isabella propeller came boat Its gone Didnt hit anything Boat experts c
590,2012-07-16T17:00:00,decrease,-0.18,Negative,haram maybe fakrt 3mreha scorpion Y would cat die scrarching someone
591,2012-07-16T17:00:00,decrease,-0.18,Positive,You love dont lie
592,2012-07-16T17:00:00,decrease,-0.18,Positive,hahahaa thats sad funny ur bro poisenessis ok
593,2012-07-16T17:00:00,decrease,-0.18,Negative,mean ppl Im waiting seconed rabies shotim bored
594,2012-07-16T17:00:00,decrease,-0.18,Negative,Why much metal face next tesla coil eyebrows antenna hair extention volt metre necklace end
595,2012-07-16T17:00:00,decrease,-0.18,Positive,Tesla invented electric motor Look greatest alchemist ever William Wollaston century earlier amp much
596,2012-07-16T17:00:00,decrease,-0.18,Positive,would something Id read
597,2012-07-16T17:00:00,decrease,-0.18,Positive,RT Lady train far explained Tesla murdered Big Oil inventing free energy expansion Sun des
598,2012-07-16T17:00:00,decrease,-0.18,Positive,Order 2013 Tesla S make sure get one A 20k production run It First Come basis18552272662
599,2012-07-16T17:00:00,decrease,-0.18,Negative,I want Puff sleep Tesla yanooo doesnt want says goes WhippedLyfe
600,2011-04-04T17:00:00,neutral,0.02,Positive,great articleabt 356 tesla decent concept way expensive make sort real statement abt env
601,2011-04-04T17:00:00,neutral,0.02,Negative,I would also argue without Teslas contributions electricity science much modern world would possible
602,2011-04-04T17:00:00,neutral,0.02,Positive,Tesla recognized benefit inventions would provide world would rather good capitalize
603,2011-04-04T17:00:00,neutral,0.02,Positive,yup Thinking getting mine week tesla drops
604,2011-04-04T17:00:00,neutral,0.02,Positive,Do ever expect Illuminati things Tesla way Not past World Secret Government anyone know located
605,2011-04-04T17:00:00,neutral,0.02,Positive,Yeah Lotus uses fuel efficient Toyota 4banger Tesla uses shitton rare earth metals
606,2011-04-04T17:00:00,neutral,0.02,Positive,Didnt Toyota buy Tesla Why hell I think besides obvious answer Im numpty tosser
607,2011-04-04T17:00:00,neutral,0.02,Positive,If anything praised Tesla Simply saying needs work price needs drop
608,2011-04-04T17:00:00,neutral,0.02,Negative,Got email today Nikola Tesla father electricity Apparently found way email grave
609,2011-04-04T17:00:00,neutral,0.02,Negative,On Teslas induction motor Comments
610,2011-04-04T17:00:00,neutral,0.02,Positive,Give Tesla PBmonday
611,2011-04-04T17:00:00,neutral,0.02,Positive,I rewatched Tesla episode I dont see anything wrong It honest journalism I tell
612,2011-04-04T17:00:00,neutral,0.02,Positive,Watched video Tesla EE class So nifty
613,2011-04-04T17:00:00,neutral,0.02,Positive,Can anyone recommend good book Nikola Tesla If dry I never make want read
614,2011-04-04T17:00:00,neutral,0.02,Positive,nowplayin Tribute To Tesla Boy Mixtape Tracasseur Putting download tomorrow Soooooo good
615,2011-04-04T17:00:00,neutral,0.02,Positive,I think technology exciting Would love drive write Tesla Porsche GT3R Hyrbid
616,2011-04-04T17:00:00,neutral,0.02,Positive,LOL Tesla suing TopGear telling truth I doubt know bunch bitches makes look like
617,2011-04-04T17:00:00,neutral,0.02,Positive,GM F April American car month tesla GM F 5 since recommend last week buying pressure
618,2011-04-04T17:00:00,neutral,0.02,Positive,OMFG Where I start FY Normandy John HAIR VAMPIRE Tesla Sanctuary
619,2011-04-04T17:00:00,neutral,0.02,Positive,Just spotted Tesla downtown Bethesda first time
620,2011-04-04T17:00:00,neutral,0.02,Positive,Hello everyone Its monday I excitied First batch thunderbolt ROMS come week looking forward tesla android
621,2011-04-04T17:00:00,neutral,0.02,Positive,Dio Night Ranger Dangerous Toys Tesla Nitro Black Blue Keel KISS Steelheart Winger
622,2011-04-04T17:00:00,neutral,0.02,Positive,Love find way nowplaying Tesla Love Song
623,2011-04-04T17:00:00,neutral,0.02,Positive,Theres tesla front
624,2011-04-04T17:00:00,neutral,0.02,Positive,Oh Oakleys broke moments Tesla Roadster test drive
625,2011-04-04T17:00:00,neutral,0.02,Positive,Tengkyu spencer Enjoy closing photos
626,2011-04-04T17:00:00,neutral,0.02,Positive,TESLACINDELLAGREAT WHITE
627,2011-04-04T17:00:00,neutral,0.02,Positive,Tesla Generator The Unique Solution To Yield Your Personal Electricity
628,2011-04-04T17:00:00,neutral,0.02,Positive,What choice Im aware Fisker Tesla anyone else
629,2011-04-04T17:00:00,neutral,0.02,Positive,Tesla CEO Elon Musk holding press conference DC week
630,2011-04-04T17:00:00,neutral,0.02,Positive,Its way way goes Happen day day tesla
631,2011-04-04T17:00:00,neutral,0.02,Positive,Little suzis edge tesla
632,2011-04-04T17:00:00,neutral,0.02,Positive,Wonder whether thatll Tesla
633,2011-04-04T17:00:00,neutral,0.02,Positive,♫ Listening Cover Queen Tesla ♫ iTweetMyTunes
634,2011-04-04T17:00:00,neutral,0.02,Negative,This ongoing Tesla claim ego may get slightly punctured
635,2011-04-04T17:00:00,neutral,0.02,Positive,Tesla vs Top Gear Executive Producer Andy Wilman speaks via
636,2011-04-04T17:00:00,neutral,0.02,Positive,The Tesla line vehicles
637,2011-04-04T17:00:00,neutral,0.02,Positive,I Wan na Live Tesla
638,2011-04-04T17:00:00,neutral,0.02,Positive,Is kind nerdy supervillain website get tesla coils blinky dials
639,2011-04-04T17:00:00,neutral,0.02,Positive,I think hes probably got worry Tesla suing anything else
640,2011-04-04T17:00:00,neutral,0.02,Positive,RT enjoying dinner Tesla charges drop Thought EV impossible
641,2011-04-04T17:00:00,neutral,0.02,Positive,And let Tesla Manaf Effendi Mahagotra Ganesha Bali ease night JazzBalinese act
642,2011-04-04T17:00:00,neutral,0.02,Positive,sort get impression Tesla using case way generate publicityallegedly opinion etc
643,2011-04-04T17:00:00,neutral,0.02,Positive,Its whatcha got whatcha give It aint life choose Its life live Tesla
644,2011-04-04T17:00:00,neutral,0.02,Positive,Tesla Vegetarian least possibly Vegan loved pigeons The marvellous Macak cat best wishes Edward
645,2011-04-04T17:00:00,neutral,0.02,Positive,everyone know mighty name Pearse I actually look lot like I love Tesla fav inventor Pearse
646,2011-04-04T17:00:00,neutral,0.02,Positive,Ah see friend fifty yearsTesla remembered crappy american cars NZ world leaders
647,2011-04-04T17:00:00,neutral,0.02,Positive,Nigga I saw lmao EVER compare Drake lyric I kill
648,2011-04-04T17:00:00,neutral,0.02,Negative,Nope Photos going happen tonight Another strikeout It Makes want build Tesla Coil I make lightning shoot
649,2011-04-04T17:00:00,neutral,0.02,Negative,thta tesla card beast 448 cuda cores
650,2011-04-04T17:00:00,neutral,0.02,Positive,RT luckily discussion stagebc getting engaged chick get drawls iwatchedfreshprince
651,2011-04-04T17:00:00,neutral,0.02,Positive,seen references Teslawhats actual story TG invents story breakdownrunning juice summit
652,2011-04-04T17:00:00,neutral,0.02,Positive,The present future I really worked mine Nikola Tesla
653,2011-04-04T17:00:00,neutral,0.02,Positive,Re memorable mustaches dont forget Nikola Tesla
654,2011-04-04T17:00:00,neutral,0.02,Positive,Oh Please bitch Im Tesla
655,2011-04-04T17:00:00,neutral,0.02,Positive,Now playing Little Suzi Tesla
656,2011-04-04T17:00:00,neutral,0.02,Negative,Damn Skylar looks like American version certain Emoryite
657,2011-04-04T17:00:00,neutral,0.02,Positive,Youd think Tesla Motors companies wouldnt resort things
658,2011-04-04T17:00:00,neutral,0.02,Positive,dad lent biography Tesla OMG awesome
659,2011-04-04T17:00:00,neutral,0.02,Positive,Im suprise roms build yet RT ROM Tesla Coil ASOP Like Comming soon looks interesting
660,2011-04-04T17:00:00,neutral,0.02,Positive,Member Phillip entered Tesla Coils chat room 102731 CDT Sunday April 3rd 2011
661,2011-04-04T17:00:00,neutral,0.02,Positive,Tesla coils cool
662,2011-04-04T17:00:00,neutral,0.02,Positive,honeycomb theme work Tesla
663,2011-04-04T17:00:00,neutral,0.02,Positive,Nicola Tesla wanted harness natural energy distribute free public Thomas Edison created regulated monopoly profit
664,2011-04-04T17:00:00,neutral,0.02,Positive,since got ipod tesla new rom im sticking P
665,2011-04-04T17:00:00,neutral,0.02,Positive,Matted Blues updated ready Tesla Coil
666,2011-04-04T17:00:00,neutral,0.02,Positive,Well looks like Tesla happen tomorrow earliest testes got RC1 tonight
667,2011-04-04T17:00:00,neutral,0.02,Positive,SIGNS signs everywhere signs Tesla
668,2011-04-04T17:00:00,neutral,0.02,Positive,Member Bart entered Tesla Coils chat room 95621 CDT Sunday April 3rd 2011
669,2011-04-04T17:00:00,neutral,0.02,Negative,lightning strikes twice Nikolai Tesla device
670,2011-04-04T17:00:00,neutral,0.02,Positive,I talking bout tbolt Tesla device release date forum I poem
671,2011-04-04T17:00:00,neutral,0.02,Positive,wat tesla
672,2011-04-04T17:00:00,neutral,0.02,Positive,Had roof Tesla today Of course snow started
673,2011-04-04T17:00:00,neutral,0.02,Negative,RT RT Tesla TBolt please dont install DX Damn lol P
674,2011-04-04T17:00:00,neutral,0.02,Positive,praying goes well teslas delivery Congratulations mari guapo yalls families
675,2011-04-04T17:00:00,neutral,0.02,Positive,You write lol RT Tesla TBolt please dont install DX
676,2011-04-04T17:00:00,neutral,0.02,Negative,Lobo hell yeah get Leslie ANY day
677,2011-04-04T17:00:00,neutral,0.02,Positive,saw tesla statue Niagara falls wknd Was gon na send pic decided Im considerate
678,2011-04-04T17:00:00,neutral,0.02,Positive,LLeslie RT could get team maya moore sue bird candace parker swin cash lisa leslie c get
679,2011-04-04T17:00:00,neutral,0.02,Positive,Last time I saw Tesla Coil charged Griffith Park Observatory 30 years ago LA
680,2011-04-04T17:00:00,neutral,0.02,Positive,Did post Tesla yet Or last tweet prerelease warning
681,2011-04-04T17:00:00,neutral,0.02,Positive,RT id play post defense maya moore day
682,2011-04-04T17:00:00,neutral,0.02,Positive,musing pulsed power also heartbeatwe look look think Tesla alternating current
683,2011-04-04T17:00:00,neutral,0.02,Negative,Oriemma whateva UConn Womens head coach
684,2011-04-04T17:00:00,neutral,0.02,Positive,I exited first I 2hr Tesla free rental decided ignore requests process
685,2011-04-04T17:00:00,neutral,0.02,Negative,CHEESE IT Son Flips table runs door RT fuck
686,2011-04-04T17:00:00,neutral,0.02,Positive,RT Tesla TBolt please dont install DX
687,2011-04-04T17:00:00,neutral,0.02,Negative,Fuckin watkins lmao
688,2011-04-04T17:00:00,neutral,0.02,Positive,LOL Thats bit like two 3 yr olds One hand fulltwo enough drive insane Heehee I luv Tesla tho
689,2011-04-04T17:00:00,neutral,0.02,Negative,Tesla TBolt please dont install DX
690,2011-04-04T17:00:00,neutral,0.02,Positive,Tesla vs Top Gear eh I dont know vote
691,2011-04-04T17:00:00,neutral,0.02,Positive,Tesla Love Song Now Thats What I Call Monster Ballads np
692,2011-04-04T17:00:00,neutral,0.02,Positive,64 fking dollars gas coupe BMW Would Tesla hurry release Model S HTFU
693,2011-04-04T17:00:00,neutral,0.02,Positive,LOL Tesla always seem handsy type XDDDD
694,2011-04-04T17:00:00,neutral,0.02,Positive,whats tesla
695,2011-04-04T17:00:00,neutral,0.02,Positive,Tesla electric vehicles poised enter mainstream
696,2011-04-04T17:00:00,neutral,0.02,Positive,Tesla Coil I big Nikola Tesla fan know beloved free communication everyone world
697,2011-04-04T17:00:00,neutral,0.02,Positive,Member Joe entered Tesla Coils chat room 73447 CDT Sunday April 3rd 2011
698,2011-04-04T17:00:00,neutral,0.02,Positive,wants test Tesla I could use like 5 six people
699,2011-04-04T17:00:00,neutral,0.02,Positive,love tesla edison aspect prestige
700,2015-08-31T17:00:00,neutral,0.02,Positive,tesla alright though
701,2015-08-31T17:00:00,neutral,0.02,Positive,Tesla Consumer Reports And Another Moment For The Elites
702,2015-08-31T17:00:00,neutral,0.02,Positive,God bless tesla
703,2015-08-31T17:00:00,neutral,0.02,Positive,looks iffy WT IT right addition potential tesla surprise Hard say tank may help
704,2015-08-31T17:00:00,neutral,0.02,Positive,Just passed Tesla factory Was slow get pic
705,2015-08-31T17:00:00,neutral,0.02,Negative,Lol tesla takes chew toys inside cage I found one sandals one pair leggings bottle water
706,2015-08-31T17:00:00,neutral,0.02,Positive,A world Tesla didnt squander funding personal research would one custom aurora borealis every city
707,2015-08-31T17:00:00,neutral,0.02,Positive,would recommend Tesla Leaf And I buy one around
708,2015-08-31T17:00:00,neutral,0.02,Positive,Million rand idea Tesla bakkie SouthAfrica
709,2015-08-31T17:00:00,neutral,0.02,Positive,Not words would hear uneducated American without Tesla WhitePrivilege
710,2015-08-31T17:00:00,neutral,0.02,Positive,Tesla probably fave ironic since shes actually replacement ghost Id originally planned
711,2015-08-31T17:00:00,neutral,0.02,Positive,No Tesla watch No
712,2015-08-31T17:00:00,neutral,0.02,Positive,Tesla Apple growth Sammy copying Trump I hat but… Nothing big Stratos I think FIFA implosion
713,2015-08-31T17:00:00,neutral,0.02,Negative,Note bloggers cover transportation issues There much write Tesla Motors
714,2015-08-31T17:00:00,neutral,0.02,Positive,hes bona fide tesla bear maybe
715,2015-08-31T17:00:00,neutral,0.02,Positive,news Teslas Musk takes page PayPal referral incentive
716,2015-08-31T17:00:00,neutral,0.02,Positive,A partnership Airbnb Tesla Motors provide charging stations number West Coast cities
717,2015-08-31T17:00:00,neutral,0.02,Negative,I think automatic Try turning phone see symbols screen turn
