id,date,class,percent,sentiment,text
0,2013-05-08T17:00:00,increase,0.65,Negative,thats big help Niagara Falls Power big deal need N Teslas help big money would dealt
1,2013-05-08T17:00:00,increase,0.65,Positive,Hottest stock around Tesla earnings afternoon Our tech reporter tweet numbers TSLA
2,2013-05-08T17:00:00,increase,0.65,Positive,Auto scene changing Seeing first time Tesla road amp mass market Jeep GC Hyundai Ford Focus amp Fusion hot Designrules
3,2013-05-08T17:00:00,increase,0.65,Positive,We spanish blog Nikola Tesla Please could help us RT
4,2013-05-08T17:00:00,increase,0.65,Positive,Hey I request song lunch hour Hang Tough Tesla Please 94 rock Thx guys
5,2013-05-08T17:00:00,increase,0.65,Negative,Waiting Teslas Q1 earnings announcement
6,2013-05-08T17:00:00,increase,0.65,Negative,I think miss sassy snapchat
7,2013-05-08T17:00:00,increase,0.65,Positive,ohh ur manager going ooo
8,2013-05-08T17:00:00,increase,0.65,Positive,I love Myka always goes real gun first tesla cases Definitely fits character well
9,2013-05-08T17:00:00,increase,0.65,Positive,Nicola Tesla copyright n trademark electricityD kind man world could better possible forms
10,2013-05-08T17:00:00,increase,0.65,Positive,Top go 2 lt3 songs Follow Through Every Rose Champagne High Love Song Tesla immasap
11,2013-05-08T17:00:00,increase,0.65,Positive,Its intense I break bull whips tesla coils xD
12,2013-05-08T17:00:00,increase,0.65,Positive,I dont think going help occasion ask perennial question What would Tesla
13,2013-05-08T17:00:00,increase,0.65,Positive,Illuminati controlled science Tesla went air ship building gotitdone
14,2013-05-08T17:00:00,increase,0.65,Positive,Tesla Model S lt My Dream Car
15,2013-05-08T17:00:00,increase,0.65,Negative,Teslas Musk talking Google autopilot cars Elon Musk chief executive officer Tesla Motors IncTesla Motors Inc Chief Ex
16,2013-05-08T17:00:00,increase,0.65,Positive,Scientist Nikola Teslas lab purchased science center tech
17,2013-05-08T17:00:00,increase,0.65,Positive,ahmedxenasut Scientist Nikola Teslas lab purchased science center
18,2013-05-08T17:00:00,increase,0.65,Positive,julaoncullor Scientist Nikola Teslas lab purchased science center
19,2013-05-08T17:00:00,increase,0.65,Positive,jeffaebrody Scientist Nikola Teslas lab purchased science center
20,2013-05-08T17:00:00,increase,0.65,Positive,I want Picture taken tesla
21,2013-05-08T17:00:00,increase,0.65,Positive,The man wrote time travel best friends Tesla I use time travel book reasons
22,2013-05-08T17:00:00,increase,0.65,Positive,Saw tesla roaming around neighborhood today westlake
23,2013-05-08T17:00:00,increase,0.65,Negative,Nikola Tesla died virgin another one historys finest
24,2013-05-08T17:00:00,increase,0.65,Positive,The Tesla electric car Googles selfdriving car D
25,2013-05-08T17:00:00,increase,0.65,Positive,RT Aww Tesla lookin nigga
26,2013-05-08T17:00:00,increase,0.65,Positive,Group The Oatmeal Raised Money For Successfully Purchases Nikola Teslas Lab
27,2013-05-08T17:00:00,increase,0.65,Positive,All Tesla earnings statement Sweet
28,2013-05-08T17:00:00,increase,0.65,Negative,Bout remind dirty laundry TrustIssues
29,2013-05-08T17:00:00,increase,0.65,Positive,From FampS saying approach new niche brands like BMW Tesla
30,2013-05-08T17:00:00,increase,0.65,Positive,Just spotted black Tesla Model S 5th Street downtown Cincy Who owns know
31,2013-05-08T17:00:00,increase,0.65,Positive,Just saw 77000 electric car Starbucks Tesla
32,2013-05-08T17:00:00,increase,0.65,Positive,I worked tesla I knew media spin company u think making money
33,2013-05-08T17:00:00,increase,0.65,Positive,Saw Tesla Roadster Btown yesterday nice looking expensive electric car
34,2013-05-08T17:00:00,increase,0.65,Positive,Filed EVPlugin Tesla MotorsOur friend Theophilus Chin thing creating Tesla vehicles cant Earlier
35,2013-05-08T17:00:00,increase,0.65,Positive,RT I saw 4 kids get Tesla Model S drop It modified two jump seats back seat 7 total
36,2013-05-08T17:00:00,increase,0.65,Positive,sdge energyshowcase What awesome morning Energy ShowcaseCheck Alt Fuel Vehiclestesla
37,2013-05-08T17:00:00,increase,0.65,Positive,I saw 4 kids get Tesla Model S drop It modified two jump seats back seat 7 total
38,2013-05-08T17:00:00,increase,0.65,Positive,Tesla CEO Talking With Google About ‘ Autopilot ’ Systems
39,2013-05-08T17:00:00,increase,0.65,Negative,When comes wireless power Wtf since Nikola Tesla died
40,2013-05-08T17:00:00,increase,0.65,Positive,thank Nikola Tesla electricity shot hands
41,2013-05-08T17:00:00,increase,0.65,Positive,Tesla technology anathema oil companies guess sat time
42,2013-05-08T17:00:00,increase,0.65,Negative,oh u didnt know Ive making BMS battery packs conversions 2008 I worked tesla
43,2013-05-08T17:00:00,increase,0.65,Positive,RT Thx Shout Out …
44,2013-05-08T17:00:00,increase,0.65,Positive,LOL I make ev worked tesla I love evs u miss understand Im talking
45,2013-05-08T17:00:00,increase,0.65,Positive,strange tesla released day roadster would 65 5 years ev
46,2013-05-08T17:00:00,increase,0.65,Positive,RT Theres Alternate Reality Rothschild Family Replaced Nikola Teslas Ponder wed
47,2013-05-08T17:00:00,increase,0.65,Positive,making tons fake money betting Tesla motors short squeeze
48,2013-05-08T17:00:00,increase,0.65,Positive,interested tesla
49,2013-05-08T17:00:00,increase,0.65,Positive,Thx Shout Out
50,2013-05-08T17:00:00,increase,0.65,Positive,TSLA Possible pullback buytherumorsellthenews type phenomenon ifwhen Tesla reports Q1 profit
51,2013-05-08T17:00:00,increase,0.65,Positive,LOOK data sheet Panasonic cell tesla use
52,2013-05-08T17:00:00,increase,0.65,Negative,RT Faculty news Delivery 94 Tesla MRI scanner finishing touch Brains Unlimited Scanner Lab The first tw
53,2013-05-08T17:00:00,increase,0.65,Positive,Stocks Watch AOL Tesla Wednesday ’ stocks watch stocks
54,2013-05-08T17:00:00,increase,0.65,Positive,Tesla CEO talking Google autopilot systems public ready
55,2013-05-08T17:00:00,increase,0.65,Negative,loss leaving car unpluged overnight consume loads ev pumping coolant around crap cells tesla
56,2013-05-08T17:00:00,increase,0.65,Positive,If someone wanted buy tesla Id okay
57,2013-05-08T17:00:00,increase,0.65,Positive,RT RT At COS lab Tesla produced artificial lightning Thunder released energy heard Cripple Creek
58,2013-05-08T17:00:00,increase,0.65,Negative,The 1912 Titanic sinking lost Tesla many investors friends imagine would changed world
59,2013-05-08T17:00:00,increase,0.65,Positive,Making announcements every year till 1940 Tesla quite busy Perhaps raided Jan 1943 work locked FBI
60,2013-05-08T17:00:00,increase,0.65,Negative,Edison fought Teslas idea money reasonsWestinghouse partnered wTesla took patentsBut much involved
61,2013-05-08T17:00:00,increase,0.65,Positive,In 1914 Tesla sold technology Germany may non disclosure secret development contracts
62,2013-05-08T17:00:00,increase,0.65,Positive,Tesla said 1915 ship went 300 miles per second By 1919 350 miles per hour published also true
63,2013-05-08T17:00:00,increase,0.65,Positive,By time Tesla Tower 1917 Tesla already provided internal power ship turbine
64,2013-05-08T17:00:00,increase,0.65,Negative,Edison played The GAME Unfortunately Tesla didnt
65,2013-05-08T17:00:00,increase,0.65,Positive,RT I think Brooklyn Babylon actually secret collaboration Thad Jones …
66,2013-05-08T17:00:00,increase,0.65,Negative,“ Life ever remain equation incapable solution contains certain known factors ” Nikola Tesla 1937
67,2013-05-08T17:00:00,increase,0.65,Positive,NY group buys Tesla property plans science center 7
68,2013-05-08T17:00:00,increase,0.65,Positive,For Tesla Motors TSLA GradientAnalystics 12 page negative piece Co gtgt Does anyone access Tia
69,2013-05-08T17:00:00,increase,0.65,Positive,know rearrange change letters teslas name get satan
70,2013-05-08T17:00:00,increase,0.65,Positive,Aww Tesla lookin nigga
71,2013-05-08T17:00:00,increase,0.65,Positive,I achieved stage 2 Tesla Man achievement FoundHD BigFishGames ElephantGames iPadGames
72,2013-05-08T17:00:00,increase,0.65,Positive,Dallas show HOB announcedcant wait till June ✌✌✌teslafantillidie
73,2013-05-08T17:00:00,increase,0.65,Positive,Is possible find many new Tesla Model S EVs registered California April 2013 Or EVReply
74,2013-05-08T17:00:00,increase,0.65,Positive,Any thoughts regarding Tesla TSLA investment opportunity Thinking upping stake Amazon AMZN Hmm
75,2013-05-08T17:00:00,increase,0.65,Positive,Gross Margins And Model S Sales Will Drive Tesla Results
76,2013-05-08T17:00:00,increase,0.65,Positive,One must sane think clearly one think deeply quite insane — Nikola Tesla
77,2013-05-08T17:00:00,increase,0.65,Positive,welcome Tesla
78,2013-05-08T17:00:00,increase,0.65,Positive,Stocks Watch AOL Tesla Wednesday ’ stocks watch
79,2013-05-08T17:00:00,increase,0.65,Positive,RT Tesla priority electrification cars priority Model S Model X mass market third gen vehicle amp truck
80,2013-05-08T17:00:00,increase,0.65,Positive,Which Leafs AZTXCA still 100 capacity Sorry Tesla fired please stop trolling
81,2013-05-08T17:00:00,increase,0.65,Positive,Tesla stock may bumpy ride today come earnings afternoon game changer
82,2013-05-08T17:00:00,increase,0.65,Positive,Stocks Watch AOL Tesla Wednesday ’ stocks watch
83,2013-05-08T17:00:00,increase,0.65,Positive,One must sane think clearly one think deeply quite insane Nikola Tesla
84,2013-05-08T17:00:00,increase,0.65,Negative,Elon Musk Autopilot Tesla Cars Is Still A Few Years Away via
85,2013-05-08T17:00:00,increase,0.65,Positive,“ If want find secrets universe think terms energy frequency vibration ” ― Nikola Tesla
86,2013-05-08T17:00:00,increase,0.65,Positive,Hi Elon Any chance Tesla ever available South Africa
87,2013-05-08T17:00:00,increase,0.65,Negative,My heart sinks whenever Im reminded Nikola Tesla died aloneI wouldve loved groupieWhat I would give company
88,2013-05-08T17:00:00,increase,0.65,Positive,Subscription business model cars Tesla
89,2013-05-08T17:00:00,increase,0.65,Positive,RT I think Brooklyn Babylon actually secret collaboration Thad Jones …
90,2013-05-08T17:00:00,increase,0.65,Positive,Lets follow kazoo march Sir Alex Goodbye Yellow Brick Road tesla coils send Canucks another spring
91,2013-05-08T17:00:00,increase,0.65,Positive,We need pay attention NC Senate Bill 327 introducedprohibit North Carolinians purchasing electric vehicles Tesla
92,2013-05-08T17:00:00,increase,0.65,Positive,Northern Ireland hosting years G8 summit Tesla Motors turned profit first time
93,2013-05-08T17:00:00,increase,0.65,Positive,Tesla car front 😍😍
94,2013-05-08T17:00:00,increase,0.65,Positive,I think Brooklyn Babylon actually secret collaboration Thad Jones Nikola Tesla
95,2013-05-08T17:00:00,increase,0.65,Positive,oh looolcracking upcourtesylegendslegends worth paying courtesy hm leme seeTesla Einstein Turing etc
96,2013-05-08T17:00:00,increase,0.65,Positive,haha I hope Ferrari decides play chicken Tesla
97,2013-05-08T17:00:00,increase,0.65,Positive,You spread Tesla lies hiring hundreds NummiThey hired 2025 exNummi workers June 2012
98,2013-05-08T17:00:00,increase,0.65,Positive,RT Tesla auto maker selling US doesnt report monthly sales figuresTSLA
99,2013-05-08T17:00:00,increase,0.65,Positive,id surprised wasnt tesla
100,2010-11-02T17:00:00,increase,0.42,Positive,RT If want find secrets Universe think terms energy frequency vibrationNikola Tesla RT
101,2010-11-02T17:00:00,increase,0.42,Negative,Ive Teslamode day Talking loud public without realizing
102,2010-11-02T17:00:00,increase,0.42,Positive,people base decisions personal levelnot media tells tothats whats wrong world
103,2010-11-02T17:00:00,increase,0.42,Positive,I dont think matters media huge influence public
104,2010-11-02T17:00:00,increase,0.42,Positive,If want find secrets Universe think terms energy frequency vibrationNikola Tesla RT
105,2010-11-02T17:00:00,increase,0.42,Positive,omigosh ANOTHER Tesla Roadster time estate
106,2010-11-02T17:00:00,increase,0.42,Positive,If want find secrets Universe think terms energy frequency vibrationNikola Tesla
107,2010-11-02T17:00:00,increase,0.42,Positive,RT Fuck voting You know live Matrix right lt Nigga excuse number 37
108,2010-11-02T17:00:00,increase,0.42,Negative,WHERE IS THAT I MUST GO THERE NOW
109,2010-11-02T17:00:00,increase,0.42,Positive,Ha Me friend brainstormed video game taking place Columbian Exposition With future weapons Tesla
110,2010-11-02T17:00:00,increase,0.42,Positive,Wait hyperventilating 321
111,2010-11-02T17:00:00,increase,0.42,Positive,I Kid U NotTesla Rules
112,2010-11-02T17:00:00,increase,0.42,Positive,Have fun see happened Tesla right Plus GM buying IPO RT Im buying GM
113,2010-11-02T17:00:00,increase,0.42,Negative,Play video game review job Damn must almost boring driving cars like Tesla mine
114,2010-11-02T17:00:00,increase,0.42,Negative,invading twittah D
115,2010-11-02T17:00:00,increase,0.42,Positive,Tesla disproved human life science sixwordscifi
116,2010-11-02T17:00:00,increase,0.42,Positive,Be alonethat secret invention Be alone ideas born Nikola Tesla
117,2010-11-02T17:00:00,increase,0.42,Positive,Member John entered Tesla Coils chat room 85144 CDT Tuesday November 2nd 2010
118,2010-11-02T17:00:00,increase,0.42,Positive,Hoy amaneci cantando tesla girls Weird
119,2010-11-02T17:00:00,increase,0.42,Negative,Got regular access 3Tesla scanner research purposes inventing new algorithms Weirdly enough underused
120,2010-11-02T17:00:00,increase,0.42,Positive,RT Makan grateeesss Sanade w wohoo
121,2010-11-02T17:00:00,increase,0.42,Positive,Tesla What You Give
122,2010-11-02T17:00:00,increase,0.42,Positive,Still focused acquiring Tesla Im beginning wonder using fill space left soul sisters death
123,2010-11-02T17:00:00,increase,0.42,Positive,Ooh Tesla Roadster parked near office Never seen one fleshcarbon fibre compound Tiny Ecospeedy
124,2010-11-02T17:00:00,increase,0.42,Positive,I would love test drive Tesla Hopefully new factory help become Apple auto
125,2010-11-02T17:00:00,increase,0.42,Positive,Makan grateeesss Sanade w wohoo
126,2010-11-02T17:00:00,increase,0.42,Positive,Have visited Clean Energy Expo Asia Trade Fair Watch Tesla electric car hot
127,2010-11-02T17:00:00,increase,0.42,Positive,Worlds powerful super computer built China equipped 14336 Xeon X5 processors 7168 NVIDIA Tesla GPUs Tianhe1A
128,2010-11-02T17:00:00,increase,0.42,Positive,Tesla Motors unveiled new Tesla Factory Fremont California electric car company said building Mo
129,2010-11-02T17:00:00,increase,0.42,Negative,Facebook still worse They Farmville
130,2010-11-02T17:00:00,increase,0.42,Negative,teen girls took twitter long time ago Its lost cause
131,2010-11-02T17:00:00,increase,0.42,Positive,“ The present future I really worked mine Tesla
132,2010-11-02T17:00:00,increase,0.42,Positive,Will submit update Sleex Tesla Tomorrow Translation Bug fixed
133,2010-11-02T17:00:00,increase,0.42,Positive,MR VICE PRESIDENT GLENN BECKPROMISE NEW JOBS BY THE RELEASE OF NEW TESLA ENERGYNEW AUTOMOBILES THAT RUN OFF WATERPROMISE NEW JOBS AREAS
134,2010-11-02T17:00:00,increase,0.42,Positive,Member Rich entered Tesla Coils chat room 33352 CDT Tuesday November 2nd 2010
135,2010-11-02T17:00:00,increase,0.42,Positive,The return Tesla Girl Did enjoy
136,2010-11-02T17:00:00,increase,0.42,Positive,Oh Bond close Declan hed probably go vamp take Tesla vials
137,2010-11-02T17:00:00,increase,0.42,Positive,tesla nonrambo max nonwild thing dax finned one thank last night incredibly orienting inners
138,2010-11-02T17:00:00,increase,0.42,Positive,If want find secrets Universe think terms energy frequency vibration Nikola Tesla quote
139,2010-11-02T17:00:00,increase,0.42,Positive,Oh doubt evil stole ideas least driven How many people remember Tesla band
140,2010-11-02T17:00:00,increase,0.42,Positive,Probably sleep tonight Im lots interesting reading thesis Nikola Tesla space energy communication
141,2010-11-02T17:00:00,increase,0.42,Positive,NowPlaying Fire Tesla Boy amazing 80s sound
142,2010-11-02T17:00:00,increase,0.42,Positive,Like Teslas prefer saloon 2 seater though harkatme notinmylifetime
143,2010-11-02T17:00:00,increase,0.42,Positive,If work circumstance play Tesla Toy app It wont get done
144,2010-11-02T17:00:00,increase,0.42,Positive,Im staying across highway new Tesla factory Would looooove take tour test drive
145,2010-11-02T17:00:00,increase,0.42,Positive,btw saw 2 chicks driving sports car NishiAzabu dayTwas TeslaTesla using Red Bull strategy game
146,2010-11-02T17:00:00,increase,0.42,Positive,Tesla Modern Day Cowboy totalmiddleschoolflashbacknight
147,2010-11-02T17:00:00,increase,0.42,Positive,sweet like tesla bunny D
148,2010-11-02T17:00:00,increase,0.42,Positive,HAHA TESLA EPISODE Oo SCHEDULINGFAIL At least theres DECLAN I HOPE
149,2010-11-02T17:00:00,increase,0.42,Negative,OK NOW Im ready wireless electricity Someone go resurrect Tesla
150,2010-11-02T17:00:00,increase,0.42,Positive,Tesla Toy greatest app fuck wit smacked I swear
151,2010-11-02T17:00:00,increase,0.42,Positive,Member John entered Tesla Coils chat room 104819 CDT Monday November 1st 2010
152,2010-11-02T17:00:00,increase,0.42,Positive,Member John entered Tesla Coils chat room 104629 CDT Monday November 1st 2010
153,2010-11-02T17:00:00,increase,0.42,Positive,Outlined Teslas Daughter despite ugly dayjobbery postcon ennui Tomorrow better alternano
154,2010-11-02T17:00:00,increase,0.42,Negative,I read book earlier year EMPIRES OF LIGHT touched Chicago Worlds Fair Edison Westinghouse Tesla
155,2010-11-02T17:00:00,increase,0.42,Positive,HP workstation uses Xeon Tesla part machines hpwsw
156,2010-11-02T17:00:00,increase,0.42,Positive,Member Matt entered Tesla Coils chat room 101836 CDT Monday November 1st 2010
157,2010-11-02T17:00:00,increase,0.42,Positive,Ill get asian chubby ya pal
158,2010-11-02T17:00:00,increase,0.42,Positive,Follow gtgt ltlt
159,2010-11-02T17:00:00,increase,0.42,Positive,Member John entered Tesla Coils chat room 95541 CDT Monday November 1st 2010
160,2010-11-02T17:00:00,increase,0.42,Negative,Sooooo I think jailbroken iPad best anyone
161,2010-11-02T17:00:00,increase,0.42,Positive,another thing Google come right said Android optimized Tablets Blackberry ancient
162,2010-11-02T17:00:00,increase,0.42,Negative,Ugh Work goin long I need feed tesla
163,2010-11-02T17:00:00,increase,0.42,Positive,Tesla electric Jesus
164,2010-11-02T17:00:00,increase,0.42,Positive,Tesla way better boy today relief
165,2010-11-02T17:00:00,increase,0.42,Positive,Always happy attend Pama Eben Freeman A Wonderful spirit Excellent event fueled Tesla Mixology
166,2010-11-02T17:00:00,increase,0.42,Positive,Are showing one electrocutes elephant try defraud Tesla
167,2010-11-02T17:00:00,increase,0.42,Negative,todays visits EA Oracle Protolab VMware HP Tesla Motors Nvidia Microsoft Computer History Museum Tonight meeting FIT
168,2010-11-02T17:00:00,increase,0.42,Positive,tesla said guess mom want brother kid awesome ℒℴѵℯ
169,2010-11-02T17:00:00,increase,0.42,Positive,Garrett says Aegis Tesla god mention bitch called valencia balerier Valencia Superbia says LOL
170,2010-11-02T17:00:00,increase,0.42,Positive,distress call Nikola Tesla OMG much fun ahead lt3
171,2010-11-02T17:00:00,increase,0.42,Positive,Member StRyKeReYe entered Tesla Coils chat room 80431 CDT Monday November 1st 2010
172,2010-11-02T17:00:00,increase,0.42,Positive,Tesla Hang Tough nowplaying
173,2010-11-02T17:00:00,increase,0.42,Positive,Member Bart entered Tesla Coils chat room 74513 CDT Monday November 1st 2010
174,2010-11-02T17:00:00,increase,0.42,Positive,nowplaying Love Song Tesla yay
175,2010-11-02T17:00:00,increase,0.42,Positive,What want xmas Tesla
176,2010-11-02T17:00:00,increase,0.42,Negative,Itll HOURS checking Nissans cooling circuit continuity Ill pretend Im searching Teslas secrets Circuit diagram squiggles
177,2010-11-02T17:00:00,increase,0.42,Negative,Liion Motors INIZIO allelectric supercar hitting 170 mph next year 139k Tesla schmesla This friends el
178,2010-11-02T17:00:00,increase,0.42,Positive,haha placed places scale scalp tesla words big V remind teacher shes smart girl
179,2010-11-02T17:00:00,increase,0.42,Positive,Member StRyKeReYe entered Tesla Coils chat room 65858 CDT Monday November 1st 2010
180,2010-11-02T17:00:00,increase,0.42,Positive,whens e next movie us learn joint robbery w furkids I need bigger house tesla soon
181,2010-11-02T17:00:00,increase,0.42,Positive,Member StRyKeReYe entered Tesla Coils chat room 63454 CDT Monday November 1st 2010
182,2010-11-02T17:00:00,increase,0.42,Positive,Member John entered Tesla Coils chat room 62733 CDT Monday November 1st 2010
183,2010-11-02T17:00:00,increase,0.42,Positive,Member StRyKeReYe entered Tesla Coils chat room 62400 CDT Monday November 1st 2010
184,2010-11-02T17:00:00,increase,0.42,Negative,What want RT I gotten iPhone This Droid good watching porn meetings sad face
185,2010-11-02T17:00:00,increase,0.42,Positive,Music Users HERE Type Tesla Audio iTunes search today Just 99 cents INTRO price
186,2010-11-02T17:00:00,increase,0.42,Positive,Twitter Air Video IMDB Angry Birds Strategery BBC News Plants vs Zombies The Elements Tesla Toy
187,2010-11-02T17:00:00,increase,0.42,Positive,Cool saw Tesla Roadster visible tailpipe Pretty lookin machine But like pickup truck looks bouncy heck
188,2010-11-02T17:00:00,increase,0.42,Positive,Im seriously going EXPLODE SQUEEEE Friday night Tesla episode Im bouncing Im public Sanctuary
189,2010-11-02T17:00:00,increase,0.42,Positive,Lets squeeeeeeeeeeeeeeeeeeeeeeeeeeeee D Sanctuary Tesla
190,2010-11-02T17:00:00,increase,0.42,Positive,Youre cute youre excited Tesla xD
191,2010-11-02T17:00:00,increase,0.42,Positive,butts Only squeeeeeeee TESLA IS BACK butts back
192,2010-11-02T17:00:00,increase,0.42,Positive,Im looking forward Teslas return Sanctuary
193,2010-11-02T17:00:00,increase,0.42,Positive,Yup far awesome And next week TESLA Sanctuary
194,2010-11-02T17:00:00,increase,0.42,Positive,Yup far awesome And next week TESLA Sanctuary
195,2010-11-02T17:00:00,increase,0.42,Negative,I feel like certain point may turn vinegar
196,2010-11-02T17:00:00,increase,0.42,Positive,Member StRyKeReYe entered Tesla Coils chat room 45010 CDT Monday November 1st 2010
197,2010-11-02T17:00:00,increase,0.42,Positive,Member John entered Tesla Coils chat room 43554 CDT Monday November 1st 2010
198,2010-11-02T17:00:00,increase,0.42,Positive,My top five played songs iTunes Holy Diver Dio Shake Me Cinderella Paradise Tesla Dont Cry GNR Sweet Emotion Aerosmith
199,2010-11-02T17:00:00,increase,0.42,Positive,I thought Tesla created weapons electrical destruction movies games comics
200,2013-04-17T17:00:00,increase,0.31,Negative,Tesla amp Tre would get sent im lonely 
201,2013-04-17T17:00:00,increase,0.31,Negative,Could I charge tesla apartment would I need house
202,2013-04-17T17:00:00,increase,0.31,Positive,Tesla Etherite archmaster latter
203,2013-04-17T17:00:00,increase,0.31,Positive,RT Q6 Google Tesla Yahoo Sun cofounded immigrant entrepreneurs Success inspires success
204,2013-04-17T17:00:00,increase,0.31,Positive,RT Q6 Google Tesla Yahoo Sun cofounded immigrant entrepreneurs Success inspires success
205,2013-04-17T17:00:00,increase,0.31,Positive,Q6 Google Tesla Yahoo Sun cofounded immigrant entrepreneurs Success inspires success startupchats
206,2013-04-17T17:00:00,increase,0.31,Positive,Just saw tesla Where else West Hartford course
207,2013-04-17T17:00:00,increase,0.31,Positive,Are going cheer fundraiser next week
208,2013-04-17T17:00:00,increase,0.31,Positive,RT NEW ROADSTER Forums Tesla Motors Active Topics Tesla Roadster bfudge 2 days ago Roadster Sports For
209,2013-04-17T17:00:00,increase,0.31,Positive,even super cool Tesla store
210,2013-04-17T17:00:00,increase,0.31,Positive,ask nikola tesla government thinks free energy
211,2013-04-17T17:00:00,increase,0.31,Positive,Digging Tesla gt Edison tshirt Nate Burton NSA sporting Not holding back openstack
212,2013-04-17T17:00:00,increase,0.31,Positive,You peep Tesla yet
213,2013-04-17T17:00:00,increase,0.31,Negative,Spoiler Westinghouse got Niagara contract Edison Tesla got Morganized TheMenWhoBuiltAmerica
214,2013-04-17T17:00:00,increase,0.31,Positive,Oooo tesla motors scripps Yeeah Im la jolla
215,2013-04-17T17:00:00,increase,0.31,Positive,RT Sky 4 Energy relies conclusions Nikola Tesla daddy electricity greendiy
216,2013-04-17T17:00:00,increase,0.31,Positive,Actually saw Tesla I going grocery store yesterday Never thought I would see one road
217,2013-04-17T17:00:00,increase,0.31,Negative,hmm still wondering whether Bales characters twins clone teslas machine
218,2013-04-17T17:00:00,increase,0.31,Positive,Tesla love song
219,2013-04-17T17:00:00,increase,0.31,Positive,I dont see thread enemy So cal Tesla Nikola Impeccably dressed
220,2013-04-17T17:00:00,increase,0.31,Positive,Any thoughts upcoming Tesla X I wonder 7 seats realistic
221,2013-04-17T17:00:00,increase,0.31,Positive,wanting Tesla one
222,2013-04-17T17:00:00,increase,0.31,Positive,I heard Teslas modern day cowboy I forgot good song
223,2013-04-17T17:00:00,increase,0.31,Positive,Sky 4 Energy relies conclusions Nikola Tesla daddy electricity greendiy
224,2013-04-17T17:00:00,increase,0.31,Positive,Time Travel Matchup Who would win inventing stuff contest1 Nikola Tesla2 Leonardo DaVinci
225,2013-04-17T17:00:00,increase,0.31,Positive,I Abode Coffeehouse Stop say hi anything get outta Byron Tesla writing mood
226,2013-04-17T17:00:00,increase,0.31,Positive,Infotec today right Tesla car We popcorn candy chance win Nexus 7 Stop say hello
227,2013-04-17T17:00:00,increase,0.31,Positive,Shes gon na hide Tesla Coil toilet
228,2013-04-17T17:00:00,increase,0.31,Positive,RT okay I know wont stir waters say loud Hahahah
229,2013-04-17T17:00:00,increase,0.31,Positive,good luck
230,2013-04-17T17:00:00,increase,0.31,Positive,If everything write debated really fast tesla electric car austin thedomain swag swagtag
