id,date,class,percent,text
572,2009-02-09T17:00:00,decrease,-0.08,"forgot to mention that Taiwan's McDonald's male you do the recycling - one by one"
573,2009-02-09T17:00:00,decrease,-0.08,"At McDonald's. Lack of appetizing options + lack of sleep = wow, it's hard to decide."
574,2009-02-09T17:00:00,decrease,-0.08,"@codecow yeah, because we all KNOW what a bastion of health McDonald's is..."
575,2009-02-09T17:00:00,decrease,-0.08,"Ugh, somebody remind me never to eat at mcdonald's again! Talk about eating too much..."
576,2009-02-09T17:00:00,decrease,-0.08,"really want to stop at McDonald's but I really shouldn't, Lord help me"
577,2009-02-09T17:00:00,decrease,-0.08,"Protip: Don't eat McDonald's on a plane."
578,2009-02-09T17:00:00,decrease,-0.08,"Forgot my debit card for my McDonald's breakfast trip. Maybe tomorrow."
579,2009-02-09T17:00:00,decrease,-0.08,"Decided: not going to do it. They charge so little for drinks as it is. Seriously, Bojangles' medium is McDonald's Super Sized."
580,2009-02-09T17:00:00,decrease,-0.08,"I highly doubt that it's normal to be this excited about a McDonald's extra value meal on a Sunday night."
581,2009-02-09T17:00:00,decrease,-0.08,"Gonna shower, wear my kickass corporate attire, buy breakfast in Mcdonald's and commute to my job exam. LONG DAY!"
582,2009-02-09T17:00:00,decrease,-0.08,"@cheeky_geeky ""Nicest McDonald's?!"" Truly an oxymoron (brazenly exposing where I stand =)! Truly a frightening pic given the menu."
583,2009-02-09T17:00:00,decrease,-0.08,"@bobbles What is the deal? And this airline food? Come on! For the price of the ticket, I could eat McDonald's for a month! Am I right?"
584,2009-02-09T17:00:00,decrease,-0.08,"Off to McDonald's! xP Yay me."
585,2009-02-09T17:00:00,decrease,-0.08,"Did u know? McDonald’s is the largest purchaser of apples in the restaurant industry, averaging 50 million #. per year! I like their slice.s"
586,2009-02-09T17:00:00,decrease,-0.08,"@LaurinandKelly I just want a white hot chocolate, is that so bad??? Funny, my mom said the same thing about McDonald's machine"
587,2009-02-09T17:00:00,decrease,-0.08,"@bluemonkeybutt Well, I get really bent when the McDonald's ice cream machine is broken, so I feel your pain."
588,2009-02-09T17:00:00,decrease,-0.08,"Stopping by McDonald's to get fries & sweet tea"
589,2009-02-09T17:00:00,decrease,-0.08,"enjoyed my first Shamrock Shake of '09. I was shocked that McDonald's has them out in February - usually, you have to wait 'til March."
590,2009-02-09T17:00:00,decrease,-0.08,"Honestluy, McDonald's coffee is better than both Pete's  and Starbucks"
591,2009-02-09T17:00:00,decrease,-0.08,"I just had a random thought, what ever happened to McDonald's pizza?"
592,2009-02-09T17:00:00,decrease,-0.08,"A little boy at McDonald's just blew off Schuyler when she went and introduced herself with her device.  Can I call a 9 year old boy a dick?"
593,2009-02-09T17:00:00,decrease,-0.08,"@snapgrrl don't forget to go to the Spanish steps when in Rome. The most luxurious mcdonald's you'll ever see. Beautiful area."
594,2009-02-09T17:00:00,decrease,-0.08,"Yikes! Just calculated the ""nutrition"" of a McDonald's breakfast, which I try occasionally - 770 calories; 47 grams of fat! Barf."
595,2009-02-09T17:00:00,decrease,-0.08,"McDonald’s profits beat expectations. Worldwide same-store sales growth lower than in Nov-Dec Last year. Sales in Germany & China down"
596,2009-02-09T17:00:00,decrease,-0.08,"McDonald’s profits beat expectations. But, worldwide same-store sales growth lower than in Nov-Dec Last year. Sales in Germany & China down"
597,2009-02-09T17:00:00,decrease,-0.08,"Huge McDonald's nugget craving. Had to stop at drive thru. Ugh."
598,2009-02-09T17:00:00,decrease,-0.08,"Sissy still isn't feeling well. She even turned down McDonald's."
599,2009-02-09T17:00:00,decrease,-0.08,"is watchin the Cavs & Laker game. Yeeee boyeee!! But are the Cavs endorsed by Mcdonald's now or what?? Lmao"
600,2016-07-08T17:00:00,neutral,0.01,"I have a ridiculous addiction to Diet Coke from McDonald's and I hate myself for it 🌚"
601,2016-07-08T17:00:00,neutral,0.01,"RT @WillMims_: Honestly chick fil a should have breakfast all day instead of McDonald's"
602,2016-07-08T17:00:00,neutral,0.01,"There's a poke stop at this McDonald's. Fuck yeah hahha"
603,2016-07-08T17:00:00,neutral,0.01,"McDonald's breakfast is always fucking good"
604,2016-07-08T17:00:00,neutral,0.01,"I'm gunna eat my fucking McDonald's and be fucking merry today."
605,2016-07-08T17:00:00,neutral,0.01,"@MikeEdwards79 Deffo not🙈 a McDonald's trip was needed,but I'm a bit scared of reversing out the driver #howdidipass"
606,2016-07-08T17:00:00,neutral,0.01,"@Asros The best bagel sandwich is the Steak, Egg, and Cheese breakfast bagel from McDonald's for breakfast. Mmmm..... delicious. :)"
607,2016-07-08T17:00:00,neutral,0.01,"Fuck McDonald's"
608,2016-07-08T17:00:00,neutral,0.01,"@McDonald's when a customer asks for UNsweat tea three different times it means they want TEA WITHOUT SUGAR. Smh."
609,2016-07-08T17:00:00,neutral,0.01,"The McDonald's on Edgmont Avenue is a gym 😂😂😂"
610,2016-07-08T17:00:00,neutral,0.01,"I can honestly say I like my job at McDonald's I fw everybody there"
611,2016-07-08T17:00:00,neutral,0.01,"@veemamaa LOL tell me why I had the same idea about that 😂 Take her to McDonald's to use my app and coupons fucking dead 😂"
612,2016-07-08T17:00:00,neutral,0.01,"hope McDonald's still serving breakfast 😕"
613,2016-07-08T17:00:00,neutral,0.01,"I'm about to get McDonald's for the first time I months😷"
614,2016-07-08T17:00:00,neutral,0.01,"fuck McDonald's 😂😭😭😭😭"
615,2016-07-08T17:00:00,neutral,0.01,"McDonald's has the best sweet tea!!! Idc what anyone says."
616,2016-07-08T17:00:00,neutral,0.01,"I ate break fast at McDonald's this morning and I think they got some kind of Shit that makes your Dick hard"
617,2016-07-08T17:00:00,neutral,0.01,"@TheWisdomofBri McDonald's is disgusting"
618,2016-07-08T17:00:00,neutral,0.01,"Spending my last day in America for a month doing very American things like eating McDonald's &amp; waking up to news about mass shootings"
619,2016-07-08T17:00:00,neutral,0.01,"To the McDonald's employee that gave me a free Sprite because I forgot my debit card... Thank you"
620,2016-07-08T17:00:00,neutral,0.01,"RT @Hardism: I'm 5'10 and I weigh 45 kilograms. Anyone who charges ""Fat Tax"" when I buy food at McDonald's should be ashamed of themselves."
621,2016-07-08T17:00:00,neutral,0.01,"RT @DobreLucas: I don't care what anyone says.. Chocolate chip cookies from McDonald's are the best 😂"
622,2016-07-08T17:00:00,neutral,0.01,"RT @Hardism: I'm 5'10 and I weigh 45 kilograms. Anyone who charges ""Fat Tax"" when I buy food at McDonald's should be ashamed of themselves."
623,2016-07-08T17:00:00,neutral,0.01,"RT @Hardism: I'm 5'10 and I weigh 45 kilograms. Anyone who charges ""Fat Tax"" when I buy food at McDonald's should be ashamed of themselves."
624,2016-07-08T17:00:00,neutral,0.01,"@xtlcxo Rosa got excited, thinking you brought her McDonald's. 😂 lmfao"
625,2016-07-08T17:00:00,neutral,0.01,"@jasminedumpling @discolorised no it was McDonald's :("
626,2016-07-08T17:00:00,neutral,0.01,"RT @JordynAllyah: saltier than a McDonald's french fry rn"
627,2016-07-08T17:00:00,neutral,0.01,"I live for McDonald's curry sauce"
628,2016-07-08T17:00:00,neutral,0.01,"McDonald's is trash"
629,2016-07-08T17:00:00,neutral,0.01,"it's free fries Friday at McDonald's and I can't eat  😭😭😭"
630,2016-07-08T17:00:00,neutral,0.01,"Mcdonald's 😋😋"
631,2016-07-08T17:00:00,neutral,0.01,"I feel like I need to make time for Heather McDonald's new book."
632,2016-07-08T17:00:00,neutral,0.01,"RT @NoHoesMo: i miss elementary school days where i would have a doctors appointment and come back to school flexing with McDonald's or som…"
633,2016-07-08T17:00:00,neutral,0.01,"After 2 week of making the most of all inclusive, then McDonald's, pizza and cake, I've just been to the doctors to be told I've lost weight"
634,2016-07-08T17:00:00,neutral,0.01,"It's been so long since I've had McDonald's that they've changed some of their packaging and materials."
635,2016-07-08T17:00:00,neutral,0.01,"I wonder how many #police officers have a 4 year degree from a university ? I would guess less than 10%  educated like a McDonald's employee"
636,2016-07-08T17:00:00,neutral,0.01,"RT @NextUpRecruits: Nick Weatherspoon is an assassin on the court. Definite McDonald's All American candidate"
637,2016-07-08T17:00:00,neutral,0.01,"I just want a girl I can go to the McDonald's on Dorsett with and throat punch Charlene after telling her Carla sent me"
638,2016-07-08T17:00:00,neutral,0.01,"Everyone writhing in jealousy in this elevator bc I have a huge bag of McDonald's. And it smells so good."
639,2016-07-08T17:00:00,neutral,0.01,"McDonald's sweet tea saves lives"
640,2016-07-08T17:00:00,neutral,0.01,"RT @TheStiffsUK: my best friend just secured her first flat with her fiancé and i drove to mcdonald's last night to play pokémon go"
641,2016-07-08T17:00:00,neutral,0.01,"Sinkhole partially swallows car outside Florida McDonald's, if you know what i mean"
642,2016-07-08T17:00:00,neutral,0.01,"RT @KatieBurnett: Never seen anyone in Nandos or McDonald's pick up an appropriate amount of napkins - you're cleaning up after a burger no…"
643,2016-07-08T17:00:00,neutral,0.01,"So last night I physically resisted entering McDonald's but an hour later I downed ramen and this morning I ate a cookie for breakfast oops."
644,2016-07-08T17:00:00,neutral,0.01,"RT @Hardism: I'm 5'10 and I weigh 45 kilograms. Anyone who charges ""Fat Tax"" when I buy food at McDonald's should be ashamed of themselves."
645,2016-07-08T17:00:00,neutral,0.01,"@jaws_webbie there one near the McDonald's on piney forest. And a pokèstop 👌🏽"
646,2016-07-08T17:00:00,neutral,0.01,"En mcdonald""s"
647,2016-07-08T17:00:00,neutral,0.01,"saltier than a McDonald's french fry rn"
648,2016-07-08T17:00:00,neutral,0.01,"@snagglefraggle McDonald's loves to rape regional classics"
649,2016-07-08T17:00:00,neutral,0.01,"RT @Hardism: I'm 5'10 and I weigh 45 kilograms. Anyone who charges ""Fat Tax"" when I buy food at McDonald's should be ashamed of themselves."
650,2016-07-08T17:00:00,neutral,0.01,"Nick Weatherspoon is an assassin on the court. Definite McDonald's All American candidate"
651,2016-07-08T17:00:00,neutral,0.01,"RT @Hardism: I'm 5'10 and I weigh 45 kilograms. Anyone who charges ""Fat Tax"" when I buy food at McDonald's should be ashamed of themselves."
652,2016-07-08T17:00:00,neutral,0.01,"We used to finesse tf out of the McDonald's in Campbellsville.. Weren't paying for shit lmao"
653,2016-07-08T17:00:00,neutral,0.01,"RT @KatieBurnett: Never seen anyone in Nandos or McDonald's pick up an appropriate amount of napkins - you're cleaning up after a burger no…"
654,2016-07-08T17:00:00,neutral,0.01,"RT @Hardism: I'm 5'10 and I weigh 45 kilograms. Anyone who charges ""Fat Tax"" when I buy food at McDonald's should be ashamed of themselves."
655,2016-07-08T17:00:00,neutral,0.01,"RT @DobreLucas: I don't care what anyone says.. Chocolate chip cookies from McDonald's are the best 😂"
656,2016-07-08T17:00:00,neutral,0.01,"The McDonald's in Wellington is probably the slowest fast food place there is."
657,2016-07-08T17:00:00,neutral,0.01,"I had McDonald's today after 6483028 years"
658,2016-07-08T17:00:00,neutral,0.01,"Today I was feeling motivated to lose weight but then I was also feeling motivated to each the 20 chicken nuggets I got from McDonald's"
659,2016-07-08T17:00:00,neutral,0.01,"Thing is though I'm hungry and he promised we could have McDonald's tonight....but I don't wanna wake him up"
660,2016-07-08T17:00:00,neutral,0.01,"RT @OlliCrusoe: Prowling the streets, looking for receptive bodies the parasite stopped dead at the sight of the McDonald's restaurant. #fp…"
661,2016-07-08T17:00:00,neutral,0.01,"Pretty sad when you skip going to McDonald's just so you can stay at home and watch Grey's anatomy😁😁"
662,2016-07-08T17:00:00,neutral,0.01,"@brogawd_ day trip man... And if the dining hall isn't a gym we go to McDonald's or something"
663,2016-07-08T17:00:00,neutral,0.01,"RT @John_Cardiff_: I was pulling out of McDonald's the other day and somebody pulled in past me playing party, it was dope. You had to be t…"
664,2016-07-08T17:00:00,neutral,0.01,"McDonald's need a hot sign like Krispy Kreme so I can know Wassup 🙄"
665,2016-07-08T17:00:00,neutral,0.01,"McDonald's breakfast, splash can and now Chinese, today hasn't exactly been the healthiest of days"
666,2016-07-08T17:00:00,neutral,0.01,"thx God for McDonald's wifi"
667,2016-07-08T17:00:00,neutral,0.01,"RT @NoHoesMo: i miss elementary school days where i would have a doctors appointment and come back to school flexing with McDonald's or som…"
668,2016-07-08T17:00:00,neutral,0.01,"I want some McDonald's"
669,2016-07-08T17:00:00,neutral,0.01,"For fucking God's sake, McDonald's is getting worse. The burgers are shit as fuck and they're late as fuck!"
670,2016-07-08T17:00:00,neutral,0.01,"@HindaRifka @jko417 @M0L0NL4BE @PantanoLaw @TheRightScoop interesting logic would you have a McDonald's employee do your taxes #GOPlogic"
671,2016-07-08T17:00:00,neutral,0.01,"@_neeshee Yasssssss McDonald's can say all fries matter and ill boycott but I just can't get behind this 😩"
672,2016-07-08T17:00:00,neutral,0.01,"@luke_brooks can you guys vist Japan? Apparently they have Pokemon McDonald's 😍"
673,2016-07-08T17:00:00,neutral,0.01,"Pokemon Go is addictive . Almost caught a Charizard while in a McDonald's drive through"
674,2016-07-08T17:00:00,neutral,0.01,"Idk why but I was craving McDonald's breakfast this morning."
675,2016-07-08T17:00:00,neutral,0.01,"RT @therealashani2: I want some fries from McDonald's that's the only thing I eat from there 😢"
676,2016-07-08T17:00:00,neutral,0.01,"All this is a coverup the media is trying to distract you from the mcrib coming back to McDonald's"
677,2016-07-08T17:00:00,neutral,0.01,"I had McDonald's again 😭"
678,2016-07-08T17:00:00,neutral,0.01,"I'm 5'10 and I weigh 45 kilograms. Anyone who charges ""Fat Tax"" when I buy food at McDonald's should be ashamed of themselves."
679,2016-07-08T17:00:00,neutral,0.01,"I hate when McDonald's don't put salt on da fries I want da fries hot &amp; salty af df"
680,2016-07-08T17:00:00,neutral,0.01,"my best friend just secured her first flat with her fiancé and i drove to mcdonald's last night to play pokémon go"
681,2016-07-08T17:00:00,neutral,0.01,"best part of waking up at 5:00 ever morning, I don't ever wait in line for breakfast at McDonald's ❤️😬"
682,2016-07-08T17:00:00,neutral,0.01,"McDonald's on the train should be illegal in this weather. The stench is overwhelming"
683,2016-07-08T17:00:00,neutral,0.01,"RT @NoHoesMo: i miss elementary school days where i would have a doctors appointment and come back to school flexing with McDonald's or som…"
684,2016-07-08T17:00:00,neutral,0.01,"I want McDonald's breakfast 😋"
685,2016-07-08T17:00:00,neutral,0.01,"@UnitedgamerzHQ go rob McDonald's"
686,2016-07-08T17:00:00,neutral,0.01,"Who wants to eat McDonald's with me?"
687,2016-07-08T17:00:00,neutral,0.01,"RT @NoHoesMo: i miss elementary school days where i would have a doctors appointment and come back to school flexing with McDonald's or som…"
688,2016-07-08T17:00:00,neutral,0.01,"I want some fries from McDonald's that's the only thing I eat from there 😢"
689,2016-07-08T17:00:00,neutral,0.01,"Since when is a sausage and biscuit at McDonald's not $1 anymore 🙃"
690,2016-07-08T17:00:00,neutral,0.01,"The thought of McDonald's makes me wanna throw up"
691,2016-07-08T17:00:00,neutral,0.01,"""Don't have a good day, make it a good day."" - some crazy homeless dude at McDonald's."
692,2016-07-08T17:00:00,neutral,0.01,"So hungry I'm actually debating going to McDonald's.... I hate McDonalds"
693,2016-07-08T17:00:00,neutral,0.01,"I was in McDonald's and saw you :-) @kuckfuffo"
694,2016-07-08T17:00:00,neutral,0.01,"@TheTideNate @McDonalds Love = McDonald's"
695,2016-07-08T17:00:00,neutral,0.01,"Just had a McDonald's n now I'm too obese for my outfit:)))) Girl problems"
696,2016-07-08T17:00:00,neutral,0.01,"RT @emiliamedinaa: I want chick fil a and whataburger and Burger King and McDonald's and wingstop :((((("
697,2016-07-08T17:00:00,neutral,0.01,"Lady at McDonald's tells me I'm so beautiful, Ashlynn follows that up with usually people tell me that I'm beautiful"
698,2016-07-08T17:00:00,neutral,0.01,"There is no bigger let down than trying to fill a McDonald's craving with a Skinny Minnies shake 🙄 🍔🍟🍼"
699,2016-07-08T17:00:00,neutral,0.01,"Just accidentally cut in front of a lit 7 y/o girl at McDonald's am gawn tae hell"
700,2007-05-25T17:00:00,neutral,0.01,"mcdonald's chicken biscuits.  tasty indigestion."
701,2007-05-25T17:00:00,neutral,0.01,"Oohhh, daughter ran out for McDonald's breakfast!  Cool!"
702,2007-05-25T17:00:00,neutral,0.01,"Avoiding McDonald's downstairs."
703,2007-05-25T17:00:00,neutral,0.01,"Definition of irony:  The best apples in town are at the McDonald's drive through."
704,2007-05-25T17:00:00,neutral,0.01,"&nbsp;4:10 PM going home has to stop at McDonald's to pick up cheeseburger for Lindsay at [unclear speech, please listen]."
705,2007-05-25T17:00:00,neutral,0.01,"speaking of Shrek and McDonald's, they're advertising a swamp sludge mcflurry... is that supposed to sound appetizing?"
706,2007-05-25T17:00:00,neutral,0.01,"gettin ready to go to McDonald's for breakfast."
707,2007-05-25T17:00:00,neutral,0.01,"There's a sad feeling specific to eating salad at McDonald's.  Trying to think of the name."
708,2007-05-25T17:00:00,neutral,0.01,"Damn, I always forget how f'ing delicious McDonald's breakfast is. Two hash browns and a biscuit = yummy."
709,2007-05-25T17:00:00,neutral,0.01,"Getting dressed in a few minutes and going to McDonald's to catch breakfast... this a rare event; yet a joyous one! Mmmmm!"
710,2007-05-25T17:00:00,neutral,0.01,"Waiting for my lunch @ mcdonald's L:32746"
711,2007-05-25T17:00:00,neutral,0.01,"@essk: What kind of McDonald's food are you claiming is “quite nice”?"
712,2007-05-25T17:00:00,neutral,0.01,"Mcdonald's food in 'quite nice' shocker!"
713,2007-05-25T17:00:00,neutral,0.01,"McDonald's is a lie."
714,2007-05-25T17:00:00,neutral,0.01,"Chipotle is a McDonald's Company."
715,2007-05-25T17:00:00,neutral,0.01,"McDonald's breakfast burritos are far to delicious."
716,2007-05-25T17:00:00,neutral,0.01,"L:Forrest City, AR eating bfast at McDonald's"
717,2007-05-25T17:00:00,neutral,0.01,"Need 2 more McDonald's Happy Meals to complete the Shrek the 3rd toy collection. Need Shrek and Fiona."
718,2007-05-25T17:00:00,neutral,0.01,"Watching Super Size Me. Makes me want to go get some McDonald's."
719,2007-05-25T17:00:00,neutral,0.01,"Thinking about mcdonald's. Probably for the seventh time since leaving work three hours ago..."
720,2007-05-25T17:00:00,neutral,0.01,"At McDonald's trying to get some work done."
721,2007-05-25T17:00:00,neutral,0.01,"mcdonald's. I mean, come on. the food's bad, but not that bad."
722,2007-05-25T17:00:00,neutral,0.01,"suspicious package was found on a newspaper stand in front of the McDonald’s at 3880 Pacific Coast Highway, and the sheriff’s bomb squad uni"
723,2007-05-25T17:00:00,neutral,0.01,"is thinking about a McDonald's breakfast."
724,2007-05-25T17:00:00,neutral,0.01,"Yummm... Lunch with our Microsoft field rep at Lonestar Steakhouse. Steak beats McDonald's for lunch anyday."
725,2007-05-25T17:00:00,neutral,0.01,"8 year old kids finds weed, pipe and a lighter in a mcdonald's happy meal."
726,2007-05-25T17:00:00,neutral,0.01,"Lacking alternatives, just had lunch at McDonald's. Could have done some reverse puking instead, too ... :-("
727,2007-05-25T17:00:00,neutral,0.01,"Just ate a Southwest Grilled Chicken Salad from McDonald's, waaay YUM! Myr and I were lunch buddies across the miles!"
728,2007-05-25T17:00:00,neutral,0.01,"salad at mcdonald's for lunch"
729,2007-05-25T17:00:00,neutral,0.01,"Sad that McDonald's doesn't serve ice cream in the morning."
730,2007-05-25T17:00:00,neutral,0.01,"At McDonald's with Young Life."
731,2007-05-25T17:00:00,neutral,0.01,"So i stop at mcdonald's to get something to drink, green straws! Is shrek really that influential?"
732,2007-05-25T17:00:00,neutral,0.01,"If only they sold dress belts in the McDonald's drivethru. I left mine at home, over 200 miles away. No one will notice."
733,2007-05-25T17:00:00,neutral,0.01,"Actually eating at McDonald's. Once a year is forgivable, isn't it?"
734,2007-05-25T17:00:00,neutral,0.01,"The McDonald's near my house is the worst; long lines & too slow"
735,2007-05-25T17:00:00,neutral,0.01,"2nd dream where I went to McDonald's and odered a big mac and small fries, no drink,  then they tried to sell me A Scanner Darkly toys"
736,2007-05-25T17:00:00,neutral,0.01,"Back at Liang Court McDonald's again"
737,2007-05-25T17:00:00,neutral,0.01,"is disappointed because the shake machine at McDonald's was broken and I couldn't have a green mint Shrek Shake."
738,2007-05-25T17:00:00,neutral,0.01,"@andycaster  (channeling Dana Carvey's Church Lady) Could it be McDonald's, the Satan of Fast Food?"
739,2007-05-25T17:00:00,neutral,0.01,"They're saying officially according to that fast food study that McDonald's fries were picked as the best...63 percent said they're better."
740,2007-05-25T17:00:00,neutral,0.01,"just ate a McDonald's hash brown. Bad April."
741,2007-05-25T17:00:00,neutral,0.01,"Gettting Hello Kitty Stamped by my daughter thanks to McDonald's ..."
742,2007-05-25T17:00:00,neutral,0.01,"breaking my self-imposed McDonald's exile to try one of their taco salads. (i don't worry about bikini season because i have no bikini.)"
743,2007-05-25T17:00:00,neutral,0.01,"McDonald's: I ordered the new chicken menu, because of a recent commercial with Heidi Klum. The food looked a lot better with her behind it."
744,2007-05-25T17:00:00,neutral,0.01,"Well, twitter's back online. The annoying cats are gone. And with them, my craving for Chinese food. I think I'll do McDonald's instead."
745,2007-05-25T17:00:00,neutral,0.01,"Without limitation, McDonald's will have exclusive ownership of all present and future existing rights to the Submission of every kind and n"
746,2007-05-25T17:00:00,neutral,0.01,"Walking to a McDonald's now to get some cheeseburgers."
747,2007-05-25T17:00:00,neutral,0.01,"The woman @ McDonald's screwed up and didn't realize that the other woman already made my shake, so I got a second one for free."
748,2007-05-25T17:00:00,neutral,0.01,"has developed a fondness for McDonald's new iced coffee"
749,2007-05-25T17:00:00,neutral,0.01,"Did not miss my McDonald's calling but thoroughly enjoyed handing out balloons & battling it out with the pop machine!"
750,2007-05-25T17:00:00,neutral,0.01,"Took a walk to McDonald's to try to take the edge off."
751,2007-05-25T17:00:00,neutral,0.01,"developing hypoglycemia from mcdonald's sweet tea"
752,2007-05-25T17:00:00,neutral,0.01,"Something in the air smells like McDonald's hashbrowns.  Its making me hungry"
753,2007-05-25T17:00:00,neutral,0.01,"there is something so wrong yet so right about McDonald's McGriddles."
754,2007-05-25T17:00:00,neutral,0.01,"McDonald's Sausage Burrito - finally, something on their breakfast menu that actually has flavor."
755,2007-05-25T17:00:00,neutral,0.01,"My four ladies are meeting me at McDonald's for lunch - sweet lunch date!"
756,2007-05-25T17:00:00,neutral,0.01,"Back from work and poisoning my system with McDonald's."
757,2007-05-25T17:00:00,neutral,0.01,"McDonald's April same-store sales rise 5%"
758,2007-05-25T17:00:00,neutral,0.01,"Signs You've Grown up: You feed your dog Science Diet instead of McDonald's     leftovers."
759,2007-05-25T17:00:00,neutral,0.01,"At mcdonald's with both j's"
760,2007-05-25T17:00:00,neutral,0.01,"I really want something besides McDonald's or Arby's tonight"
761,2007-05-25T17:00:00,neutral,0.01,"back to hospital.  McDonald's shake to keep me awake on the way there"
762,2007-05-25T17:00:00,neutral,0.01,"Went to town with my friend Ole. He thought; lets say hello to McDonald's Cheeseburger, and we did indeed :-)"
763,2007-05-25T17:00:00,neutral,0.01,"going to mcdonald's for an ice cream sundae"
764,2007-05-25T17:00:00,neutral,0.01,"mmmmmmm...mcdonald's"
765,2007-05-25T17:00:00,neutral,0.01,"I just had a nice meal, pasta with gyros I cooked myself, not like my hippo friend Neil, who prefers ronald McDonald's kitchen"
766,2007-05-25T17:00:00,neutral,0.01,"is plotting a McDonald's breakfast."
767,2007-05-25T17:00:00,neutral,0.01,"Had McDonald's breakfast, sleepy drive into work, now pondering another day of horrid lecture class."
768,2007-05-25T17:00:00,neutral,0.01,"Wesley Willis' ""Rock & Roll McDonald's"" stuck in my head."
769,2007-05-25T17:00:00,neutral,0.01,"The upstairs of the McDonald's in kentish town is a much used kid's play area. Not sure if that's good or bad."
770,2007-05-25T17:00:00,neutral,0.01,"I'm sipping on a hot (white) chocolate from D&D. It tastes like a McDonald's vanilla shake that's been heated up."
771,2007-05-25T17:00:00,neutral,0.01,"at work, irritated that my McDonald's diet coke was really a coke.  *sigh*  l:68127"
772,2007-05-25T17:00:00,neutral,0.01,"Coming back from McDonald's (yes I know, but I was starving) and watching Family Guy on Adult Swim."
773,2007-05-25T17:00:00,neutral,0.01,"I noticed McDonald's GlobalCasting thing and interested to see this hybrid marketing/UGC/mass reach thing to celebrate normal peeps"
774,2007-05-25T17:00:00,neutral,0.01,"Mcdonald's playland with john.  Wish they had these when I was a kid."
775,2007-05-25T17:00:00,neutral,0.01,"Still at McDonald's using their WiFi"
